CD_PIANO_GRUPPI,CD_GRUPPO_EP,CD_VOCE_EP,SEZIONE,DS_ASSOCIAZIONE,SEGNO,UTCR,UTUV,PG_VER_REC
"CE","A3","R35008","A","Entrate da rimborsi di imposte dirette","+","SYSTEM","SYSTEM","1"
"CE","A3","R35012","A","Restituzione di ratei di borse di studio","+","SYSTEM","SYSTEM","1"
"CE","A3","R35013","A","Entrate da rimborsi, recuperi e restituzioni di somme non dovute o incassate in eccesso da Famiglie","+","SYSTEM","SYSTEM","1"
"CE","A3","R35014","A","Entrate da rimborsi, recuperi e restituzioni di somme non dovute o incassate in eccesso da Imprese","+","SYSTEM","SYSTEM","1"
"CE","A3","R35015","A","Entrate da rimborsi, recuperi e restituzioni di somme non dovute o incassate in eccesso da ISP","+","SYSTEM","SYSTEM","1"
"CE","A3","R35017","A","Incassi per azioni di rivalsa nei confronti di terzi","+","SYSTEM","SYSTEM","1"
"CE","A3","R35018","A","Incassi per azioni di surroga nei confronti di terzi","+","SYSTEM","SYSTEM","1"
"CE","A3","R35019","A","Altre entrate correnti","+","SYSTEM","SYSTEM","1"
"CE","B10","R00074","D","Variazioni nelle rimanenze di prodotti in corso di lavorazione, semilavorati e finiti","+","SYSTEM","SYSTEM","1"
"CE","C15","R33001","A","Interessi attivi di mora da Amministrazioni Centrali","+","SYSTEM","SYSTEM","1"
"CE","C15","R33002","A","Interessi attivi di mora da Amministrazioni Locali","+","SYSTEM","SYSTEM","1"
"CE","C15","R33003","A","Interessi attivi di mora da Enti previdenziali","+","SYSTEM","SYSTEM","1"
"CE","C15","R33004","A","Interessi attivi di mora da altri soggetti","+","SYSTEM","SYSTEM","1"
"CE","C15","R33005","A","Interessi attivi da conti della tesoreria dello Stato o di altre amministrazioni pubbliche","+","SYSTEM","SYSTEM","1"
"CE","C15","R33006","A","Interessi attivi da depositi bancari o postali","+","SYSTEM","SYSTEM","1"
"CE","C15","R33007","A","Altri interessi attivi da Amministrazioni Centrali","+","SYSTEM","SYSTEM","1"
"CE","C15","R33008","A","Altri interessi attivi da Amministrazioni Locali","+","SYSTEM","SYSTEM","1"
"CE","C15","R33009","A","Altri interessi attivi da Enti previdenziali","+","SYSTEM","SYSTEM","1"
"CE","C15","R33010","A","Altri interessi attivi da altri soggetti","+","SYSTEM","SYSTEM","1"
"CE","D18","R00072","A","Insussistenze del passivo","+","SYSTEM","SYSTEM","1"
"CE","D18","R00073","A","Altre sopravvenienze attive","+","SYSTEM","SYSTEM","1"
"CE","D19","R44001","A","Plusvalenze da alienazione di  autovetture","+","SYSTEM","SYSTEM","1"
"CE","D19","R44002","A","Plusvalenze da alienazione di altri automezzi","+","SYSTEM","SYSTEM","1"
"CE","D19","R44003","A","Plusvalenze da alienazione di velivoli","+","SYSTEM","SYSTEM","1"
"CE","D19","R44004","A","Plusvalenza da alienazione di battelli e imbarcazioni","+","SYSTEM","SYSTEM","1"
"CE","D19","R44005","A","Plusvalenza da alienazione di altri mezzi di trasporto ","+","SYSTEM","SYSTEM","1"
"CE","D19","R44006","A","Plusvalenza da alienazione di mobili e arredi per ufficio","+","SYSTEM","SYSTEM","1"
"CE","D19","R44007","A","Plusvalenza da alienazione di Macchinari","+","SYSTEM","SYSTEM","1"
"CE","D19","R44008","A","Plusvalenza da alienazione di impianti","+","SYSTEM","SYSTEM","1"
"CE","D19","R44009","A","Plusvalenza da alienazione di attrezzature scientifiche","+","SYSTEM","SYSTEM","1"
"CE","D19","R44010","A","Plusvalenza da alienazione di attrezzature sanitarie","+","SYSTEM","SYSTEM","1"
"CE","D19","R44011","A","Plusvalenza da alienazione di attrezzature diverse","+","SYSTEM","SYSTEM","1"
"CE","D19","R44012","A","Plusvalenza da alienazione di Macchine per ufficio","+","SYSTEM","SYSTEM","1"
"CE","D19","R44013","A","Plusvalenza da Alienazione di server","+","SYSTEM","SYSTEM","1"
"CE","D19","R44014","A","Plusvalenza da Alienazione di postazioni di lavoro","+","SYSTEM","SYSTEM","1"
"CE","D19","R44015","A","Plusvalenza da Alienazione di periferiche","+","SYSTEM","SYSTEM","1"
"CE","D19","R44016","A","Plusvalenza da Alienazione di apparati di telecomunicazione","+","SYSTEM","SYSTEM","1"
"CE","D19","R44017","A","Plusvalenza da Alienazione di altro hardware","+","SYSTEM","SYSTEM","1"
"CE","D19","R44018","A","Plusvalenza da alienazione di Fabbricati ad abitativo","+","SYSTEM","SYSTEM","1"
"CE","D19","R44020","A","Plusvalenza da alienazione di Fabbricati industriali e costruzioni leggere","+","SYSTEM","SYSTEM","1"
"CE","D19","R44021","A","Plusvalenza da alienazione di Fabbricati rurali","+","SYSTEM","SYSTEM","1"
"CE","D19","R44022","A","Plusvalenza da alienazione di Fabbricati Ospedalieri e altre strutture sanitarie","+","SYSTEM","SYSTEM","1"
"CE","D19","R44023","A","Plusvalenza da alienazione di Infrastrutture telematiche","+","SYSTEM","SYSTEM","1"
"CE","D19","R44024","A","Plusvalenza da alienazione di altri beni immobili ","+","SYSTEM","SYSTEM","1"
"CE","D19","R44025","A","Plusvalenza da alienazione di Oggetti di valore","+","SYSTEM","SYSTEM","1"
"CE","D19","R44026","A","Plusvalenza da alienazione di diritti reali","+","SYSTEM","SYSTEM","1"
"CE","D19","R44027","A","Plusvalenza da alienazione di Materiale bibliografico","+","SYSTEM","SYSTEM","1"
"CE","D19","R44028","A","Plusvalenza da cessione di Terreni agricoli","+","SYSTEM","SYSTEM","1"
"CE","D19","R44029","A","Plusvalenza da cessione di Terreni edificabili","+","SYSTEM","SYSTEM","1"
"CE","D19","R44030","A","Plusvalenza da Alienazione di software","+","SYSTEM","SYSTEM","1"
"CE","D19","R44031","A","Plusvalenza da alienazione di Brevetti","+","SYSTEM","SYSTEM","1"
"CE","B8b","C00011","D","Ammortamento di attrezzature scientifiche","+","SYSTEM","SYSTEM","1"
"CE","B8b","C00012","D","Ammortamento di attrezzature sanitarie","+","SYSTEM","SYSTEM","1"
"CE","B8b","C00013","D","Ammortamento Macchine per ufficio","+","SYSTEM","SYSTEM","1"
"CE","B8b","C00014","D","Ammortamento di server","+","SYSTEM","SYSTEM","1"
"CE","B8b","C00015","D","Ammortamento postazioni di lavoro","+","SYSTEM","SYSTEM","1"
"SPATT","BII1","A21049","D","Crediti per Trasferimenti correnti da famiglie","+","SYSTEM","SYSTEM","1"
"SPATT","BII1","A21050","D","Crediti per Altri trasferimenti correnti da imprese controllate","+","SYSTEM","SYSTEM","1"
"SPATT","BII1","A21053","D","Crediti per Trasferimenti correnti da Istituzioni Sociali Private","+","SYSTEM","SYSTEM","1"
"SPATT","BII1","A21054","D","Crediti per finanziamenti della Comunit? Europea nell'ambito dei Programmi Quadro","+","SYSTEM","SYSTEM","1"
"SPATT","BII1","A21055","D","Crediti per finanziamenti della Comunit? Europea per il Programma ""Horizon 2020""","+","SYSTEM","SYSTEM","1"
"SPATT","BII1","A21058","D","Crediti per Trasferimenti correnti dal Resto del Mondo","+","SYSTEM","SYSTEM","1"
"SPATT","BII1","A21063","D","Crediti per contributo di funzionamento del MIUR - finanziamento dei progetti premiali","+","SYSTEM","SYSTEM","1"
"SPATT","BII1","A21064","D","Crediti per contributo di funzionamento del MIUR - altre assegnazioni straordinarie","+","SYSTEM","SYSTEM","1"
"SPATT","BII1","A00052","D","Fatture da emettere","+","SYSTEM","SYSTEM","1"
"SPATT","BII1","A00068","D","IVA a credito","+","SYSTEM","SYSTEM","1"
"SPATT","BII1","A00069","D","IVA acquisti in sospensione/differita","+","SYSTEM","SYSTEM","1"
"SPATT","C1","A00002","D","Ratei attivi","+","SYSTEM","SYSTEM","1"
"SPATT","C2","A00003","D","Risconti attivi","+","SYSTEM","SYSTEM","1"
"SPATT","D1","P00009","A","Risultato economico dell'esercizio","+","SYSTEM","SYSTEM","1"
"SPATT","D2","P00006","A","Avanzi (disavanzo) portati a nuovo","+","SYSTEM","SYSTEM","1"
"SPATT","F1","O.01.007","D","Assicurazioni contro rischi incendio","+","SYSTEM","SYSTEM","1"
"SPATT","F1","O.01.002","D","Fidejussioni concesse a terzi","+","SYSTEM","SYSTEM","1"
"SPATT","F1","O.01.006","D","Fidejussioni prestate da terzi","+","SYSTEM","SYSTEM","1"
"SPATT","F2","O.01.001","D","Beni di Terzi","+","SYSTEM","SYSTEM","1"
"SPATT","AIII1a","A31001B","D","Partecipazioni in imprese partecipate non incluse in Amministrazioni pubbliche","+","SYSTEM","SYSTEM","1"
"SPATT","AIII1a","A31003B","D","Partecipazioni in imprese controllate non incluse in Amministrazioni pubbliche","+","SYSTEM","SYSTEM","1"
"SPATT","AIII2a","A35017","D","Crediti da  azioni di rivalsa nei confronti di terzi","+","SYSTEM","SYSTEM","1"
"SPATT","AIII2b","A00066","D","Buoni fruttiferi postali","+","SYSTEM","SYSTEM","1"
"SPATT","AIII2b","A00065","D","Polizza INFM","+","SYSTEM","SYSTEM","1"
"SPATT","AII1","P00034","A","Fondi ammortamento di Fabbricati rurali","-","SYSTEM","SYSTEM","1"
"SPATT","AII1","A22019","D","Manutenzione straordinaria fabbricati istituzionali ","+","SYSTEM","SYSTEM","1"
"SPATT","AII1","A22022","D","Fabbricati rurali","+","SYSTEM","SYSTEM","1"
"SPATT","AII1","A22023","D","Manutenzione straordinaria fabbricati rurali","+","SYSTEM","SYSTEM","1"
"SPATT","AII1","A22026","D","Terreni edificabili","+","SYSTEM","SYSTEM","1"
"SPATT","AII1","A22032","D","Manutenzione straordinaria infrastrutture telematiche","+","SYSTEM","SYSTEM","1"
"SPATT","AII2","P00018","A","Fondo ammortamento mobili a uso esclusivo dei laboratori","-","SYSTEM","SYSTEM","1"
"SPATT","AII3","P00023","A","Fondo ammortamento macchine per ufficio","-","SYSTEM","SYSTEM","1"
"SPATT","AII3","P00024","A","Fondo ammortamento server","-","SYSTEM","SYSTEM","1"
"SPATT","AII3","P00026","A","Fondo ammortamento periferiche","-","SYSTEM","SYSTEM","1"
"SPATT","AII3","P00027","A","Fondo ammortamento apparati di telecomunicazione","-","SYSTEM","SYSTEM","1"
"SPATT","AII3","P00029","A","Fondo ammortamento  dispositivi di telefonia fissa","-","SYSTEM","SYSTEM","1"
"SPATT","AII3","P00030","A","Fondo ammortamento hardware n.a.c.","-","SYSTEM","SYSTEM","1"
"SPATT","AII3","A22012","D","Macchine per ufficio","+","SYSTEM","SYSTEM","1"
"SPATT","AII3","A22013","D","Server","+","SYSTEM","SYSTEM","1"
"SPATT","AII3","A22014","D","Postazioni di lavoro","+","SYSTEM","SYSTEM","1"
"SPATT","AII3","A22016","D","Apparati di telecomunicazione","+","SYSTEM","SYSTEM","1"
"SPATT","AII3","A22017","D","Hardware ","+","SYSTEM","SYSTEM","1"
"SPATT","AII3","A22029","D","Dispositivi di telefonia mobile e tablet","+","SYSTEM","SYSTEM","1"
"SPATT","AII3","A22030","D","Dispositivi di telefonia fissa","+","SYSTEM","SYSTEM","1"
"SPATT","AII4","A22024","D","Materiale bibliografico","+","SYSTEM","SYSTEM","1"
"SPATT","AII5","P00012","A","Fondo ammortamento autovetture","-","SYSTEM","SYSTEM","1"
"SPPAS","AI","P00004","A","Fondo di dotazione","+","SYSTEM","SYSTEM","1"
"SPPAS","AII","P00006","A","AVANZO ECONOMICO ESERCIZI PRECEDENTI","+","SYSTEM","SYSTEM","1"
"SPPAS","AIII","P00009","D","Risultato economico dell'esercizio","+","SYSTEM","SYSTEM","1"
"SPPAS","B1","P00010","A","Fondi per trattamento di quiescenza ","+","SYSTEM","SYSTEM","1"
"SPPAS","B2","P00040","A","Fondo svalutazione crediti","+","SYSTEM","SYSTEM","1"
"SPPAS","B3","P00011","A","Fondi per imposte","+","SYSTEM","SYSTEM","1"
"SPPAS","C","P00043","A","Fondo per trattamento fine rapporto","+","SYSTEM","SYSTEM","1"
"CE","B7d","C11007","D","Equo premio per attivit? inventiva","+","SYSTEM","SYSTEM","1"
"CE","B7a","C11008","D","Arretrati per anni precedenti corrisposti al personale a tempo determinato/Fonti interne","+","SYSTEM","SYSTEM","1"
"CE","B7a","C11009","D","Arretrati per anni precedenti corrisposti al personale a tempo determinato/fonti esterne","+","SYSTEM","SYSTEM","1"
"CE","B7a","C11010","D","Arretrati per anni precedenti corrisposti al personale a tempo determinato/Tipo Privatistico","+","SYSTEM","SYSTEM","1"
"CE","B7a","C11011","D","Stipendi ed assegni fissi per il personale a tempo determinato da fonti interne","+","SYSTEM","SYSTEM","1"
"CE","B7a","C11012","D","Stipendi ed assegni fissi per il personale a tempo determinato/Fonti esterne","+","SYSTEM","SYSTEM","1"
"CE","B7a","C11013","D","Stipendi ed assegni fissi per il personale assunto con contratto di tipo privatistico","+","SYSTEM","SYSTEM","1"
"CE","B7a","C11014","D","Retribuzioni degli operai agricoli a tempo determinato","+","SYSTEM","SYSTEM","1"
"CE","B7a","C11015","D","Straordinario per il personale a tempo determinato/Fonti interne","+","SYSTEM","SYSTEM","1"
"CE","D19","R44032","A","Plusvalenza da alienazione di Opere dell'ingegno e Diritti d'autore","+","SYSTEM","SYSTEM","1"
"CE","D19","R44033","A","Plusvalenza da alienazione di altri beni immateriali","+","SYSTEM","SYSTEM","1"
"CE","D19","R44034","A","Plusvalenza da alienazione di mobili e arredi per alloggi e pertinenze","+","SYSTEM","SYSTEM","1"
"CE","B5","C14025","D","Trasferimenti correnti a Istituzioni scolastiche ","+","SYSTEM","SYSTEM","1"
"CE","B5","C14024","D","Trasferimenti correnti a enti di regolazione dell'attivit? economica","+","SYSTEM","SYSTEM","1"
"CE","B13","C10012","D","Costi per indennizzi","+","SYSTEM","SYSTEM","1"
"CE","B13","C10013","D","Oneri da contenzioso","+","SYSTEM","SYSTEM","1"
"CE","B7a","C11001","D","Arretrati per anni precedenti corrisposti al personale a tempo indeterminato","+","SYSTEM","SYSTEM","1"
"CE","B7a","C11002","D","Stipendi ed assegni fissi per il personale a tempo indeterminato","+","SYSTEM","SYSTEM","1"
"CE","B7a","C11003","D","Straordinario per il personale a tempo indeterminato","+","SYSTEM","SYSTEM","1"
"CE","B4","C13017","D","Altri beni e materiali di consumo ","+","SYSTEM","SYSTEM","1"
"CE","B4","C13018","D","Fauna","+","SYSTEM","SYSTEM","1"
"CE","B4","C13019","D","Flora","+","SYSTEM","SYSTEM","1"
"CE","B4","C13020","D","Prodotti farmaceutici ed emoderivati","+","SYSTEM","SYSTEM","1"
"CE","B4","C13021","D","Sangue ed emocomponenti","+","SYSTEM","SYSTEM","1"
"CE","B4","C13022","D","Dispositivi medici","+","SYSTEM","SYSTEM","1"
"CE","B4","C13023","D","Prodotti dietetici","+","SYSTEM","SYSTEM","1"
"CE","B4","C13024","D","Prodotti chimici","+","SYSTEM","SYSTEM","1"
"CE","B4","C13025","D","Materali e prodotti per uso veterinario","+","SYSTEM","SYSTEM","1"
"CE","B4","C13026","D","Altri beni e prodotti sanitari n.a.c.","+","SYSTEM","SYSTEM","1"
"CE","B5","C13027","D","Organi istituzionali dell'amministrazione - Indennit?","+","SYSTEM","SYSTEM","1"
"CE","B5","C13028","D","Organi istituzionali dell'amministrazione - Rimborsi ","+","SYSTEM","SYSTEM","1"
"CE","B5","C13030","D","Missioni del personale dipendente","+","SYSTEM","SYSTEM","1"
"CE","B5","C13031","D","Missioni del personale non soggette ai limiti di spesa","+","SYSTEM","SYSTEM","1"
"CE","B5","C13032","D","Rimborso di oneri per trasferimento di personale (trasloco)","+","SYSTEM","SYSTEM","1"
"CE","B5","C13033","D","Spese di trasferta del personale associato","+","SYSTEM","SYSTEM","1"
"CE","B5","C13034","D","Professori visitatori","+","SYSTEM","SYSTEM","1"
"CE","B5","C13035","D","Mobilit? internazionale di ricercatori","+","SYSTEM","SYSTEM","1"
"SPPAS","G2","O.01.001","A","Beni di Terzi","+","SYSTEM","SYSTEM","1"
"CE","B5","C13037","D","Pubblicit?","+","SYSTEM","SYSTEM","1"
"CE","B5","C13038","D","Spese per l'organizzazione di convegni","+","SYSTEM","SYSTEM","1"
"CE","B5","C13039","D","Spese per la partecipazione a convegni","+","SYSTEM","SYSTEM","1"
"CE","B5","C13040","D","Mostre ed altre spese per relazioni pubbliche","+","SYSTEM","SYSTEM","1"
"CE","B5","C13041","D","Acquisto di servizi per formazione obbligatoria","+","SYSTEM","SYSTEM","1"
"CE","B7c","C00066","D","Altri accontonamenti n.a.c","+","SYSTEM","SYSTEM","1"
"CE","B5","C13042","D","Acquisto di servizi per la formazione generica e discrezionale","+","SYSTEM","SYSTEM","1"
"CE","B5","C13043","D","Telefonia fissa","+","SYSTEM","SYSTEM","1"
"CE","B5","C13044","D","Telefonia mobile","+","SYSTEM","SYSTEM","1"
"CE","B5","C13045","D","Accesso a banche dati e a pubblicazioni on line","+","SYSTEM","SYSTEM","1"
"CE","B5","C13046","D","Energia elettrica","+","SYSTEM","SYSTEM","1"
"CE","B5","C13047","D","Acqua","+","SYSTEM","SYSTEM","1"
"SPATT","BII1","A31001","D","Proventi dalla vendita di beni di consumo","+","SYSTEM","SYSTEM","1"
"SPATT","BII1","A31002","D","Proventi dalla vendita di medicinali e altri beni di consumo sanitario","+","SYSTEM","SYSTEM","1"
"SPATT","BII1","A31003","D","Proventi dalla vendita di flora e fauna","+","SYSTEM","SYSTEM","1"
"CE","B5","C13048","D","Gas","+","SYSTEM","SYSTEM","1"
"CE","B5","C13049","D","Spese di condominio ","+","SYSTEM","SYSTEM","1"
"CE","B5","C13050","D","Utenze e canoni per altri servizi ","+","SYSTEM","SYSTEM","1"
"CE","B6","C13051","D","Locazione di beni immobili","+","SYSTEM","SYSTEM","1"
"CE","B6","C13052","D","Noleggi di autovetture","+","SYSTEM","SYSTEM","1"
"SPATT","BII1","A31004","D","Proventi da energia, acqua, gas e riscaldamento","+","SYSTEM","SYSTEM","1"
"SPATT","BII1","A31005","D","Proventi derivanti dallo sfruttamento di brevetti","+","SYSTEM","SYSTEM","1"
"SPATT","BII1","A31006","D","Proventi dalla vendita di riviste e pubblicazioni","+","SYSTEM","SYSTEM","1"
"SPATT","BII1","A31007","D","Proventi dall'uso di locali adibiti a riunioni non istituzionali","+","SYSTEM","SYSTEM","1"
"SPATT","BII1","A31008","D","Proventi da servizi di accesso a banche dati e pubblicazioni on line","+","SYSTEM","SYSTEM","1"
"SPATT","BII1","A31009","D","Proventi da servizi per formazione e addestramento","+","SYSTEM","SYSTEM","1"
"SPATT","BII1","A31010","D","Proventi da servizi sanitari","+","SYSTEM","SYSTEM","1"
"SPATT","BII1","A31011","D","Proventi da licenze d'uso per software","+","SYSTEM","SYSTEM","1"
"SPATT","BII1","A31012","D","Proventi da consulenze","+","SYSTEM","SYSTEM","1"
"SPATT","BII1","A31013","D","Proventi da servizi informatici","+","SYSTEM","SYSTEM","1"
"SPATT","BII1","A31014","D","Proventi da servizi ispettivi e controllo","+","SYSTEM","SYSTEM","1"
"SPATT","BII1","A31016","D","Proventi da attivita' di monitoraggio e controllo ambientale","+","SYSTEM","SYSTEM","1"
"SPATT","BII1","A31017","D","Proventi da analisi e studi nel campo della ricerca","+","SYSTEM","SYSTEM","1"
"SPATT","BII1","A31018","D","Proventi dallo svolgimento di attivita' di certificazione","+","SYSTEM","SYSTEM","1"
"SPATT","BII1","A31019","D","Proventi per organizzazione convegni","+","SYSTEM","SYSTEM","1"
"CE","B4","C13016","D","Stampati specialistici","+","SYSTEM","SYSTEM","1"
"CE","B6","C13053","D","Noleggio della Nave ""Urania""","+","SYSTEM","SYSTEM","1"
"CE","B6","C13054","D","Noleggio di natanti ed imbarcazioni","+","SYSTEM","SYSTEM","1"
"CE","B6","C13055","D","Noleggio di velivoli","+","SYSTEM","SYSTEM","1"
"CE","B6","C13056","D","Noleggi di altri mezzi di trasporto stradali","+","SYSTEM","SYSTEM","1"
"CE","B6","C13057","D","Noleggi di attrezzature scientifiche e sanitarie","+","SYSTEM","SYSTEM","1"
"CE","B6","C13058","D","Noleggi di hardware","+","SYSTEM","SYSTEM","1"
"CE","B5","C13059","D","Fitti di terreni ","+","SYSTEM","SYSTEM","1"
"CE","B5","C13060","D","Licenze d'uso per software
","+","SYSTEM","SYSTEM","1"
"CE","B5","C13061","D","Altre licenze","+","SYSTEM","SYSTEM","1"
"CE","B6","C13062","D","Noleggi di impianti e macchinari","+","SYSTEM","SYSTEM","1"
"CE","B6","C13063","D","Leasing operativo di autovetture","+","SYSTEM","SYSTEM","1"
"CE","B6","C13064","D","Leasing operativo di altri mezzi di trasporto stradale","+","SYSTEM","SYSTEM","1"
"CE","B6","C13065","D","Leasing operativo relativo a natanti, imbarcazioni e velivoli","+","SYSTEM","SYSTEM","1"
"CE","B6","C13066","D","Leasing operativo di attrezzature e macchinari","+","SYSTEM","SYSTEM","1"
"SPATT","BII1","A31020","D","Altri proventi","+","SYSTEM","SYSTEM","1"
"SPATT","BII1","A31021","D","Diritti reali di godimento","+","SYSTEM","SYSTEM","1"
"SPATT","BII1","A31022","D","Fitti di terreni","+","SYSTEM","SYSTEM","1"
"SPATT","BII1","A31023","D","Canoni di locazione di immobili di proprieta'","+","SYSTEM","SYSTEM","1"
"SPATT","BII1","A33004","D","Interessi attivi di mora da altri soggetti","+","SYSTEM","SYSTEM","1"
"SPATT","BII1","A33005","D","Interessi attivi da conti della tesoreria dello Stato o di altre Amministrazioni pubbliche","+","SYSTEM","SYSTEM","1"
"SPATT","BII1","A33006","D","Interessi attivi da depositi bancari o postali","+","SYSTEM","SYSTEM","1"
"SPATT","BII1","A33010","D","Altri interessi attivi da altri soggetti","+","SYSTEM","SYSTEM","1"
"SPATT","BII1","A35002","D","Indennizzi assicurativi su beni mobili","+","SYSTEM","SYSTEM","1"
"CE","B5","C13068","D","Manutenzione ordinaria e riparazioni di autovetture","+","SYSTEM","SYSTEM","1"
"SPATT","BII1","A35003","D","Altri indennizzi assicurativi contro i danni","+","SYSTEM","SYSTEM","1"
"SPATT","BII1","A35004","D","Altri indennizzi assicurativi","+","SYSTEM","SYSTEM","1"
"SPATT","BII1","A35005","D","Rimborsi ricevuti per spese di personale (comando, distacco, fuori ruolo, convenzioni, ecc?) ","+","SYSTEM","SYSTEM","1"
"CE","C14","C17004","D","Interessi di mora a Enti previdenziali","+","SYSTEM","SYSTEM","1"
"SPATT","BII1","A35019","D","Altre entrate correnti","+","SYSTEM","SYSTEM","1"
"CE","AVA","P00009","A","Avanzo/Disavanzo d'esercizio","+","SYSTEM","SYSTEM","1"
"CE","A1","R21001","A","Contributo di funzionamento del MIUR","+","SYSTEM","SYSTEM","1"
"CE","A1","R21002","A","Finanziamenti MIUR in attuazione della nuova intesa di programma per il Mezzogiorno","+","SYSTEM","SYSTEM","1"
"CE","A1","R21003","A","Finanziamenti MIUR relativi ai Programmi Operativi Nazionali (PON)","+","SYSTEM","SYSTEM","1"
"CE","A1","R21004","A","Finanziamenti MIUR per l'attivit? di sviluppo delle aree depresse (CLUSTER)","+","SYSTEM","SYSTEM","1"
"CE","A1","R21005","A","Finanziamenti MIUR relativi al Fondo per gli Investimenti della Ricerca di Base (FIRB)","+","SYSTEM","SYSTEM","1"
"CE","A1","R21006","A","Finanziamenti MIUR relativi al Fondo Integrativo Speciale per la Ricerca (FISR)","+","SYSTEM","SYSTEM","1"
"CE","A1","R21007","A","Finanziamenti MIUR relativi al Fondo Agevolato per la Ricerca Industriale (FAR)","+","SYSTEM","SYSTEM","1"
"CE","A1","R21008","A","Finanziamenti MIUR relativi ai Programmi di ricerca di Rilevante Interesse Nazionale (PRIN)","+","SYSTEM","SYSTEM","1"
"CE","A1","R21009","A","Finanziamenti MIUR per i progetti strategici e di diffusione della cultura scientifica","+","SYSTEM","SYSTEM","1"
"CE","A1","R21010","A","Contributo MIUR per le spese complessive del Laboratorio di Luce di Sincrotrone di Grenoble","+","SYSTEM","SYSTEM","1"
"CE","A1","R21011","A","Finanziamenti MIUR per altre iniziative progettuali","+","SYSTEM","SYSTEM","1"
"CE","A1","R21012","A","Finanziamenti MEF ai sensi della legge 16 aprile 1987, n. 183 (Fondo di rotazione)","+","SYSTEM","SYSTEM","1"
"CE","A1","R21013","A","Finanziamenti MiSE relativi al progetto Industria 2015","+","SYSTEM","SYSTEM","1"
"CE","A1","R21014","A","Altri finanziamenti e contributi ministeriali","+","SYSTEM","SYSTEM","1"
"CE","A1","R21015","A","Finanziamenti da Presidenza del Consiglio dei Ministri","+","SYSTEM","SYSTEM","1"
"CE","A1","R21016","A","Finanziamenti da Organi Costituzionali e di rilievo costituzionale","+","SYSTEM","SYSTEM","1"
"CE","A1","R21017","A","Finanziamenti da Agenzie Fiscali","+","SYSTEM","SYSTEM","1"
"CE","A1","R21018","A","Finanziamenti da enti di regolazione dell'attivit? economica","+","SYSTEM","SYSTEM","1"
"CE","A1","R21019","A","Finanziamenti da Gruppo Equitalia","+","SYSTEM","SYSTEM","1"
"CE","A1","R21020","A","Finanziamenti da Anas S.p.A.","+","SYSTEM","SYSTEM","1"
"CE","A1","R21021","A","Finanziamenti da altri enti centrali","+","SYSTEM","SYSTEM","1"
"CE","A1","R21022","A","Finanziamenti da autorit? amministrative indipendenti","+","SYSTEM","SYSTEM","1"
"CE","A1","R21023","A","Finanziamenti da enti centrali produttori di servizi assistenziali, ricreativi e culturali","+","SYSTEM","SYSTEM","1"
"CE","A1","R21024","A","Finanziamenti da altri enti e istituzioni di ricerca","+","SYSTEM","SYSTEM","1"
"CE","A1","R21025","A","Finanziamenti delle Regioni relativi ai Programmi Operativi Regionali (POR)","+","SYSTEM","SYSTEM","1"
"CE","A1","R21047","A","Trasferimenti correnti da INAIL","+","SYSTEM","SYSTEM","1"
"CE","A1","R21048","A","Finanziamenti da altri Enti di Previdenza","+","SYSTEM","SYSTEM","1"
"CE","A1","R21049","A","Finanziamenti da soggetti privati","+","SYSTEM","SYSTEM","1"
"CE","A1","R21050","A","Finanziamenti da imprese controllate","+","SYSTEM","SYSTEM","1"
"CE","A1","R21051","A","Finanziamenti da imprese partecipate","+","SYSTEM","SYSTEM","1"
"CE","A1","R21052","A","Finanziamenti da altre imprese","+","SYSTEM","SYSTEM","1"
"CE","A1","R21053","A","Finanziamenti da Istituzioni Sociali Private (ONLUS, fondazioni, ONG)","+","SYSTEM","SYSTEM","1"
"CE","A1","R21054","A","Finanziamenti della Comunit? Europea nell'ambito dei Programmi Quadro","+","SYSTEM","SYSTEM","1"
"CE","A1","R21055","A","Finanziamenti della Comunit? Europea per il Programma ""Horizon 2020""","+","SYSTEM","SYSTEM","1"
"CE","D20","C19005","D","Costi per rimborsi di parte corrente a Famiglie di somme non dovute o incassate in eccesso","+","SYSTEM","SYSTEM","1"
"CE","D20","C19006","D","Costi per rimborsi di parte corrente a Imprese di somme non dovute o incassate in eccesso","+","SYSTEM","SYSTEM","1"
"CE","D21","C44001","D","Minusvalenze da alienazione di autovetture","+","SYSTEM","SYSTEM","1"
"CE","D21","C44002","D","Minusvalenze da alienazione di altri automezzi","+","SYSTEM","SYSTEM","1"
"CE","D21","C44003","D","Minusvalenze da alienazione di velivoli","+","SYSTEM","SYSTEM","1"
"CE","D21","C44004","D","Minusvalenze da alienazione di battelli ed imbarcazioni","+","SYSTEM","SYSTEM","1"
"CE","D21","C44005","D","Minusvalenza da alienazione di altri mezzi di trasporto ","+","SYSTEM","SYSTEM","1"
"CE","D21","C44006","D","Minusvalenza da alienazione di mobili e arredi per ufficio","+","SYSTEM","SYSTEM","1"
"CE","D21","C44007","D","Minusvalenza da alienazione di Macchinari","+","SYSTEM","SYSTEM","1"
"CE","D21","C44008","D","Minusvalenza da alienazione di impianti","+","SYSTEM","SYSTEM","1"
"CE","D21","C44009","D","Minusvalenza da alienazione di attrezzature scientifiche","+","SYSTEM","SYSTEM","1"
"CE","D21","C44010","D","Minusvalenza da alienazione di attrezzature sanitarie","+","SYSTEM","SYSTEM","1"
"CE","D21","C44011","D","Minusvalenza da alienazione di attrezzature diverse","+","SYSTEM","SYSTEM","1"
"SPPAS","D2","P14018","A","Debiti per Trasferimenti correnti a Paesi Intra-UE","+","SYSTEM","SYSTEM","1"
