CD_PIANO_GRUPPI,CD_GRUPPO_EP,CD_VOCE_EP,SEZIONE,DS_ASSOCIAZIONE,SEGNO,UTCR,UTUV,PG_VER_REC
"SPPAS","D2","P13039","A","Debiti verso fornitori -  Spese per la partecipazione a convegni","+","SYSTEM","SYSTEM","1"
"SPPAS","D2","P11002","A","Debiti per stipendi  e assegni fissi al personale a tempo indeterminato","+","SYSTEM","SYSTEM","1"
"SPPAS","D2","P11003","A","Debiti per straordinario da corrispondere al personale a tempo indeterminato","+","SYSTEM","SYSTEM","1"
"SPPAS","D2","P11007","A","Debiti per equo premio per attivit? inventiva","+","SYSTEM","SYSTEM","1"
"SPPAS","D2","P11008","A","Debiti per arretrati per anni precedenti corrisposti al personale a tempo determinato/fonti interne","+","SYSTEM","SYSTEM","1"
"SPPAS","D2","P11009","A","Debiti per arretrati per anni precedenti corrisposti al personale a tempo determinato/fonti esterne","+","SYSTEM","SYSTEM","1"
"SPPAS","D2","P11011","A","Debiti per stipendi e assegni fissi  al personale a tempo determinato/fonti interne","+","SYSTEM","SYSTEM","1"
"SPPAS","D2","P11012","A","Debiti per stipendi e assegni fissi al personale a tempo determinato/fonti esterne","+","SYSTEM","SYSTEM","1"
"SPPAS","D2","P11013","A","Debiti per stipendi ed assegni fissi per il personale assunto con contratto di tipo privatistico","+","SYSTEM","SYSTEM","1"
"SPPAS","D2","P11014","A","Debiti per retribuzioni degli operai agricoli a tempo determinato","+","SYSTEM","SYSTEM","1"
"SPPAS","D2","P11015","A","Debiti per straordinario per il personale a tempo determinato/Fonti interne","+","SYSTEM","SYSTEM","1"
"SPPAS","D2","P11016","A","Debiti per straordinario per il personale a tempo determinato/Fonti esterne","+","SYSTEM","SYSTEM","1"
"SPPAS","D2","P11023","A","Debiti per assegni di ricerca","+","SYSTEM","SYSTEM","1"
"SPPAS","D2","P11024","A","Debiti per benefici di natura assistenziale e sociale","+","SYSTEM","SYSTEM","1"
"SPPAS","D2","P11025","A","Debiti verso fornitori - buoni pasto","+","SYSTEM","SYSTEM","1"
"SPPAS","D2","P11026","A","Altri debiti verso il personale dipendente - Accantonamento per nuove assunzioni di personale t.d.","+","SYSTEM","SYSTEM","1"
"CE","B5","C13093","D","Stampa e rilegatura","+","SYSTEM","SYSTEM","1"
"CE","B5","C13094","D","Rimozione e smaltimento di rifiuti tossico-nocivi e di altri materiali","+","SYSTEM","SYSTEM","1"
"CE","B5","C13095","D","Mensa","+","SYSTEM","SYSTEM","1"
"CE","B5","C13096","D","Pubblicazione bandi di gara","+","SYSTEM","SYSTEM","1"
"CE","B5","C13097","D","Spese postali","+","SYSTEM","SYSTEM","1"
"CE","B5","C13098","D","Spese notarili","+","SYSTEM","SYSTEM","1"
"CE","B5","C13099","D","Oneri per fideiussione ","+","SYSTEM","SYSTEM","1"
"CE","B5","C13100","D","Spese per commissioni bancarie","+","SYSTEM","SYSTEM","1"
"CE","B6","C13067","D","Leasing operativo di altri beni","+","SYSTEM","SYSTEM","1"
"CE","B5","C13101","D","Spese per accertamenti sanitari, ivi comprese le spese per visite fiscali","+","SYSTEM","SYSTEM","1"
"CE","B5","C13102","D","Gestione e manutenzione applicazioni","+","SYSTEM","SYSTEM","1"
"CE","B5","C13104","D","Servizi di rete per trasmissione dati e VoIP e relativa manutenzione","+","SYSTEM","SYSTEM","1"
"CE","B5","C13105","D","Servizi di gestione documentale","+","SYSTEM","SYSTEM","1"
"SPPAS","D2","P72011","A","Debiti per Trasferimenti per conto terzi a autorit? amministrative indipendenti","+","SYSTEM","SYSTEM","1"
"SPPAS","D2","P72012","A","Debiti per Trasferimenti per conto terzi a enti centrali a struttura associativa","+","SYSTEM","SYSTEM","1"
"SPPAS","D2","P72015","A","Debiti per Trasferimenti per conto terzi a altre Amministrazioni Centrali n.a.c.","+","SYSTEM","SYSTEM","1"
"SPPAS","D2","P72016","A","Debiti per Trasferimenti per conto terzi a Regioni e province autonome","+","SYSTEM","SYSTEM","1"
"SPPAS","D2","P72017","A","Debiti per Trasferimenti per conto terzi a Province","+","SYSTEM","SYSTEM","1"
"SPPAS","D2","P72019","A","Debiti per Trasferimenti per conto terzi a Comuni","+","SYSTEM","SYSTEM","1"
"SPPAS","D2","P72019","A","Debiti per Trasferimenti per conto terzi a Citt? metropolitane e Roma capitale","+","SYSTEM","SYSTEM","1"
"SPPAS","D2","P72020","A","Debiti per Trasferimenti per conto terzi a Unioni di Comuni","+","SYSTEM","SYSTEM","1"
"SPPAS","D2","P72021","A","Debiti per Trasferimenti per conto terzi a Comunit? Montane","+","SYSTEM","SYSTEM","1"
"SPPAS","D2","P72022","A","Debiti per Trasferimenti per conto terzi a Camere di Commercio","+","SYSTEM","SYSTEM","1"
"SPPAS","D2","P72023","A","Debiti per Trasferimenti per conto terzi a Universit?","+","SYSTEM","SYSTEM","1"
"SPPAS","D2","P72025","A","Debiti per Trasferimenti per conto terzi a Autorit? Portuali","+","SYSTEM","SYSTEM","1"
"SPPAS","D2","P72026","A","Debiti per Trasferimenti per conto terzi a Aziende sanitarie locali ","+","SYSTEM","SYSTEM","1"
"SPPAS","D2","P72028","A","Debiti per Trasferimenti per conto terzi a policlinici","+","SYSTEM","SYSTEM","1"
"SPPAS","D2","P72031","A","Debiti per Trasferimenti per conto terzi a Agenzie regionali per le erogazioni in agricoltura","+","SYSTEM","SYSTEM","1"
"SPPAS","D2","P72032","A","Debiti per Trasferimenti per conto terzi a altri enti e agenzie regionali e sub regionali","+","SYSTEM","SYSTEM","1"
"SPPAS","D2","P72033","A","Debiti per Trasferimenti per conto terzi a Consorzi di enti locali","+","SYSTEM","SYSTEM","1"
"SPPAS","D2","P72035","A","Debiti per Trasferimenti per conto terzi a altre Amministrazioni Locali n.a.c.","+","SYSTEM","SYSTEM","1"
"SPPAS","D2","P72036","A","Debiti per Trasferimenti per conto terzi a INPS","+","SYSTEM","SYSTEM","1"
"SPPAS","D2","P72037","A","Debiti per Trasferimenti per conto terzi a INAIL","+","SYSTEM","SYSTEM","1"
"SPPAS","D2","P72038","A","Debiti per Trasferimenti per conto terzi a altri Enti di Previdenza n.a.c.","+","SYSTEM","SYSTEM","1"
"SPPAS","D2","P72039","A","Debiti per Trasferimenti per conto terzi a Famiglie","+","SYSTEM","SYSTEM","1"
"SPPAS","D2","P72040","A","Debiti per Trasferimenti per conto terzi a Imprese controllate","+","SYSTEM","SYSTEM","1"
"SPPAS","D2","P72041","A","Debiti per Trasferimenti per conto terzi a altre imprese partecipate","+","SYSTEM","SYSTEM","1"
"SPPAS","D2","P72042","A","Debiti per Trasferimenti per conto terzi a altre imprese","+","SYSTEM","SYSTEM","1"
"SPPAS","D2","P72043","A","Debiti per Trasferimenti per conto terzi a Istituzioni Sociali Private ","+","SYSTEM","SYSTEM","1"
"SPPAS","D2","P72044","A","Debiti per Trasferimenti per conto terzi all'Unione Europea e al Resto del Mondo","+","SYSTEM","SYSTEM","1"
"SPPAS","D2","P72045","A","Altri debiti derivanti dalla costituzione di depositi cauzionali o contrattuali presso terzi","+","SYSTEM","SYSTEM","1"
"SPPAS","D2","P72046","A","Altri debiti derivanti dalla restituzione di depositi cauzionali o contrattuali di terzi","+","SYSTEM","SYSTEM","1"
"SPPAS","D2","P72047","A","Debiti per Versamenti di imposte e tasse di natura corrente riscosse per conto di terzi","+","SYSTEM","SYSTEM","1"
"SPPAS","D2","P72048","A","Debiti per Versamenti di imposte in conto capitale riscosse per conto di terzi","+","SYSTEM","SYSTEM","1"
"SPPAS","D2","P72049","A","Altre uscite per conto terzi n.a.c.","+","SYSTEM","SYSTEM","1"
"SPPAS","D3","P19006","A","Debiti per rimborsi di parte corrente a Imprese di somme non dovute o incassate in eccesso","+","SYSTEM","SYSTEM","1"
"SPPAS","E1","P00048","A","Ratei di debito su costi del personale","+","SYSTEM","SYSTEM","1"
"SPPAS","E1","P00049","A","Ratei di debito su acquisti di servizi ed utilizzo di beni di terzi","+","SYSTEM","SYSTEM","1"
"SPPAS","E1","P00050","A","Ratei di debito su altri costi","+","SYSTEM","SYSTEM","1"
"SPPAS","E2","P00051","A","Altri risconti passivi","+","SYSTEM","SYSTEM","1"
"SPPAS","G1","O.01.101","A","Fidejussori per fidejussioni concesse a favore di terzi","+","SYSTEM","SYSTEM","1"
"SPPAS","G1","O.01.106","A","Assicurazioni contro rischi incendio","+","SYSTEM","SYSTEM","1"
"SPPAS","G1","O.01.105","A","Fidejussioni da terzi","+","SYSTEM","SYSTEM","1"
"SPPAS","G2","O.01.107","A","Altri conti d'ordine","+","SYSTEM","SYSTEM","1"
"SPATT","AII1","A22027","D","Manutenzione straordinaria  immobili in locazione, in comodato o in uso","+","SYSTEM","SYSTEM","1"
"SPATT","AII1","A22028","D","Ripristino e adattamento immobili in locazione, in comodato o in uso","+","SYSTEM","SYSTEM","1"
"SPPAS","D2","P43001","A","Altri debiti","+","SYSTEM","SYSTEM","1"
"CE","A1","R21065","A","Trasferimenti correnti da Ministero dell'Istruzione - Istituzioni Scolastiche","+","SYSTEM","SYSTEM","1"
"CE","B5","C13118","D","Indennita' di missione e trasferta del personale dipendente","+","SYSTEM","SYSTEM","1"
"CE","B5","C13116","D","Patrocinio legale","+","SYSTEM","SYSTEM","1"
"CE","B5","C13121","D","Tirocini formativi extracurriculari","+","SYSTEM","SYSTEM","1"
"CE","B5","C13117","D","Servizi per i sistemi informativi e per telecomunicazione","+","SYSTEM","SYSTEM","1"
"CE","B5","C13119","D","Servizi di sicurezza dei sistemi informativi e per telecomunicazione","+","SYSTEM","SYSTEM","1"
"CE","B5","C13122","D","Altri servizi informatici e di telecomunicazioni ","+","SYSTEM","SYSTEM","1"
"CE","B5","C13123","D","Spese connesse con la comunicazione WEB","+","SYSTEM","SYSTEM","1"
"CE","B7a","C11046","D","Ulteriore quota di retribuzione accessoria per il personale a tempo determinato su fonti esterne","+","SYSTEM","SYSTEM","1"
"CE","B7b","C11047","D","Contributi previdenza complementare ","+","SYSTEM","SYSTEM","1"
"CE","B7d","C11042","D","Accantonamento per rinnovo contrattuale del personale a tempo determinato/fonti esterne","+","SYSTEM","SYSTEM","1"
"SPATT","BII1","A33001","D","Crediti derivanti da interessi attivi di mora da Amministrazioni Centrali","+","SYSTEM","SYSTEM","1"
"SPATT","BII1","A33002","D","Crediti derivanti da interessi attivi di mora da Amministrazioni Locali","+","SYSTEM","SYSTEM","1"
"SPATT","BII1","A33003","D","Crediti derivanti da interessi attivi di mora da Enti previdenziali","+","SYSTEM","SYSTEM","1"
"SPATT","BII1","A33007","D","Crediti derivanti da altri interessi attivi da Amministrazioni Centrali","+","SYSTEM","SYSTEM","1"
"SPATT","BII1","A33008","D","Crediti derivanti da altri interessi attivi da Amministrazioni Locali","+","SYSTEM","SYSTEM","1"
"SPATT","BII1","A33009","D","Crediti derivanti da altri interessi attivi da Enti previdenziali","+","SYSTEM","SYSTEM","1"
"SPATT","BII1","A35018","D","Crediti da  azioni di surroga nei confronti di terzi","+","SYSTEM","SYSTEM","1"
"SPATT","BII1","A44003","D","Crediti da Alienazione di Mezzi di trasporto aerei","+","SYSTEM","SYSTEM","1"
"SPATT","BII1","A44006","D","Crediti da Alienazione di mobili e arredi per ufficio","+","SYSTEM","SYSTEM","1"
"SPATT","BII1","A44008","D","Crediti da Alienazione di impianti","+","SYSTEM","SYSTEM","1"
"SPATT","BII1","A44010","D","Crediti da Attrezzature sanitarie","+","SYSTEM","SYSTEM","1"
"SPATT","BII1","A44011","D","Crediti da Alienazione di Attrezzature ","+","SYSTEM","SYSTEM","1"
"SPATT","BII1","A44012","D","Crediti da Alienazione di macchine per ufficio","+","SYSTEM","SYSTEM","1"
"SPATT","BII1","A44013","D","Crediti da Alienazione di server","+","SYSTEM","SYSTEM","1"
"SPATT","BII1","A44014","D","Crediti da Alienazione di postazioni di lavoro","+","SYSTEM","SYSTEM","1"
"SPATT","BII1","A44015","D","Crediti da Alienazione di periferiche","+","SYSTEM","SYSTEM","1"
"SPATT","BII1","A44016","D","Crediti da Alienazione di apparati di telecomunicazione","+","SYSTEM","SYSTEM","1"
"SPATT","BII1","A44017","D","Crediti da Alienazione di hardware ","+","SYSTEM","SYSTEM","1"
"SPATT","BII1","A44019","D","Crediti da Alienazione di Fabbricati strumentali","+","SYSTEM","SYSTEM","1"
"SPATT","BII1","A44020","D","Crediti da Alienazione di Fabbricati industriali e costruzioni leggere","+","SYSTEM","SYSTEM","1"
"SPATT","BII1","A44021","D","Crediti da Alienazione di Fabbricati rurali","+","SYSTEM","SYSTEM","1"
"SPATT","BII1","A44023","D","Crediti da Alienazione di Infrastrutture telematiche","+","SYSTEM","SYSTEM","1"
"SPATT","BII1","A44024","D","Crediti da Alienazione di altri beni immobili","+","SYSTEM","SYSTEM","1"
"SPATT","BII1","A44026","D","Crediti da Alienazione di diritti reali","+","SYSTEM","SYSTEM","1"
"SPATT","BII1","A44027","D","Crediti da Alienazione di Materiale bibliografico","+","SYSTEM","SYSTEM","1"
"SPATT","BII1","A44028","D","Crediti da Cessione di Terreni agricoli","+","SYSTEM","SYSTEM","1"
"SPATT","BII1","A44029","D","Crediti da Cessione di Terreni edificabili","+","SYSTEM","SYSTEM","1"
"SPATT","BII1","A44030","D","Crediti da Alienazione di software","+","SYSTEM","SYSTEM","1"
"SPATT","BII1","A44032","D","Crediti da Alienazione di Opere dell'ingegno e Diritti d'autore","+","SYSTEM","SYSTEM","1"
"SPATT","BII1","A44033","D","Crediti da Alienazione di altri beni immateriali ","+","SYSTEM","SYSTEM","1"
"SPATT","BII1","A44034","D","Crediti da Alienazione di mobili e arredi per alloggi e pertinenze","+","SYSTEM","SYSTEM","1"
"SPATT","BII1","A44035","D","Crediti da Alienazione di mobili e arredi per uso laboratorio","+","SYSTEM","SYSTEM","1"
"SPATT","BII1","A51001","D","Crediti da Alienazione di partecipazioni in imprese controllate","+","SYSTEM","SYSTEM","1"
"SPATT","BII1","A51002","D","Crediti da Alienazione di partecipazioni in altre imprese partecipate","+","SYSTEM","SYSTEM","1"
"SPATT","BII1","A51003","D","Crediti da Alienazione di partecipazioni in altre imprese","+","SYSTEM","SYSTEM","1"
"SPATT","BII1","A91001","D","Crediti diversi derivanti da ritenuta del 4% sui contributi pubblici","+","SYSTEM","SYSTEM","1"
"SPATT","BII1","A91005","D","Crediti diversi derivanti da altre ritenute al personale dipendente per conto di terzi","+","SYSTEM","SYSTEM","1"
"SPATT","BII1","A91006","D","Crediti diversi derivanti da ritenute erariali su redditi da lavoro autonomo per conto terzi","+","SYSTEM","SYSTEM","1"
"SPATT","BII1","A91009","D","Crediti diversi derivanti da entrate a seguito di spese non andate a buon fine","+","SYSTEM","SYSTEM","1"
"SPPAS","D2","P13098","A","Debiti per spese notarili","+","SYSTEM","SYSTEM","1"
"SPPAS","D2","P13099","A","Debiti relativi ad oneri per fideiussioni","+","SYSTEM","SYSTEM","1"
"SPPAS","D2","P13100","A","Debiti per commissioni bancarie","+","SYSTEM","SYSTEM","1"
"SPPAS","D2","P13101","A","Debiti verso fornitori - spese per accertamenti sanitari, ivi comprese le spese per visite fiscali","+","SYSTEM","SYSTEM","1"
"SPPAS","D2","P13102","A","Debiti verso fornitori - Gestione e manutenzione applicazioni","+","SYSTEM","SYSTEM","1"
"SPPAS","D2","P13104","A","Debiti verso fornitori - Servizi di rete per trasmissione dati e VoIP e relativa manutenzione","+","SYSTEM","SYSTEM","1"
"SPPAS","D2","P13105","A","Debiti verso fornitori - servizi di gestione documentale ","+","SYSTEM","SYSTEM","1"
"SPPAS","D2","P13106","A","Debiti verso fornitori - servizi di consulenza e prestazioni professionali ICT","+","SYSTEM","SYSTEM","1"
"SPPAS","D2","P13107","A","Debiti verso creditori diversi per spese legali","+","SYSTEM","SYSTEM","1"
"SPPAS","D2","P13108","A","Debiti per quote di iscrizione ad associazioni","+","SYSTEM","SYSTEM","1"
"SPPAS","D2","P13109","A","Debiti per spese per componenti commissioni concorso e selezione del personale","+","SYSTEM","SYSTEM","1"
"SPPAS","D2","P13110","A","Debiti verso creditori diversi per spese di funzionamento dei Panel di Valutazione","+","SYSTEM","SYSTEM","1"
"SPPAS","D2","P13111","A","Debiti verso creditori diversi per spese di funzionamento delle commissioni di gara","+","SYSTEM","SYSTEM","1"
"SPPAS","D2","P13112","A","Debiti verso creditori diversi per giardinaggio","+","SYSTEM","SYSTEM","1"
"SPPAS","D2","P13113","A","Debiti per spese di organizzazione di corsi di formazione","+","SYSTEM","SYSTEM","1"
"SPPAS","D2","P13114","A","Debiti verso creditori diversi - servizi di attivit? di rappresentanza","+","SYSTEM","SYSTEM","1"
"SPPAS","D2","P13115","A","Debiti verso fornitori - Altri servizi non altrimenti classificabili","+","SYSTEM","SYSTEM","1"
"SPPAS","D2","P13120","A","Debiti verso fornitori - Noleggio di altri beni mobili","+","SYSTEM","SYSTEM","1"
"SPPAS","D2","P14003","A","Debiti per Trasferimenti correnti a Regioni e province autonome","+","SYSTEM","SYSTEM","1"
"SPPAS","D2","P14004","A","Debiti per Trasferimenti correnti a Universit?","+","SYSTEM","SYSTEM","1"
"SPPAS","D2","P14005","A","Debiti per Trasferimenti correnti a Universit? - Finanziamento dei dottorati di ricerca","+","SYSTEM","SYSTEM","1"
"SPPAS","D2","P14006","A","Debiti per Trasferimenti correnti a Aziende sanitarie locali  ","+","SYSTEM","SYSTEM","1"
"SPPAS","D2","P14008","A","Debiti per Trasferimenti correnti a policlinici ","+","SYSTEM","SYSTEM","1"
"SPPAS","D2","P14009","A","Debiti per Trasferimenti correnti a Istituti di ricovero e cura a carattere scientifico pubblici","+","SYSTEM","SYSTEM","1"
"SPPAS","D2","P14010","A","Debiti per Trasferimenti correnti a altri enti e agenzie regionali e sub regionali","+","SYSTEM","SYSTEM","1"
"SPPAS","D2","P14011","A","Debiti per borse di studio","+","SYSTEM","SYSTEM","1"
"SPPAS","D2","P14012","A","Debiti per borse di formazione, stages e tirocini formativi","+","SYSTEM","SYSTEM","1"
"SPPAS","D2","P14013","A","Debiti verso famiglie dovuti a titolo di trasferimenti ","+","SYSTEM","SYSTEM","1"
"SPPAS","D2","P14014","A","Debiti per Trasferimenti correnti a imprese controllate","+","SYSTEM","SYSTEM","1"
"SPPAS","D2","P14015","A","Debiti per Trasferimenti correnti a altre imprese partecipate","+","SYSTEM","SYSTEM","1"
"SPPAS","D2","P14016","A","Debiti per Trasferimenti correnti a altre imprese","+","SYSTEM","SYSTEM","1"
"SPPAS","D2","P14017","A","Debiti per Trasferimenti correnti a Istituzioni Sociali Private ","+","SYSTEM","SYSTEM","1"
"SPPAS","D2","P14014","A","Debiti per Trasferimenti correnti a imprese controllate","+","SYSTEM","SYSTEM","1"
"SPPAS","D2","P14015","A","Debiti per Trasferimenti correnti a altre imprese partecipate","+","SYSTEM","SYSTEM","1"
"SPPAS","D2","P14016","A","Debiti per Trasferimenti correnti a altre imprese","+","SYSTEM","SYSTEM","1"
"SPPAS","D2","P14017","A","Debiti per Trasferimenti correnti a Istituzioni Sociali Private ","+","SYSTEM","SYSTEM","1"
"SPPAS","D2","P14018","A","Debiti per Trasferimenti correnti a Paesi Intra-UE","+","SYSTEM","SYSTEM","1"
"SPPAS","D2","P14019","A","Debiti per Trasferimenti correnti a Paesi Extra-UE","+","SYSTEM","SYSTEM","1"
"SPPAS","D2","P14020","A","Debiti per Trasferimenti correnti a Organi Costituzionali e di rilievo costituzionale","+","SYSTEM","SYSTEM","1"
"SPPAS","D2","P14021","A","Debiti per Trasferimenti correnti a INAIL","+","SYSTEM","SYSTEM","1"
"SPPAS","D2","P17002","A","Debiti per interessi di mora pagati a Amministrazioni Centrali","+","SYSTEM","SYSTEM","1"
"SPPAS","D2","P17003","A","Debiti per interessi di mora pagati a Amministrazioni Locali","+","SYSTEM","SYSTEM","1"
"SPPAS","D2","P17004","A","Debiti per interessi di mora pagati a Enti previdenziali","+","SYSTEM","SYSTEM","1"
"SPPAS","D2","P22019","A","Debiti verso fornitori per manutenzione straordinaria fabbricati istituzionali/strumentali","+","SYSTEM","SYSTEM","1"
"SPPAS","D2","P13116","A","Debiti per patrocinio legale da parte di collaboratori","+","SYSTEM","SYSTEM","1"
"SPPAS","D2","P13117","A","Debiti verso fornitori - servizi per sistemi informativi e telecomunicazione","+","SYSTEM","SYSTEM","1"
"SPPAS","D2","P13119","A","Debiti verso fornitori - servizi di sicurezza dei sistemi informativi e telecomunicazione","+","SYSTEM","SYSTEM","1"
"SPPAS","D2","P13121","A","Debiti per tirocini formativi extracurriculari","+","SYSTEM","SYSTEM","1"
"SPPAS","D2","P13122","A","Debiti verso fornitori - altri servizi informatici e di telecomunicazione ","+","SYSTEM","SYSTEM","1"
"SPPAS","D2","P13123","A","Debiti verso fornitori  - Comunicazione WEB","+","SYSTEM","SYSTEM","1"
"SPPAS","D2","P14023","A","Debiti verso famiglie - mobilit? internazionale di ricercatori","+","SYSTEM","SYSTEM","1"
"SPPAS","D2","P14024","A","Debiti per trasferimenti correnti a Enti di regolazione dell'attivit? economica ","+","SYSTEM","SYSTEM","1"
"SPPAS","D2","P14025","A","Debiti per trasferimenti correnti al Ministero dell'Istruzione - Istituzioni scolastiche","+","SYSTEM","SYSTEM","1"
"SPPAS","D2","P14026","A","Debiti per tirocini formativi curriculari","+","SYSTEM","SYSTEM","1"
"SPPAS","D2","P22031","A","Debiti verso fornitori per acquisizione e realizzazione di infrastrutture telematiche","+","SYSTEM","SYSTEM","1"
"SPPAS","D2","P22032","A","Debiti verso fornitori per manutenzione straordinaria di infrastrutture telematiche","+","SYSTEM","SYSTEM","1"
"CE","A1","R21026","A","Altri finanziamenti da Regioni e province autonome","+","SYSTEM","SYSTEM","1"
"CE","A1","R21056","A","Altri finanziamenti della Comunit? Europea","+","SYSTEM","SYSTEM","1"
"CE","A1","R21057","A","Finanziamenti di altri soggetti, pubblici e privati, di Paesi aderenti alla Comunit? Europea","+","SYSTEM","SYSTEM","1"
"CE","A1","R21027","A","Finanziamenti da Province","+","SYSTEM","SYSTEM","1"
"CE","A1","R21028","A","Finanziamenti da Comuni","+","SYSTEM","SYSTEM","1"
"CE","A1","R21060","A","Contributo di funzionamento del MIUR - finanziamenti delle progettualit? di carattere straordinario","+","SYSTEM","SYSTEM","1"
"CE","A1","R21061","A","Contributo di funzionamento del MIUR - finanziamento dei progetti bandiera e di interesse","+","SYSTEM","SYSTEM","1"
"CE","A1","R21062","A","Contributo di funzionamento del MIUR - finanziamento delle attivit? a valenza internazionale","+","SYSTEM","SYSTEM","1"
"CE","A1","R21063","A","Contributo di funzionamento del MIUR - finanziamento dei progetti premiali","+","SYSTEM","SYSTEM","1"
"CE","A1","R21064","A","Contributo di funzionamento del MIUR - altre assegnazioni straordinarie","+","SYSTEM","SYSTEM","1"
"CE","A1","R21029","A","Finanziamenti da Citt? metropolitane e Roma capitale","+","SYSTEM","SYSTEM","1"
"CE","A1","R21030","A","Finanziamenti da Unioni di Comuni","+","SYSTEM","SYSTEM","1"
"CE","A1","R21031","A","Finanziamenti da Comunit? Montane","+","SYSTEM","SYSTEM","1"
"CE","A1","R21032","A","Finanziamenti da Camere di Commercio","+","SYSTEM","SYSTEM","1"
"CE","A1","R21033","A","Finanziamenti da Universit?","+","SYSTEM","SYSTEM","1"
"CE","A1","R21035","A","Finanziamenti da Autorit? Portuali","+","SYSTEM","SYSTEM","1"
"CE","A1","R21036","A","Finanziamenti da Aziende sanitarie locali ","+","SYSTEM","SYSTEM","1"
"CE","A1","R21037","A","Finanziamenti da Aziende ospedaliere e Aziende ospedaliere universitarie integrate con il SSN","+","SYSTEM","SYSTEM","1"
"CE","A1","R21038","A","Finanziamenti da Policlinici","+","SYSTEM","SYSTEM","1"
"CE","A1","R21039","A","Finanziamenti da Istituti di ricovero e cura a carattere scientifico pubblici","+","SYSTEM","SYSTEM","1"
"CE","A1","R21040","A","Finanziamenti da altre Amministrazioni Locali produttrici di servizi sanitari","+","SYSTEM","SYSTEM","1"
"CE","A1","R21041","A","Finanziamenti da Agenzie regionali per le erogazioni in agricoltura","+","SYSTEM","SYSTEM","1"
"CE","A1","R21042","A","Finanziamenti da altri enti e agenzie regionali e sub regionali","+","SYSTEM","SYSTEM","1"
"CE","A1","R21043","A","Finanziamenti da Consorzi di enti locali","+","SYSTEM","SYSTEM","1"
"CE","A1","R21044","A","Finanziamenti da Istituzioni liriche locali e da teatri stabili di iniziativa pubblica","+","SYSTEM","SYSTEM","1"
"CE","A1","R21045","A","Finanziamenti da altre Amministrazioni Locali","+","SYSTEM","SYSTEM","1"
"CE","A1","R21046","A","Finanziamenti da INPS","+","SYSTEM","SYSTEM","1"
"CE","A2","R31001","A","Proventi dalla vendita di beni di consumo","+","SYSTEM","SYSTEM","1"
"CE","A2","R31002","A","Proventi dalla vendita di medicinali e altri beni di consumo sanitario","+","SYSTEM","SYSTEM","1"
"CE","A2","R31003","A","Proventi dalla vendita di flora e fauna","+","SYSTEM","SYSTEM","1"
"CE","A2","R31004","A","Proventi da energia, acqua, gas e riscaldamento","+","SYSTEM","SYSTEM","1"
"CE","A2","R31005","A","Ricavi dallo sfruttamento di brevetti","+","SYSTEM","SYSTEM","1"
"CE","A2","R31006","A","Ricavi dalla vendita di riviste e pubblicazioni","+","SYSTEM","SYSTEM","1"
"CE","A2","R31007","A","Proventi dall'uso di locali adibiti a riunioni non istituzionali","+","SYSTEM","SYSTEM","1"
"CE","A2","R31008","A","Proventi da servizi di accesso a banche dati e pubblicazioni on line","+","SYSTEM","SYSTEM","1"
"CE","A2","R31009","A","Proventi da servizi per formazione e addestramento","+","SYSTEM","SYSTEM","1"
"CE","A2","R31010","A","Proventi da servizi sanitari","+","SYSTEM","SYSTEM","1"
"CE","A2","R31011","A","Proventi da licenze d'uso per software","+","SYSTEM","SYSTEM","1"
"CE","A2","R31012","A","Proventi da consulenze","+","SYSTEM","SYSTEM","1"
"CE","A2","R31013","A","Proventi da servizi informatici","+","SYSTEM","SYSTEM","1"
"CE","A2","R31014","A","Proventi da servizi ispettivi e controllo","+","SYSTEM","SYSTEM","1"
"CE","A2","R31015","A","Proventi da servizi di arbitrato e collaudi","+","SYSTEM","SYSTEM","1"
"CE","A2","R31016","A","Proventi da attivit? di monitoraggio e controllo ambientale","+","SYSTEM","SYSTEM","1"
"CE","A2","R31017","A","Proventi da analisi e studi nel campo della ricerca","+","SYSTEM","SYSTEM","1"
"CE","A2","R31018","A","Proventi dallo svolgimento di attivit? di certificazione","+","SYSTEM","SYSTEM","1"
"CE","A2","R31019","A","Proventi per organizzazione convegni","+","SYSTEM","SYSTEM","1"
"CE","A2","R31020","A","Altri proventi","+","SYSTEM","SYSTEM","1"
"CE","A2","R31021","A","Diritti reali di godimento","+","SYSTEM","SYSTEM","1"
"CE","A2","R31022","A","Fitti di terreni","+","SYSTEM","SYSTEM","1"
"CE","A2","R31023","A","Noleggi e locazioni di altri beni immobili","+","SYSTEM","SYSTEM","1"
"CE","A2","R31024","A","Locazioni di beni mobili","+","SYSTEM","SYSTEM","1"
"CE","A3","R35001","A","Indennizzi assicurativi su beni immobili","+","SYSTEM","SYSTEM","1"
"CE","A3","R35002","A","Indennizzi di assicurazione su beni mobili","+","SYSTEM","SYSTEM","1"
"CE","A3","R35003","A","Altri indennizzi di assicurazione contro i danni","+","SYSTEM","SYSTEM","1"
