CD_PIANO_GRUPPI,CD_GRUPPO_EP,CD_VOCE_EP,SEZIONE,DS_ASSOCIAZIONE,SEGNO,UTCR,UTUV,PG_VER_REC
"CE","B6","C13120","D","Altri costi sostenuti per utilizzo di beni di terzi n.a.c.","+","SYSTEM","SYSTEM","1"
"CE","B5","C14003","D","Trasferimenti correnti a Regioni e province autonome","+","SYSTEM","SYSTEM","1"
"CE","B5","C14004","D","Trasferimenti correnti a Universit?","+","SYSTEM","SYSTEM","1"
"CE","B5","C14005","D","Finanziamento dei dottorati di ricerca","+","SYSTEM","SYSTEM","1"
"CE","B5","C14006","D","Trasferimenti correnti a Aziende sanitarie regionali e locali","+","SYSTEM","SYSTEM","1"
"CE","B5","C14008","D","Trasferimenti correnti a policlinici ","+","SYSTEM","SYSTEM","1"
"SPATT","BII1","A44031","D","Alienazione di brevetti","+","SYSTEM","SYSTEM","1"
"SPATT","BII1","A63001","D","Accensione mutui ","+","SYSTEM","SYSTEM","1"
"SPATT","BII1","A91002","D","Altre ritenute n.a.c.","+","SYSTEM","SYSTEM","1"
"CE","B5","C14009","D","Trasferimenti correnti a Istituti di ricovero e cura a carattere scientifico pubblici","+","SYSTEM","SYSTEM","1"
"CE","B5","C14010","D","Trasferimenti correnti a altri enti e agenzie regionali e sub regionali","+","SYSTEM","SYSTEM","1"
"SPATT","BII1","A91003","D","Ritenute erariali su redditi da lavoro dipendente per conto terzi","+","SYSTEM","SYSTEM","1"
"SPATT","BII1","A91004","D","Ritenute previdenziali e assistenziali su redditi da lavoro dipendente per conto terzi","+","SYSTEM","SYSTEM","1"
"SPATT","BII1","A91010","D","Rimborso di fondi economali e carte aziendali","+","SYSTEM","SYSTEM","1"
"SPATT","BII1","A91011","D","Altre entrate per partite di giro diverse","+","SYSTEM","SYSTEM","1"
"CE","B5","C14011","D","Borse di studio","+","SYSTEM","SYSTEM","1"
"CE","B5","C14012","D","Borse di formazione, stages e tirocini formativi","+","SYSTEM","SYSTEM","1"
"CE","B5","C14013","D","Trasferimenti correnti a famiglie","+","SYSTEM","SYSTEM","1"
"CE","B5","C14014","D","Trasferimenti correnti a imprese controllate","+","SYSTEM","SYSTEM","1"
"CE","B5","C14015","D","Trasferimenti correnti a altre imprese partecipate","+","SYSTEM","SYSTEM","1"
"CE","B5","C14016","D","Trasferimenti correnti a altre Imprese","+","SYSTEM","SYSTEM","1"
"CE","B5","C14017","D","Trasferimenti correnti a Istituzioni Sociali Private ","+","SYSTEM","SYSTEM","1"
"CE","B5","C14018","D","Trasferimenti correnti a Paesi Intra-UE","+","SYSTEM","SYSTEM","1"
"CE","B5","C14019","D","Trasferimenti correnti a Paesi Extra-UE","+","SYSTEM","SYSTEM","1"
"CE","B5","C14020","D","Trasferimenti correnti a Organi Costituzionali e di rilievo costituzionale","+","SYSTEM","SYSTEM","1"
"CE","B5","C14021","D","Trasferimenti correnti a INAIL","+","SYSTEM","SYSTEM","1"
"CE","C14","C17001","D","Interessi passivi su mutui, prestiti, anticipazioni di cassa ed oneri accessori","+","SYSTEM","SYSTEM","1"
"CE","C14","C17002","D","Interessi di mora a Amministrazioni Centrali","+","SYSTEM","SYSTEM","1"
"CE","C14","C17003","D","Interessi di mora a Amministrazioni Locali","+","SYSTEM","SYSTEM","1"
"CE","D19","R44035","A","Plusvalenza da alienazione di mobili e arredi auso esclusivo dei laboratori","+","SYSTEM","SYSTEM","1"
"CE","D19","R51001","A","Plusvalenze da Alienazione di partecipazioni in imprese controllate","+","SYSTEM","SYSTEM","1"
"CE","D19","R51002","A","Plusvalenze da Alienazione di partecipazioni in altre imprese partecipate","+","SYSTEM","SYSTEM","1"
"CE","D19","R51003","A","Plusvalenze da Alienazione di partecipazioni in altre imprese","+","SYSTEM","SYSTEM","1"
"CE","B13","C00001","D","Costo per IVA indetraibile","+","SYSTEM","SYSTEM","1"
"CE","B8d","C00002","D","Ammortamento autovetture","+","SYSTEM","SYSTEM","1"
"CE","B8d","C00003","D","Ammortamento altri mezzi di trasporto","+","SYSTEM","SYSTEM","1"
"CE","B8e","C00004","D","Ammortamento Mezzi di trasporto aerei","+","SYSTEM","SYSTEM","1"
"CE","B8e","C00005","D","Ammortamento Mezzi di trasporto per vie d'acqua","+","SYSTEM","SYSTEM","1"
"CE","B8c","C00006","D","Ammortamento Mobili e arredi per ufficio","+","SYSTEM","SYSTEM","1"
"CE","B8c","C00007","D","Ammortamento Mobili e arredi per alloggi e pertinenze","+","SYSTEM","SYSTEM","1"
"CE","B8c","C00008","D","Ammortamento Mobili e arredi a uso esclusivo dei  laboratori","+","SYSTEM","SYSTEM","1"
"CE","B8b","C00009","D","Ammortamento Macchinari","+","SYSTEM","SYSTEM","1"
"CE","B8b","C00010","D","Ammortamento di impianti","+","SYSTEM","SYSTEM","1"
"CE","B7a","C11016","D","Straordinario per il personale a tempo determinato/Fonti esterne","+","SYSTEM","SYSTEM","1"
"CE","B7a","C11023","D","Assegni di ricerca","+","SYSTEM","SYSTEM","1"
"CE","B7d","C11024","D","Benefici di natura assistenziale e sociale","+","SYSTEM","SYSTEM","1"
"CE","B7d","C11025","D","Buoni pasto","+","SYSTEM","SYSTEM","1"
"CE","B7d","C11026","D","Accantonamento per nuove assunzioni di personale a tempo determinato","+","SYSTEM","SYSTEM","1"
"CE","B7d","C11027","D","Altri costi del personale n.a.c.","+","SYSTEM","SYSTEM","1"
"CE","B7b","C11028","D","Contributi obbligatori per il personale a tempo indeterminato","+","SYSTEM","SYSTEM","1"
"CE","B7b","C11029","D","Contributi obbligatori per il personale a tempo determinato/ Fonti interne","+","SYSTEM","SYSTEM","1"
"CE","B7b","C11030","D","Contributi obbligatori per il personale a tempo determinato/ Fonti esterne","+","SYSTEM","SYSTEM","1"
"CE","B7b","C11031","D","Contributi obbligatori per il personale a tempo determinato/ Tipo Privatistico","+","SYSTEM","SYSTEM","1"
"CE","B7b","C11032","D","Imposte, contributi previdenziali a carico ente","+","SYSTEM","SYSTEM","1"
"CE","B7a","C11033","D","Assegni familiari a personale a tempo indeterminato","+","SYSTEM","SYSTEM","1"
"CE","B7a","C11034","D","Assegni familiari corrisposti a personale a tempo determinato/fonti interne","+","SYSTEM","SYSTEM","1"
"CE","B7a","C11035","D","Assegni familiari corrisposti a personale a tempo determinato/fonti interne","+","SYSTEM","SYSTEM","1"
"CE","B7d","C11036","D","Equo indennizzo","+","SYSTEM","SYSTEM","1"
"CE","B7c","C11037","D","Trattamento di fine servizio per il personale a tempo indeterminato ","+","SYSTEM","SYSTEM","1"
"CE","B7c","C11038","D","Trattamento di fine rapporto per il personale a tempo indeterminato","+","SYSTEM","SYSTEM","1"
"CE","B7c","C11039","D","Liquidazione buoni fruttiferi postali per il TFR del personale iscritto INPS","+","SYSTEM","SYSTEM","1"
"CE","B7c","C11040","D","Trattamento di fine rapporto per il personale a tempo determinato","+","SYSTEM","SYSTEM","1"
"CE","B7c","C11041","D","Trasferimento tfr del personale comandatoa tempo indeterminato","+","SYSTEM","SYSTEM","1"
"CE","B7b","C12001","D","Imposta regionale sulle attivit? produttive (IRAP)","+","SYSTEM","SYSTEM","1"
"CE","B9","C12006","D","Imposta di registro e di bollo","+","SYSTEM","SYSTEM","1"
"CE","B9","C12007","D","Imposta comunale sulla pubblicit? e diritto sulle pubbliche affissioni","+","SYSTEM","SYSTEM","1"
"CE","B9","C12008","D","Tributo speciale per il deposito in discarica dei rifiuti solidi","+","SYSTEM","SYSTEM","1"
"CE","B9","C12009","D","Tributo funzione tutela e protezione ambiente","+","SYSTEM","SYSTEM","1"
"CE","B9","C12010","D","Tassa e/o tariffa smaltimento rifiuti solidi urbani","+","SYSTEM","SYSTEM","1"
"CE","B9","C12011","D","Tassa e/o canone occupazione spazi e aree pubbliche","+","SYSTEM","SYSTEM","1"
"CE","B9","C12012","D","Tassa sulle emissioni di anidride solforosa","+","SYSTEM","SYSTEM","1"
"CE","B9","C12013","D","Tassa di circolazione dei veicoli a motore (tassa automobilistica)","+","SYSTEM","SYSTEM","1"
"CE","B9","C12014","D","Imposte sul reddito delle persone giuridiche (ex IRPEG)","+","SYSTEM","SYSTEM","1"
"CE","B9","C12015","D","Imposta comunale sugli immobili (ICI) ","+","SYSTEM","SYSTEM","1"
"CE","B9","C12016","D","IMU/TASI","+","SYSTEM","SYSTEM","1"
"CE","B9","C12017","D","Tributi sulle successioni e donazioni ","+","SYSTEM","SYSTEM","1"
"CE","B4","C13001","D","Giornali e riviste","+","SYSTEM","SYSTEM","1"
"CE","B4","C13002","D","Pubblicazioni","+","SYSTEM","SYSTEM","1"
"CE","B4","C13003","D","Carta, cancelleria e stampati","+","SYSTEM","SYSTEM","1"
"CE","B4","C13004","D","Carburanti, combustibili e lubrificanti ","+","SYSTEM","SYSTEM","1"
"CE","B4","C13005","D","Carburanti, combustibili e lubrificanti per autovetture","+","SYSTEM","SYSTEM","1"
"CE","B4","C13006","D","Carburanti, combustibili e lubrificanti per altri mezzi di trasporto stradali","+","SYSTEM","SYSTEM","1"
"CE","B4","C13007","D","Carburanti, combustibili e lubrificanti per natanti, imbarcazioni e velivoli","+","SYSTEM","SYSTEM","1"
"CE","B4","C13008","D","Equipaggiamento","+","SYSTEM","SYSTEM","1"
"CE","B4","C13009","D","Vestiario","+","SYSTEM","SYSTEM","1"
"CE","B4","C13010","D","Accessori per uffici e alloggi","+","SYSTEM","SYSTEM","1"
"CE","B4","C13011","D","Materiale informatico","+","SYSTEM","SYSTEM","1"
"CE","B4","C13012","D","Altri materiali tecnico-specialistici non sanitari","+","SYSTEM","SYSTEM","1"
"CE","B4","C13013","D","Strumenti tecnico-specialistici non sanitari","+","SYSTEM","SYSTEM","1"
"CE","B4","C13014","D","Beni per attivit? di rappresentanza","+","SYSTEM","SYSTEM","1"
"CE","B4","C13015","D","Generi alimentari","+","SYSTEM","SYSTEM","1"
"SPATT","AII6","P00015","A","Fondo ammortamento mezzi di trasporto per vie d'acqua","-","SYSTEM","SYSTEM","1"
"SPATT","AII6","A22003","D","Mezzi di trasporto aerei","+","SYSTEM","SYSTEM","1"
"SPATT","AII6","A22004","D","Mezzi di trasporto per vie d'acqua","+","SYSTEM","SYSTEM","1"
"SPATT","AII7","A22018B","D","Immobilizzazioni materiali in costruzione - Fabbricati istituzionali","+","SYSTEM","SYSTEM","1"
"SPATT","AII7","A22022B","D","Immobilizzazioni materiali in costruzione - Infrastrutture telematiche","+","SYSTEM","SYSTEM","1"
"SPATT","AI1","A00058","D","Brevetti","+","SYSTEM","SYSTEM","1"
"SPATT","AI2","A00061","D","Altre immobilizzazioni immateriali n.a.c.","+","SYSTEM","SYSTEM","1"
"SPATT","AI3","P00039","A","Fondo ammortamento opere dell'ingegno e diritti d'autore","-","SYSTEM","SYSTEM","1"
"SPATT","AI3","A00059","D","Opere dell'ingegno e Diritti d'autore","+","SYSTEM","SYSTEM","1"
"SPATT","BIII1","A00056","D","Depositi postali","+","SYSTEM","SYSTEM","1"
"SPATT","BIII1","A00001","D","Denaro e valori in cassa","+","SYSTEM","SYSTEM","1"
"SPATT","BII1","A21002","D","Crediti per finanziamenti MIUR in attuazione della nuova intesa di programma per il Mezzogiorno","+","SYSTEM","SYSTEM","1"
"SPATT","BII1","A21004","D","Crediti per finanziamenti MIUR per l'attivit? di sviluppo delle aree depresse (CLUSTER)","+","SYSTEM","SYSTEM","1"
"SPATT","BII1","A21005","D","Crediti per finanziamenti MIUR relativi al Fondo per gli Investimenti della Ricerca di Base (FIRB)","+","SYSTEM","SYSTEM","1"
"SPATT","BII1","A21006","D","Crediti per finanziamenti MIUR relativi al Fondo Integrativo Speciale per la Ricerca (FISR)","+","SYSTEM","SYSTEM","1"
"SPATT","BII1","A91012","D","Crediti diversi derivanti da ritenute per scissione contabile IVA (Split payment)","+","SYSTEM","SYSTEM","1"
"SPATT","BII1","A91013","D","Crediti diversi derivanti da ritenute erariali su prestazioni sociali","+","SYSTEM","SYSTEM","1"
"SPATT","BII1","A92046","D","Crediti diversi derivanti da restituzione di depositi cauzionali presso terzi ","+","SYSTEM","SYSTEM","1"
"SPATT","BII1","A35001","D","Crediti da Indennizzi di assicurazione su beni immobili","+","SYSTEM","SYSTEM","1"
"SPATT","BII1","A44007","D","Crediti da Alienazione di Macchinari","+","SYSTEM","SYSTEM","1"
"SPATT","BII1","A44009","D","Crediti da Alienazione Attrezzature scientifiche","+","SYSTEM","SYSTEM","1"
"SPPAS","D1","P63001","A","Debiti per finanziamenti a medio / lungo  termine da altre Imprese - mutui passivi","+","SYSTEM","SYSTEM","1"
"SPPAS","D2","P00044","A","IVA a debito","+","SYSTEM","SYSTEM","1"
"SPPAS","D2","P00045","A","IVA vendite in sospensione/differita","+","SYSTEM","SYSTEM","1"
"SPPAS","D2","P00046","A","Erario c/IVA","+","SYSTEM","SYSTEM","1"
"SPPAS","D2","P00047","A","Fatture da ricevere","+","SYSTEM","SYSTEM","1"
"SPPAS","D2","P10006","A","Debiti verso fornitori - premi di assicurazione su beni mobili","+","SYSTEM","SYSTEM","1"
"SPPAS","D2","P10007","A","Debiti verso fornitori - premi di assicurazione su beni immobili","+","SYSTEM","SYSTEM","1"
"SPPAS","D2","P10008","A","Debiti verso fornitori - premi di assicurazione per responsabilit? civile verso terzi","+","SYSTEM","SYSTEM","1"
"SPPAS","D2","P10009","A","Debiti verso fornitori - altri premi di assicurazione contro i danni","+","SYSTEM","SYSTEM","1"
"SPPAS","D2","P10010","A","Debiti per sanzioni","+","SYSTEM","SYSTEM","1"
"SPPAS","D2","P10011","A","Debiti per risarcimenti danni","+","SYSTEM","SYSTEM","1"
"SPPAS","D2","P10012","A","Debiti per indennizzi","+","SYSTEM","SYSTEM","1"
"SPPAS","D2","P10013","A","Oneri da contenzioso","+","SYSTEM","SYSTEM","1"
"SPPAS","D2","P11001","A","Debiti per arretrati per anni precedenti corrisposti al personale a tempo indeterminato","+","SYSTEM","SYSTEM","1"
"SPATT","BII1","A21041","D","Crediti per Trasferimenti correnti da Agenzie regionali per le erogazioni in agricoltura","+","SYSTEM","SYSTEM","1"
"SPATT","BII1","A21042","D","Crediti per Trasferimenti correnti da altri enti e agenzie regionali e sub regionali","+","SYSTEM","SYSTEM","1"
"SPATT","BII1","A21043","D","Crediti per Trasferimenti correnti da Consorzi di enti locali","+","SYSTEM","SYSTEM","1"
"SPATT","BII1","A21045","D","Crediti per Trasferimenti correnti da altre Amministrazioni Locali ","+","SYSTEM","SYSTEM","1"
"SPATT","BII1","A21046","D","Crediti per Trasferimenti correnti da INPS","+","SYSTEM","SYSTEM","1"
"SPATT","BII1","A21047","D","Crediti per Trasferimenti correnti da INAIL","+","SYSTEM","SYSTEM","1"
"SPATT","BII1","A21048","D","Crediti per Trasferimenti correnti da altri Enti di Previdenza","+","SYSTEM","SYSTEM","1"
"SPATT","BII1","A21051","D","Crediti per Altri trasferimenti correnti da altre imprese partecipate","+","SYSTEM","SYSTEM","1"
"SPATT","BII1","A21052","D","Crediti per Altri trasferimenti correnti da altre imprese","+","SYSTEM","SYSTEM","1"
"SPATT","BII1","A21057","D","Crediti per altri finanziamenti della Comunit? Europea","+","SYSTEM","SYSTEM","1"
"SPATT","BI1","A00067","D","Rimanenze di prodotti finiti","+","SYSTEM","SYSTEM","1"
"SPATT","F2","O.01.008","D","Altri conti d'ordine","+","SYSTEM","SYSTEM","1"
"CE","C14","C17005","D","Interessi di mora ad altri soggetti","+","SYSTEM","SYSTEM","1"
"CE","D20","C19001","D","Costi per rimborsi per spese di personale (comando, distacco)","+","SYSTEM","SYSTEM","1"
"CE","D20","C19002","D","Costi per rimborsi di trasferimenti all'Unione Europea","+","SYSTEM","SYSTEM","1"
"CE","B5","C13106","D","Servizi di consulenza e prestazioni professionali ICT","+","SYSTEM","SYSTEM","1"
"CE","B5","C13107","D","Altre spese legali","+","SYSTEM","SYSTEM","1"
"CE","B5","C13108","D","Quote di iscrizione ad associazioni","+","SYSTEM","SYSTEM","1"
"CE","B5","C13109","D","Spese per componenti commissioni concorso e selezione del personale","+","SYSTEM","SYSTEM","1"
"SPATT","BII1","A44001","D","Alienazione di autovetture","+","SYSTEM","SYSTEM","1"
"SPATT","BII1","A44002","D","Alienazione di altri mezzi di trasporto stradali","+","SYSTEM","SYSTEM","1"
"SPATT","BII1","A44004","D","Alienazione di battelli ed imbarcazioni","+","SYSTEM","SYSTEM","1"
"SPATT","BII1","A44005","D","Alienazione di altri mezzi di trasporto","+","SYSTEM","SYSTEM","1"
"CE","B5","C13110","D","Spese per funzionamento dei Panel di Valutazione","+","SYSTEM","SYSTEM","1"
"CE","B5","C13111","D","Spese per funzionamento delle commissioni di gara","+","SYSTEM","SYSTEM","1"
"CE","B5","C13112","D","Giardinaggio","+","SYSTEM","SYSTEM","1"
"CE","B5","C13113","D","Spese per l'organizzazione di corsi di formazione","+","SYSTEM","SYSTEM","1"
"CE","B5","C13114","D","Servizi per attivit? di rappresentanza","+","SYSTEM","SYSTEM","1"
"CE","B5","C13115","D","Altri servizi diversi n.a.c.","+","SYSTEM","SYSTEM","1"
"CE","B8f","C00029","D","Ammortamento Opere dell'ingegno e Diritti d'autore","+","SYSTEM","SYSTEM","1"
"CE","B12","C00061","D","Accantonamento a fondo svalutazione crediti per trasferimenti e contributi","+","SYSTEM","SYSTEM","1"
"CE","B12","C00062","D","Accantonamento a fondo svalutazione crediti per crediti verso clienti ed utenti","+","SYSTEM","SYSTEM","1"
"CE","B12","C00063","D","Accantonamento a fondo svalutazione altri crediti","+","SYSTEM","SYSTEM","1"
"CE","B11","C00064","D","Accantonamenti per rischi","+","SYSTEM","SYSTEM","1"
"CE","B10","C00067","D","Variazioni nelle rimanenze di materie prime e/o beni di consumo","+","SYSTEM","SYSTEM","1"
"CE","D20","C00069","D","Altre sopravvenienze passive","+","SYSTEM","SYSTEM","1"
"CE","D20","C00070","D","Insussistenze dell'attivo","+","SYSTEM","SYSTEM","1"
"CE","B7d","C10004","D","Accantonamenti per rinnovi contrattuali","+","SYSTEM","SYSTEM","1"
"CE","B13","C10006","D","Premi di assicurazione su beni mobili","+","SYSTEM","SYSTEM","1"
"CE","B13","C10007","D","Premi di assicurazione su beni immobili","+","SYSTEM","SYSTEM","1"
"CE","B13","C10008","D","Premi di assicurazione per responsabilit? civile verso terzi","+","SYSTEM","SYSTEM","1"
"CE","B13","C10009","D","Premi di assicurazione contro i danni","+","SYSTEM","SYSTEM","1"
"CE","B13","C10010","D","Costi per multe, ammende, sanzioni e oblazioni","+","SYSTEM","SYSTEM","1"
"CE","B13","C10011","D","Costi per risarcimento danni","+","SYSTEM","SYSTEM","1"
"SPATT","BII1","A21007","D","Crediti per finanziamenti MIUR relativi al Fondo Agevolato per la Ricerca Industriale (FAR)","+","SYSTEM","SYSTEM","1"
"SPATT","BII1","A21011","D","Crediti per finanziamenti MIUR per altre iniziative progettuali","+","SYSTEM","SYSTEM","1"
"SPATT","BII1","A21012","D","Crediti per finanziamenti MEF ai sensi della legge 16 aprile 1987, n. 183 (Fondo di rotazione)","+","SYSTEM","SYSTEM","1"
"SPATT","BII1","A21013","D","Crediti per finanziamenti MiSE relativi al progetto Industria 2015","+","SYSTEM","SYSTEM","1"
"SPATT","BII1","A21014","D","Crediti per altri finanziamenti e contributi ministeriali","+","SYSTEM","SYSTEM","1"
"SPATT","BII1","A21015","D","Crediti per Trasferimenti correnti da Presidenza del Consiglio dei Ministri","+","SYSTEM","SYSTEM","1"
"SPATT","BII1","A21016","D","Crediti per Trasferimenti correnti da Organi Costituzionali e di rilievo costituzionale","+","SYSTEM","SYSTEM","1"
"SPATT","BII1","A21017","D","Crediti per Trasferimenti correnti da Agenzie Fiscali","+","SYSTEM","SYSTEM","1"
"SPATT","BII1","A21018","D","Crediti per Trasferimenti correnti da enti di regolazione dell'attivit? economica","+","SYSTEM","SYSTEM","1"
"SPATT","BII1","A21020","D","Crediti per Trasferimenti correnti da Anas S.p.A.","+","SYSTEM","SYSTEM","1"
"SPATT","BII1","A21021","D","Crediti per Trasferimenti correnti da altri enti centrali produttori di servizi economici","+","SYSTEM","SYSTEM","1"
"SPATT","BII1","A21022","D","Crediti per Trasferimenti correnti da autorit? amministrative indipendenti","+","SYSTEM","SYSTEM","1"
"SPATT","BII1","A21025","D","Crediti per finanziamenti delle Regioni relativi ai Programmi Operativi Regionali (POR)","+","SYSTEM","SYSTEM","1"
"SPATT","BII1","A21026","D","Crediti per altri finanziamenti da Regioni e province autonome","+","SYSTEM","SYSTEM","1"
"SPATT","BII1","A21027","D","Crediti per Trasferimenti correnti da Province","+","SYSTEM","SYSTEM","1"
"SPATT","BII1","A21028","D","Crediti per Trasferimenti correnti da Comuni","+","SYSTEM","SYSTEM","1"
"SPATT","BII1","A21030","D","Crediti per Trasferimenti correnti da Unioni di Comuni","+","SYSTEM","SYSTEM","1"
"SPATT","BII1","A21031","D","Crediti per Trasferimenti correnti da Comunit? Montane","+","SYSTEM","SYSTEM","1"
"SPATT","BII1","A21032","D","Crediti per Trasferimenti correnti da Camere di Commercio","+","SYSTEM","SYSTEM","1"
"SPATT","BII1","A21033","D","Crediti per Trasferimenti correnti da Universit?","+","SYSTEM","SYSTEM","1"
"SPATT","BII1","A21035","D","Crediti per Trasferimenti correnti da Autorit? Portuali","+","SYSTEM","SYSTEM","1"
"SPATT","BII1","A21036","D","Crediti per Trasferimenti correnti da Aziende sanitarie locali ","+","SYSTEM","SYSTEM","1"
"SPATT","BII1","A21038","D","Crediti per Trasferimenti correnti da Policlinici","+","SYSTEM","SYSTEM","1"
"SPATT","BII1","A21040","D","Crediti per Trasferimenti correnti da altre Amministrazioni Locali produttrici di servizi sanitari","+","SYSTEM","SYSTEM","1"
"SPATT","BII1","A35006","D","Entrate per rimborsi di imposte indirette","+","SYSTEM","SYSTEM","1"
"CE","B5","C13069","D","Manutenzione ordinaria e riparazioni di altri mezzi di trasporto stradale","+","SYSTEM","SYSTEM","1"
"CE","B5","C13070","D","Manutenzione ordinaria e riparazioni della Nave ""Urania""","+","SYSTEM","SYSTEM","1"
"CE","B5","C13071","D","Manutenzione ordinaria e riparazioni di natanti, imbarcazioni e velivoli","+","SYSTEM","SYSTEM","1"
"CE","B5","C13072","D","Manutenzione ordinaria e riparazioni di mobili e arredi","+","SYSTEM","SYSTEM","1"
"CE","B5","C13073","D","Manutenzione ordinaria e riparazioni di impianti e macchinari","+","SYSTEM","SYSTEM","1"
"SPATT","BII1","A35007","D","Entrate da rimborsi di IVA a credito","+","SYSTEM","SYSTEM","1"
"SPATT","BII1","A35008","D","Entrate da rimborsi di imposte dirette","+","SYSTEM","SYSTEM","1"
"SPATT","BII1","A35012","D","Restituzione di ratei di borse di studio","+","SYSTEM","SYSTEM","1"
"SPATT","BII1","A35013","D","Entrate da rimborsi, recuperi e restituzioni di somme non dovute o incassate in eccesso da Famiglie","+","SYSTEM","SYSTEM","1"
"SPATT","BII1","A35014","D","Entrate da rimborsi, recuperi e restituzioni di somme non dovute o incassate in eccesso da Imprese","+","SYSTEM","SYSTEM","1"
"CE","B5","C13074","D","Manutenzione ordinaria e riparazioni di attrezzature","+","SYSTEM","SYSTEM","1"
"CE","B5","C13075","D","Manutenzione ordinaria e riparazioni di macchine per ufficio ","+","SYSTEM","SYSTEM","1"
"CE","B5","C13076","D","Manutenzione ordinaria e riparazioni di beni immobili di propriet?","+","SYSTEM","SYSTEM","1"
"CE","B6","C13077","D","Manutenzione ordinaria e riparazioni di beni immobili in locazione, in comodato o in uso","+","SYSTEM","SYSTEM","1"
"CE","B5","C13078","D","Incarichi libero professionali di studi, ricerca e consulenza","+","SYSTEM","SYSTEM","1"
"CE","B5","C13079","D","Esperti per commissioni, comitati e consigli","+","SYSTEM","SYSTEM","1"
"CE","B5","C13080","D","Interpretariato e traduzioni","+","SYSTEM","SYSTEM","1"
"CE","B5","C13081","D","Perizie","+","SYSTEM","SYSTEM","1"
"CE","B5","C13082","D","Prestazioni di natura contabile, tributaria e del lavoro","+","SYSTEM","SYSTEM","1"
"CE","B5","C13083","D","Prestazioni tecnico-scientifiche a fini di ricerca","+","SYSTEM","SYSTEM","1"
"CE","B5","C13084","D","Costi per il deposito, mantenimento e tutela dei brevetti ","+","SYSTEM","SYSTEM","1"
"CE","B5","C13085","D","Altre prestazioni professionali e specialistiche n.a.c.","+","SYSTEM","SYSTEM","1"
"CE","B5","C13086","D","Acquisto di servizi da agenzie di lavoro interinale","+","SYSTEM","SYSTEM","1"
"CE","B5","C13087","D","Collaborazioni coordinate e a progetto","+","SYSTEM","SYSTEM","1"
"CE","B5","C13088","D","Vigilanza","+","SYSTEM","SYSTEM","1"
"CE","B5","C13089","D","Pulizia","+","SYSTEM","SYSTEM","1"
"CE","B5","C13090","D","Servizi di lavanderia","+","SYSTEM","SYSTEM","1"
"CE","B5","C13091","D","Trasporti, traslochi e facchinaggio","+","SYSTEM","SYSTEM","1"
"CE","B5","C13092","D","Acquisto di buoni taxi","+","SYSTEM","SYSTEM","1"
"SPPAS","D2","P71012","A","Debito per versamento delle ritenute per scissione contabile IVA (Split payment)","+","SYSTEM","SYSTEM","1"
"SPPAS","D2","P71013","A","Debiti per versamenti ritenute erariali su prestazioni sociali ","+","SYSTEM","SYSTEM","1"
"SPATT","AII1","A22033","D","Manutenzione straordinaria su beni demaniali di terzi dati in concessione","+","SYSTEM","SYSTEM","1"
"SPATT","BII1","A21065","D","Crediti per Trasferimenti correnti da Ministero dell'Istruzione - Istituzioni scolastiche","+","SYSTEM","SYSTEM","1"
"SPATT","BII1","A63002","D","Crediti diversi derivanti da accensione di mutui da Cassa depositi e Prestiti SpA.","+","SYSTEM","SYSTEM","1"
"CE","D21","C44012","D","Minusvalenza da alienazione di Macchinari per ufficio","+","SYSTEM","SYSTEM","1"
"CE","D21","C44013","D","Minusvalenza da Alienazione di server","+","SYSTEM","SYSTEM","1"
"CE","D21","C44014","D","Minusvalenza da Alienazione di postazioni di lavoro","+","SYSTEM","SYSTEM","1"
"CE","D21","C44015","D","Minusvalenza da Alienazione di periferiche","+","SYSTEM","SYSTEM","1"
"CE","D21","C44016","D","Minusvalenza da Alienazione di apparati di telecomunicazione","+","SYSTEM","SYSTEM","1"
"CE","D21","C44017","D","Minusvalenza da Alienazione di altro hardware","+","SYSTEM","SYSTEM","1"
"CE","D21","C44018","D","Minusvalenza da alienazione di Fabbricati ad uso abitativo","+","SYSTEM","SYSTEM","1"
"CE","D21","C44020","D","Minusvalenza da alienazione di Fabbricati industriali e costruzioni leggere","+","SYSTEM","SYSTEM","1"
"CE","D21","C44021","D","Minusvalenza da alienazione di Fabbricati rurali","+","SYSTEM","SYSTEM","1"
"CE","D21","C44022","D","Minusvalenza da alienazione di Fabbricati Ospedalieri e altre strutture sanitarie","+","SYSTEM","SYSTEM","1"
"CE","D21","C44023","D","Minusvalenza da alienazione di Infrastrutture telematiche","+","SYSTEM","SYSTEM","1"
"CE","D21","C44024","D","Minusvalenza da alienazione di altri beni immobili","+","SYSTEM","SYSTEM","1"
"CE","D21","C44025","D","Minusvalenza da alienazione di Oggetti di valore","+","SYSTEM","SYSTEM","1"
"CE","D21","C44026","D","Minusvalenza da alienazione di diritti reali","+","SYSTEM","SYSTEM","1"
"CE","D21","C44027","D","Minusvalenza da alienazione di Materiale bibliografico","+","SYSTEM","SYSTEM","1"
"CE","D21","C44028","D","Minusvalenza da cessione di Terreni agricoli","+","SYSTEM","SYSTEM","1"
"CE","D21","C44029","D","Minusvalenza da cessione di Terreni edificabili","+","SYSTEM","SYSTEM","1"
"CE","D21","C44030","D","Minusvalenza da Alienazione di software","+","SYSTEM","SYSTEM","1"
