CD_PIANO_GRUPPI,CD_GRUPPO_EP,CD_VOCE_EP,SEZIONE,DS_ASSOCIAZIONE,SEGNO,UTCR,UTUV,PG_VER_REC
"SPATT","BII1","A31013","D","Proventi da servizi informatici","+","SYSTEM","SYSTEM","1"
"SPATT","BII1","A31014","D","Proventi da servizi ispettivi e controllo","+","SYSTEM","SYSTEM","1"
"SPATT","BII1","A31016","D","Proventi da attivita' di monitoraggio e controllo ambientale","+","SYSTEM","SYSTEM","1"
"SPATT","BII1","A31017","D","Proventi da analisi e studi nel campo della ricerca","+","SYSTEM","SYSTEM","1"
"SPATT","BII1","A31018","D","Proventi dallo svolgimento di attivita' di certificazione","+","SYSTEM","SYSTEM","1"
"SPATT","BII1","A31019","D","Proventi per organizzazione convegni","+","SYSTEM","SYSTEM","1"
"CE","B4","C13016","D","Stampati specialistici","+","SYSTEM","SYSTEM","1"
"CE","B6","C13053","D","Noleggio della Nave ""Urania""","+","SYSTEM","SYSTEM","1"
"CE","B6","C13054","D","Noleggio di natanti ed imbarcazioni","+","SYSTEM","SYSTEM","1"
"CE","B6","C13055","D","Noleggio di velivoli","+","SYSTEM","SYSTEM","1"
"SPATT","BII1","A44007","D","Crediti da Alienazione di Macchinari","+","SYSTEM","SYSTEM","1"
"SPATT","BII1","A44009","D","Crediti da Alienazione Attrezzature scientifiche","+","SYSTEM","SYSTEM","1"
"SPPAS","D1","P63001","A","Debiti per finanziamenti a medio / lungo  termine da altre Imprese - mutui passivi","+","SYSTEM","SYSTEM","1"
"SPPAS","D2","P00044","A","IVA a debito","+","SYSTEM","SYSTEM","1"
"SPPAS","D2","P00045","A","IVA vendite in sospensione/differita","+","SYSTEM","SYSTEM","1"
"SPPAS","D2","P00046","A","Erario c/IVA","+","SYSTEM","SYSTEM","1"
"SPPAS","D2","P00047","A","Fatture da ricevere","+","SYSTEM","SYSTEM","1"
"SPPAS","D2","P10006","A","Debiti verso fornitori - premi di assicurazione su beni mobili","+","SYSTEM","SYSTEM","1"
"SPPAS","D2","P10007","A","Debiti verso fornitori - premi di assicurazione su beni immobili","+","SYSTEM","SYSTEM","1"
"SPPAS","D2","P10008","A","Debiti verso fornitori - premi di assicurazione per responsabilit? civile verso terzi","+","SYSTEM","SYSTEM","1"
"SPPAS","D2","P10009","A","Debiti verso fornitori - altri premi di assicurazione contro i danni","+","SYSTEM","SYSTEM","1"
"SPPAS","D2","P10010","A","Debiti per sanzioni","+","SYSTEM","SYSTEM","1"
"SPPAS","D2","P10011","A","Debiti per risarcimenti danni","+","SYSTEM","SYSTEM","1"
"SPPAS","D2","P10012","A","Debiti per indennizzi","+","SYSTEM","SYSTEM","1"
"SPPAS","D2","P10013","A","Oneri da contenzioso","+","SYSTEM","SYSTEM","1"
"SPPAS","D2","P11001","A","Debiti per arretrati per anni precedenti corrisposti al personale a tempo indeterminato","+","SYSTEM","SYSTEM","1"
"SPPAS","D2","P11002","A","Debiti per stipendi  e assegni fissi al personale a tempo indeterminato","+","SYSTEM","SYSTEM","1"
"SPPAS","D2","P11003","A","Debiti per straordinario da corrispondere al personale a tempo indeterminato","+","SYSTEM","SYSTEM","1"
"SPPAS","D2","P11007","A","Debiti per equo premio per attivit? inventiva","+","SYSTEM","SYSTEM","1"
"SPPAS","D2","P11008","A","Debiti per arretrati per anni precedenti corrisposti al personale a tempo determinato/fonti interne","+","SYSTEM","SYSTEM","1"
"SPPAS","D2","P11009","A","Debiti per arretrati per anni precedenti corrisposti al personale a tempo determinato/fonti esterne","+","SYSTEM","SYSTEM","1"
"SPPAS","D2","P11011","A","Debiti per stipendi e assegni fissi  al personale a tempo determinato/fonti interne","+","SYSTEM","SYSTEM","1"
"SPPAS","D2","P11012","A","Debiti per stipendi e assegni fissi al personale a tempo determinato/fonti esterne","+","SYSTEM","SYSTEM","1"
"SPPAS","D2","P11013","A","Debiti per stipendi ed assegni fissi per il personale assunto con contratto di tipo privatistico","+","SYSTEM","SYSTEM","1"
"SPPAS","D2","P11014","A","Debiti per retribuzioni degli operai agricoli a tempo determinato","+","SYSTEM","SYSTEM","1"
"SPPAS","D2","P11015","A","Debiti per straordinario per il personale a tempo determinato/Fonti interne","+","SYSTEM","SYSTEM","1"
"SPPAS","D2","P11016","A","Debiti per straordinario per il personale a tempo determinato/Fonti esterne","+","SYSTEM","SYSTEM","1"
"SPPAS","D2","P11023","A","Debiti per assegni di ricerca","+","SYSTEM","SYSTEM","1"
"SPPAS","D2","P11024","A","Debiti per benefici di natura assistenziale e sociale","+","SYSTEM","SYSTEM","1"
"SPPAS","D2","P11025","A","Debiti verso fornitori - buoni pasto","+","SYSTEM","SYSTEM","1"
"SPPAS","D2","P11026","A","Altri debiti verso il personale dipendente - Accantonamento per nuove assunzioni di personale t.d.","+","SYSTEM","SYSTEM","1"
"CE","B5","C13093","D","Stampa e rilegatura","+","SYSTEM","SYSTEM","1"
"CE","B5","C13094","D","Rimozione e smaltimento di rifiuti tossico-nocivi e di altri materiali","+","SYSTEM","SYSTEM","1"
"CE","B5","C13095","D","Mensa","+","SYSTEM","SYSTEM","1"
"CE","B5","C13096","D","Pubblicazione bandi di gara","+","SYSTEM","SYSTEM","1"
"CE","B5","C13097","D","Spese postali","+","SYSTEM","SYSTEM","1"
"CE","B5","C13098","D","Spese notarili","+","SYSTEM","SYSTEM","1"
"CE","B5","C13099","D","Oneri per fideiussione ","+","SYSTEM","SYSTEM","1"
"CE","B5","C13100","D","Spese per commissioni bancarie","+","SYSTEM","SYSTEM","1"
"CE","B6","C13067","D","Leasing operativo di altri beni","+","SYSTEM","SYSTEM","1"
"CE","B5","C13101","D","Spese per accertamenti sanitari, ivi comprese le spese per visite fiscali","+","SYSTEM","SYSTEM","1"
"CE","B5","C13102","D","Gestione e manutenzione applicazioni","+","SYSTEM","SYSTEM","1"
"CE","B5","C13104","D","Servizi di rete per trasmissione dati e VoIP e relativa manutenzione","+","SYSTEM","SYSTEM","1"
"CE","B5","C13105","D","Servizi di gestione documentale","+","SYSTEM","SYSTEM","1"
"SPPAS","D2","P72011","A","Debiti per Trasferimenti per conto terzi a autorit? amministrative indipendenti","+","SYSTEM","SYSTEM","1"
"SPPAS","D2","P72012","A","Debiti per Trasferimenti per conto terzi a enti centrali a struttura associativa","+","SYSTEM","SYSTEM","1"
"SPPAS","D2","P72015","A","Debiti per Trasferimenti per conto terzi a altre Amministrazioni Centrali n.a.c.","+","SYSTEM","SYSTEM","1"
"SPPAS","D2","P72016","A","Debiti per Trasferimenti per conto terzi a Regioni e province autonome","+","SYSTEM","SYSTEM","1"
"SPPAS","D2","P72017","A","Debiti per Trasferimenti per conto terzi a Province","+","SYSTEM","SYSTEM","1"
"SPPAS","D2","P72018","A","Debiti per Trasferimenti per conto terzi a Comuni","+","SYSTEM","SYSTEM","1"
"SPPAS","D2","P72019","A","Debiti per Trasferimenti per conto terzi a Citt? metropolitane e Roma capitale","+","SYSTEM","SYSTEM","1"
"SPPAS","D2","P72020","A","Debiti per Trasferimenti per conto terzi a Unioni di Comuni","+","SYSTEM","SYSTEM","1"
"SPPAS","D2","P72021","A","Debiti per Trasferimenti per conto terzi a Comunit? Montane","+","SYSTEM","SYSTEM","1"
"SPPAS","D2","P72022","A","Debiti per Trasferimenti per conto terzi a Camere di Commercio","+","SYSTEM","SYSTEM","1"
"SPPAS","D2","P72023","A","Debiti per Trasferimenti per conto terzi a Universit?","+","SYSTEM","SYSTEM","1"
"SPPAS","D2","P72025","A","Debiti per Trasferimenti per conto terzi a Autorit? Portuali","+","SYSTEM","SYSTEM","1"
"SPPAS","D2","P72026","A","Debiti per Trasferimenti per conto terzi a Aziende sanitarie locali ","+","SYSTEM","SYSTEM","1"
"SPPAS","D2","P72028","A","Debiti per Trasferimenti per conto terzi a policlinici","+","SYSTEM","SYSTEM","1"
"SPPAS","D2","P72031","A","Debiti per Trasferimenti per conto terzi a Agenzie regionali per le erogazioni in agricoltura","+","SYSTEM","SYSTEM","1"
"SPPAS","E2","P00051","A","Altri risconti passivi","+","SYSTEM","SYSTEM","1"
"SPPAS","D2","P22018","A","Debiti verso fornitori per acquisto e costruzione fabbricati istituzionali/strumentali","+","SYSTEM","SYSTEM","1"
"SPPAS","D2","P72032","A","Debiti per Trasferimenti per conto terzi a altri enti e agenzie regionali e sub regionali","+","SYSTEM","SYSTEM","1"
"SPPAS","D2","P72033","A","Debiti per Trasferimenti per conto terzi a Consorzi di enti locali","+","SYSTEM","SYSTEM","1"
"SPPAS","D2","P72035","A","Debiti per Trasferimenti per conto terzi a altre Amministrazioni Locali n.a.c.","+","SYSTEM","SYSTEM","1"
"SPPAS","D2","P72036","A","Debiti per Trasferimenti per conto terzi a INPS","+","SYSTEM","SYSTEM","1"
"SPPAS","D2","P72037","A","Debiti per Trasferimenti per conto terzi a INAIL","+","SYSTEM","SYSTEM","1"
"SPPAS","D2","P72038","A","Debiti per Trasferimenti per conto terzi a altri Enti di Previdenza n.a.c.","+","SYSTEM","SYSTEM","1"
"SPPAS","D2","P72039","A","Debiti per Trasferimenti per conto terzi a Famiglie","+","SYSTEM","SYSTEM","1"
"SPPAS","D2","P72040","A","Debiti per Trasferimenti per conto terzi a Imprese controllate","+","SYSTEM","SYSTEM","1"
"SPPAS","D2","P72041","A","Debiti per Trasferimenti per conto terzi a altre imprese partecipate","+","SYSTEM","SYSTEM","1"
"SPPAS","D2","P72042","A","Debiti per Trasferimenti per conto terzi a altre imprese","+","SYSTEM","SYSTEM","1"
"SPPAS","D2","P72043","A","Debiti per Trasferimenti per conto terzi a Istituzioni Sociali Private ","+","SYSTEM","SYSTEM","1"
"SPPAS","D2","P72044","A","Debiti per Trasferimenti per conto terzi all'Unione Europea e al Resto del Mondo","+","SYSTEM","SYSTEM","1"
"SPPAS","D2","P72045","A","Altri debiti derivanti dalla costituzione di depositi cauzionali o contrattuali presso terzi","+","SYSTEM","SYSTEM","1"
"SPPAS","D2","P72046","A","Altri debiti derivanti dalla restituzione di depositi cauzionali o contrattuali di terzi","+","SYSTEM","SYSTEM","1"
"SPATT","BII1","A44020","D","Crediti da Alienazione di Fabbricati industriali e costruzioni leggere","+","SYSTEM","SYSTEM","1"
"SPATT","BII1","A44021","D","Crediti da Alienazione di Fabbricati rurali","+","SYSTEM","SYSTEM","1"
"SPATT","BII1","A44023","D","Crediti da Alienazione di Infrastrutture telematiche","+","SYSTEM","SYSTEM","1"
"SPATT","BII1","A44024","D","Crediti da Alienazione di altri beni immobili","+","SYSTEM","SYSTEM","1"
"SPATT","BII1","A44026","D","Crediti da Alienazione di diritti reali","+","SYSTEM","SYSTEM","1"
"SPATT","BII1","A44027","D","Crediti da Alienazione di Materiale bibliografico","+","SYSTEM","SYSTEM","1"
"SPATT","BII1","A44028","D","Crediti da Cessione di Terreni agricoli","+","SYSTEM","SYSTEM","1"
"SPATT","BII1","A44029","D","Crediti da Cessione di Terreni edificabili","+","SYSTEM","SYSTEM","1"
"SPATT","BII1","A44030","D","Crediti da Alienazione di software","+","SYSTEM","SYSTEM","1"
"SPATT","BII1","A44032","D","Crediti da Alienazione di Opere dell'ingegno e Diritti d'autore","+","SYSTEM","SYSTEM","1"
"SPATT","BII1","A44033","D","Crediti da Alienazione di altri beni immateriali ","+","SYSTEM","SYSTEM","1"
"SPATT","BII1","A44034","D","Crediti da Alienazione di mobili e arredi per alloggi e pertinenze","+","SYSTEM","SYSTEM","1"
"SPATT","BII1","A44035","D","Crediti da Alienazione di mobili e arredi per uso laboratorio","+","SYSTEM","SYSTEM","1"
"SPATT","BII1","A51001","D","Crediti da Alienazione di partecipazioni in imprese controllate","+","SYSTEM","SYSTEM","1"
"SPATT","BII1","A51002","D","Crediti da Alienazione di partecipazioni in altre imprese partecipate","+","SYSTEM","SYSTEM","1"
"SPATT","BII1","A51003","D","Crediti da Alienazione di partecipazioni in altre imprese","+","SYSTEM","SYSTEM","1"
"SPATT","BII1","A91001","D","Crediti diversi derivanti da ritenuta del 4% sui contributi pubblici","+","SYSTEM","SYSTEM","1"
"SPATT","BII1","A91005","D","Crediti diversi derivanti da altre ritenute al personale dipendente per conto di terzi","+","SYSTEM","SYSTEM","1"
"SPATT","BII1","A91006","D","Crediti diversi derivanti da ritenute erariali su redditi da lavoro autonomo per conto terzi","+","SYSTEM","SYSTEM","1"
"SPATT","BII1","A91009","D","Crediti diversi derivanti da entrate a seguito di spese non andate a buon fine","+","SYSTEM","SYSTEM","1"
"SPPAS","D2","P22021","A","Debiti verso fornitori per manutenzione straordinaria fabbricati industriali e costruzioni leggere","+","SYSTEM","SYSTEM","1"
"SPPAS","D2","P22022","A","Debiti verso fornitori per acquisto e costruzione fabbricati rurali","+","SYSTEM","SYSTEM","1"
"SPPAS","D2","P22023","A","Debiti verso fornitori per manutenzione straordinaria fabbricati rurali","+","SYSTEM","SYSTEM","1"
"SPPAS","D2","P22024","A","Debiti verso fornitori - materiale bibliografico","+","SYSTEM","SYSTEM","1"
"SPPAS","D2","P22025","A","Debiti verso fornitori - terreni agricoli","+","SYSTEM","SYSTEM","1"
"SPPAS","D2","P22026","A","Debiti verso fornitori - terreni edificabili","+","SYSTEM","SYSTEM","1"
"SPPAS","D2","P22028","A","Debiti verso fornitori - ripristino e adattamento immobili in locazione, in comodato o in uso","+","SYSTEM","SYSTEM","1"
"SPPAS","D2","P22029","A","Debiti verso fornitori per acquisto dispositivi di telefonia mobile e tablet","+","SYSTEM","SYSTEM","1"
"SPPAS","D2","P22030","A","Debiti verso fornitori per acquisto dispositivi di telefonia fissa","+","SYSTEM","SYSTEM","1"
"CE","A1","R21051","A","Finanziamenti da imprese partecipate","+","SYSTEM","SYSTEM","1"
"CE","A1","R21052","A","Finanziamenti da altre imprese","+","SYSTEM","SYSTEM","1"
"CE","A1","R21053","A","Finanziamenti da Istituzioni Sociali Private (ONLUS, fondazioni, ONG)","+","SYSTEM","SYSTEM","1"
"CE","A1","R21054","A","Finanziamenti della Comunit? Europea nell'ambito dei Programmi Quadro","+","SYSTEM","SYSTEM","1"
"CE","A1","R21055","A","Finanziamenti della Comunit? Europea per il Programma ""Horizon 2020""","+","SYSTEM","SYSTEM","1"
"CE","D20","C19005","D","Costi per rimborsi di parte corrente a Famiglie di somme non dovute o incassate in eccesso","+","SYSTEM","SYSTEM","1"
"CE","D20","C19006","D","Costi per rimborsi di parte corrente a Imprese di somme non dovute o incassate in eccesso","+","SYSTEM","SYSTEM","1"
"CE","D21","C44001","D","Minusvalenze da alienazione di autovetture","+","SYSTEM","SYSTEM","1"
"CE","D21","C44002","D","Minusvalenze da alienazione di altri automezzi","+","SYSTEM","SYSTEM","1"
"CE","D21","C44003","D","Minusvalenze da alienazione di velivoli","+","SYSTEM","SYSTEM","1"
"CE","D21","C44004","D","Minusvalenze da alienazione di battelli ed imbarcazioni","+","SYSTEM","SYSTEM","1"
"CE","D21","C44005","D","Minusvalenza da alienazione di altri mezzi di trasporto ","+","SYSTEM","SYSTEM","1"
"CE","D21","C44006","D","Minusvalenza da alienazione di mobili e arredi per ufficio","+","SYSTEM","SYSTEM","1"
"CE","D21","C44007","D","Minusvalenza da alienazione di Macchinari","+","SYSTEM","SYSTEM","1"
"CE","D21","C44008","D","Minusvalenza da alienazione di impianti","+","SYSTEM","SYSTEM","1"
"CE","D21","C44009","D","Minusvalenza da alienazione di attrezzature scientifiche","+","SYSTEM","SYSTEM","1"
"CE","D21","C44010","D","Minusvalenza da alienazione di attrezzature sanitarie","+","SYSTEM","SYSTEM","1"
"CE","D21","C44011","D","Minusvalenza da alienazione di attrezzature diverse","+","SYSTEM","SYSTEM","1"
"CE","D21","C44012","D","Minusvalenza da alienazione di Macchinari per ufficio","+","SYSTEM","SYSTEM","1"
"CE","D21","C44013","D","Minusvalenza da Alienazione di server","+","SYSTEM","SYSTEM","1"
"CE","D21","C44014","D","Minusvalenza da Alienazione di postazioni di lavoro","+","SYSTEM","SYSTEM","1"
"CE","D21","C44015","D","Minusvalenza da Alienazione di periferiche","+","SYSTEM","SYSTEM","1"
"CE","D21","C44016","D","Minusvalenza da Alienazione di apparati di telecomunicazione","+","SYSTEM","SYSTEM","1"
"CE","D21","C44017","D","Minusvalenza da Alienazione di altro hardware","+","SYSTEM","SYSTEM","1"
"CE","D21","C44018","D","Minusvalenza da alienazione di Fabbricati ad uso abitativo","+","SYSTEM","SYSTEM","1"
"CE","D21","C44020","D","Minusvalenza da alienazione di Fabbricati industriali e costruzioni leggere","+","SYSTEM","SYSTEM","1"
"CE","D21","C44021","D","Minusvalenza da alienazione di Fabbricati rurali","+","SYSTEM","SYSTEM","1"
"CE","D21","C44022","D","Minusvalenza da alienazione di Fabbricati Ospedalieri e altre strutture sanitarie","+","SYSTEM","SYSTEM","1"
"CE","D21","C44023","D","Minusvalenza da alienazione di Infrastrutture telematiche","+","SYSTEM","SYSTEM","1"
"CE","D21","C44024","D","Minusvalenza da alienazione di altri beni immobili","+","SYSTEM","SYSTEM","1"
"CE","D21","C44025","D","Minusvalenza da alienazione di Oggetti di valore","+","SYSTEM","SYSTEM","1"
"CE","D21","C44026","D","Minusvalenza da alienazione di diritti reali","+","SYSTEM","SYSTEM","1"
"CE","D21","C44027","D","Minusvalenza da alienazione di Materiale bibliografico","+","SYSTEM","SYSTEM","1"
"CE","D21","C44028","D","Minusvalenza da cessione di Terreni agricoli","+","SYSTEM","SYSTEM","1"
"CE","D21","C44029","D","Minusvalenza da cessione di Terreni edificabili","+","SYSTEM","SYSTEM","1"
"CE","D21","C44030","D","Minusvalenza da Alienazione di software","+","SYSTEM","SYSTEM","1"
"CE","D21","C44031","D","Minusvalenza da alienazione di Brevetti","+","SYSTEM","SYSTEM","1"
"CE","D21","C44032","D","Minusvalenza da alienazione di Opere dell'ingegno e Diritti d'autore","+","SYSTEM","SYSTEM","1"
"CE","D21","C44033","D","Minusvalenza da alienazione di altri beni immateriali ","+","SYSTEM","SYSTEM","1"
"CE","D21","C44034","D","Minusvalenza da alienazione di mobili e arredi per alloggi e pertinenze","+","SYSTEM","SYSTEM","1"
"CE","D21","C44035","D","Minusvalenza da alienazione di mobili e arredi a uso esclusivo dei laboratori","+","SYSTEM","SYSTEM","1"
"CE","D21","C51001","D","Minusvalenze da Alienazione di partecipazioni in imprese controllate","+","SYSTEM","SYSTEM","1"
"CE","D21","C51002","D","Minusvalenze da Alienazione di partecipazioni in altre imprese partecipate","+","SYSTEM","SYSTEM","1"
"CE","D21","C51003","D","Minusvalenze da Alienazione di partecipazioni in altre imprese","+","SYSTEM","SYSTEM","1"
"SPATT","AIII2b","A31002B","D","Polizza INA ASSITALIA  n. 9.003.583 (personale ex INSEAN)","+","SYSTEM","SYSTEM","1"
"SPATT","AII1","P00032","A","Fondi ammortamento di Fabbricati ad uso commerciale e istituzionale","-","SYSTEM","SYSTEM","1"
"SPATT","AII1","P00033","A","Fondi ammortamento di Fabbricati industriali e costruzioni leggere","-","SYSTEM","SYSTEM","1"
"SPATT","AII1","P00036","A","Fondi ammortamento di Infrastrutture telematiche","-","SYSTEM","SYSTEM","1"
"SPATT","AII1","A22018","D","Fabbricati ad uso commerciale e istituzionale","+","SYSTEM","SYSTEM","1"
"SPATT","AII1","A22020","D","Fabbricati industriali e costruzioni leggere","+","SYSTEM","SYSTEM","1"
"SPATT","AII1","A22021","D","Manutenzione straordinaria fabbricati industriali e costruzioni leggere","+","SYSTEM","SYSTEM","1"
"SPATT","AII1","A22025","D","Terreni agricoli","+","SYSTEM","SYSTEM","1"
"SPATT","AII3","A22008","D","Macchinari","+","SYSTEM","SYSTEM","1"
"CE","B4","C13003","D","Carta, cancelleria e stampati","+","SYSTEM","SYSTEM","1"
"CE","B4","C13004","D","Carburanti, combustibili e lubrificanti ","+","SYSTEM","SYSTEM","1"
"CE","B4","C13005","D","Carburanti, combustibili e lubrificanti per autovetture","+","SYSTEM","SYSTEM","1"
"CE","B4","C13006","D","Carburanti, combustibili e lubrificanti per altri mezzi di trasporto stradali","+","SYSTEM","SYSTEM","1"
"CE","B4","C13007","D","Carburanti, combustibili e lubrificanti per natanti, imbarcazioni e velivoli","+","SYSTEM","SYSTEM","1"
"CE","B4","C13008","D","Equipaggiamento","+","SYSTEM","SYSTEM","1"
"CE","B4","C13009","D","Vestiario","+","SYSTEM","SYSTEM","1"
"CE","B4","C13010","D","Accessori per uffici e alloggi","+","SYSTEM","SYSTEM","1"
"CE","B4","C13011","D","Materiale informatico","+","SYSTEM","SYSTEM","1"
"CE","B4","C13012","D","Altri materiali tecnico-specialistici non sanitari","+","SYSTEM","SYSTEM","1"
"CE","B4","C13013","D","Strumenti tecnico-specialistici non sanitari","+","SYSTEM","SYSTEM","1"
"CE","B4","C13014","D","Beni per attivit? di rappresentanza","+","SYSTEM","SYSTEM","1"
"CE","B4","C13015","D","Generi alimentari","+","SYSTEM","SYSTEM","1"
"SPATT","AII6","P00015","A","Fondo ammortamento mezzi di trasporto per vie d'acqua","-","SYSTEM","SYSTEM","1"
"SPATT","AII6","A22003","D","Mezzi di trasporto aerei","+","SYSTEM","SYSTEM","1"
"SPATT","AII6","A22004","D","Mezzi di trasporto per vie d'acqua","+","SYSTEM","SYSTEM","1"
"SPATT","AII7","A22018B","D","Immobilizzazioni materiali in costruzione - Fabbricati istituzionali","+","SYSTEM","SYSTEM","1"
"SPATT","AII7","A22022B","D","Immobilizzazioni materiali in costruzione - Infrastrutture telematiche","+","SYSTEM","SYSTEM","1"
"SPATT","AI1","A00058","D","Brevetti","+","SYSTEM","SYSTEM","1"
"SPATT","AI2","A00061","D","Altre immobilizzazioni immateriali n.a.c.","+","SYSTEM","SYSTEM","1"
"SPATT","AI3","P00039","A","Fondo ammortamento opere dell'ingegno e diritti d'autore","-","SYSTEM","SYSTEM","1"
"SPATT","AI3","A00059","D","Opere dell'ingegno e Diritti d'autore","+","SYSTEM","SYSTEM","1"
"SPATT","BIII1","A00056","D","Depositi postali","+","SYSTEM","SYSTEM","1"
"SPATT","BIII1","A00001","D","Denaro e valori in cassa","+","SYSTEM","SYSTEM","1"
"SPATT","BII1","A21002","D","Crediti per finanziamenti MIUR in attuazione della nuova intesa di programma per il Mezzogiorno","+","SYSTEM","SYSTEM","1"
"SPATT","BII1","A21004","D","Crediti per finanziamenti MIUR per l'attivit? di sviluppo delle aree depresse (CLUSTER)","+","SYSTEM","SYSTEM","1"
"SPATT","BII1","A21005","D","Crediti per finanziamenti MIUR relativi al Fondo per gli Investimenti della Ricerca di Base (FIRB)","+","SYSTEM","SYSTEM","1"
"SPATT","BII1","A21006","D","Crediti per finanziamenti MIUR relativi al Fondo Integrativo Speciale per la Ricerca (FISR)","+","SYSTEM","SYSTEM","1"
"SPATT","BII1","A21007","D","Crediti per finanziamenti MIUR relativi al Fondo Agevolato per la Ricerca Industriale (FAR)","+","SYSTEM","SYSTEM","1"
"SPATT","BII1","A21011","D","Crediti per finanziamenti MIUR per altre iniziative progettuali","+","SYSTEM","SYSTEM","1"
"SPATT","BII1","A21012","D","Crediti per finanziamenti MEF ai sensi della legge 16 aprile 1987, n. 183 (Fondo di rotazione)","+","SYSTEM","SYSTEM","1"
"SPATT","BII1","A21013","D","Crediti per finanziamenti MiSE relativi al progetto Industria 2015","+","SYSTEM","SYSTEM","1"
"SPATT","BII1","A21014","D","Crediti per altri finanziamenti e contributi ministeriali","+","SYSTEM","SYSTEM","1"
"SPATT","BII1","A21015","D","Crediti per Trasferimenti correnti da Presidenza del Consiglio dei Ministri","+","SYSTEM","SYSTEM","1"
"SPATT","BII1","A21016","D","Crediti per Trasferimenti correnti da Organi Costituzionali e di rilievo costituzionale","+","SYSTEM","SYSTEM","1"
"SPATT","BII1","A21017","D","Crediti per Trasferimenti correnti da Agenzie Fiscali","+","SYSTEM","SYSTEM","1"
"SPATT","BII1","A21018","D","Crediti per Trasferimenti correnti da enti di regolazione dell'attivit? economica","+","SYSTEM","SYSTEM","1"
"SPATT","BII1","A21020","D","Crediti per Trasferimenti correnti da Anas S.p.A.","+","SYSTEM","SYSTEM","1"
"SPATT","BII1","A21021","D","Crediti per Trasferimenti correnti da altri enti centrali produttori di servizi economici","+","SYSTEM","SYSTEM","1"
"SPATT","BII1","A21022","D","Crediti per Trasferimenti correnti da autorit? amministrative indipendenti","+","SYSTEM","SYSTEM","1"
"SPATT","BII1","A21025","D","Crediti per finanziamenti delle Regioni relativi ai Programmi Operativi Regionali (POR)","+","SYSTEM","SYSTEM","1"
"SPATT","BII1","A21026","D","Crediti per altri finanziamenti da Regioni e province autonome","+","SYSTEM","SYSTEM","1"
"SPATT","BII1","A21027","D","Crediti per Trasferimenti correnti da Province","+","SYSTEM","SYSTEM","1"
"SPATT","BII1","A21028","D","Crediti per Trasferimenti correnti da Comuni","+","SYSTEM","SYSTEM","1"
"SPATT","BII1","A21030","D","Crediti per Trasferimenti correnti da Unioni di Comuni","+","SYSTEM","SYSTEM","1"
"SPATT","BII1","A21031","D","Crediti per Trasferimenti correnti da Comunit? Montane","+","SYSTEM","SYSTEM","1"
"SPATT","BII1","A21032","D","Crediti per Trasferimenti correnti da Camere di Commercio","+","SYSTEM","SYSTEM","1"
"SPATT","BII1","A21033","D","Crediti per Trasferimenti correnti da Universit?","+","SYSTEM","SYSTEM","1"
"SPATT","BII1","A21035","D","Crediti per Trasferimenti correnti da Autorit? Portuali","+","SYSTEM","SYSTEM","1"
"SPATT","BII1","A21036","D","Crediti per Trasferimenti correnti da Aziende sanitarie locali ","+","SYSTEM","SYSTEM","1"
"SPATT","BII1","A21038","D","Crediti per Trasferimenti correnti da Policlinici","+","SYSTEM","SYSTEM","1"
"SPATT","BII1","A21040","D","Crediti per Trasferimenti correnti da altre Amministrazioni Locali produttrici di servizi sanitari","+","SYSTEM","SYSTEM","1"
"SPATT","BII1","A21041","D","Crediti per Trasferimenti correnti da Agenzie regionali per le erogazioni in agricoltura","+","SYSTEM","SYSTEM","1"
"SPATT","BII1","A21042","D","Crediti per Trasferimenti correnti da altri enti e agenzie regionali e sub regionali","+","SYSTEM","SYSTEM","1"
"SPATT","BII1","A21043","D","Crediti per Trasferimenti correnti da Consorzi di enti locali","+","SYSTEM","SYSTEM","1"
"SPATT","BII1","A21045","D","Crediti per Trasferimenti correnti da altre Amministrazioni Locali ","+","SYSTEM","SYSTEM","1"
"SPATT","BII1","A21046","D","Crediti per Trasferimenti correnti da INPS","+","SYSTEM","SYSTEM","1"
"SPATT","BII1","A21047","D","Crediti per Trasferimenti correnti da INAIL","+","SYSTEM","SYSTEM","1"
"SPATT","BII1","A21048","D","Crediti per Trasferimenti correnti da altri Enti di Previdenza","+","SYSTEM","SYSTEM","1"
"SPATT","BII1","A21051","D","Crediti per Altri trasferimenti correnti da altre imprese partecipate","+","SYSTEM","SYSTEM","1"
"SPATT","BII1","A21052","D","Crediti per Altri trasferimenti correnti da altre imprese","+","SYSTEM","SYSTEM","1"
"SPATT","BII1","A21057","D","Crediti per altri finanziamenti della Comunit? Europea","+","SYSTEM","SYSTEM","1"
"SPATT","BI1","A00067","D","Rimanenze di prodotti finiti","+","SYSTEM","SYSTEM","1"
"SPATT","F2","O.01.008","D","Altri conti d'ordine","+","SYSTEM","SYSTEM","1"
"CE","C14","C17005","D","Interessi di mora ad altri soggetti","+","SYSTEM","SYSTEM","1"
"CE","D20","C19001","D","Costi per rimborsi per spese di personale (comando, distacco)","+","SYSTEM","SYSTEM","1"
"CE","D20","C19002","D","Costi per rimborsi di trasferimenti all'Unione Europea","+","SYSTEM","SYSTEM","1"
