TI_APPARTENENZA,TI_GESTIONE,CD_ELEMENTO_VOCE,CD_PROPRIO_ELEMENTO,TI_ELEMENTO_VOCE,FL_LIMITE_ASS_OBBLIG,FL_VOCE_PERSONALE,DS_ELEMENTO_VOCE,FL_PARTITA_GIRO,CD_CAPOCONTO_FIN,FL_VOCE_SAC,FL_VOCE_NON_SOGG_IMP_AUT,COD_CLA_E,COD_CLA_S,FL_RECON,FL_INV_BENI_PATR,ID_CLASSIFICAZIONE,FL_VOCE_FONDO,FL_CHECK_TERZO_SIOPE,FL_INV_BENI_COMP,FL_LIMITE_SPESA,FL_PRELIEVO,FL_SOGGETTO_PRELIEVO,PERC_PRELIEVO_PDGP_ENTRATE,FL_SOLO_RESIDUO,FL_SOLO_COMPETENZA,FL_TROVATO,FL_AZZERA_RESIDUI,FL_MISSIONI,UTCR,UTUV,PG_VER_REC
"C","E","31021","31021","C",,"N","Diritti reali di godimento","N","NULL","N","N","11","NULL","Y","N","776","N","N","N","N","N","N",0,"N","N","N","N","N","SYSTEM","SYSTEM","1"
"C","E","31022","31022","C",,"N","Fitti di terreni","N","NULL","N","N","11","NULL","Y","N","779","N","N","N","N","N","N",0,"N","N","N","N","N","SYSTEM","SYSTEM","1"
"C","E","31023","31023","C",,"N","Canoni di locazione di immobili di proprieta'","N","NULL","N","N","11","NULL","Y","N","781","N","N","N","N","N","N",0,"N","N","N","N","N","SYSTEM","SYSTEM","1"
"C","E","31024","31024","C",,"N","Locazioni di beni mobili","N","NULL","N","N","11","NULL","Y","N","783","N","N","N","N","N","N",0,"N","N","N","N","N","SYSTEM","SYSTEM","1"
"C","E","33001","33001","C",,"N","Interessi attivi di mora da Amministrazioni Centrali","N","NULL","N","N","NULL","NULL","N","N","793","N","N","N","N","N","N",0,"N","N","N","N","N","SYSTEM","SYSTEM","1"
"C","E","33002","33002","C",,"N","Interessi attivi di mora da Amministrazioni Locali","N","NULL","N","N","11","NULL","N","N","795","N","N","N","N","N","N",0,"N","N","N","N","N","SYSTEM","SYSTEM","1"
"C","E","33003","33003","C",,"N","Interessi attivi di mora da Enti previdenziali","N","NULL","N","N","11","NULL","N","N","797","N","N","N","N","N","N",0,"N","N","N","N","N","SYSTEM","SYSTEM","1"
"C","E","33004","33004","C",,"N","Interessi attivi di mora da altri soggetti","N","NULL","N","N","11","NULL","N","N","799","N","N","N","N","N","N",0,"N","N","N","N","N","SYSTEM","SYSTEM","1"
"C","E","33005","33005","C",,"N","Interessi attivi da conti della tesoreria dello Stato o di altre Amministrazioni pubbliche","N","NULL","N","N","11","NULL","N","N","802","N","N","N","N","N","N",0,"N","N","N","N","N","SYSTEM","SYSTEM","1"
"C","E","33006","33006","C",,"N","Interessi attivi da depositi bancari o postali","N","NULL","N","N","11","NULL","N","N","805","N","N","N","N","N","N",0,"N","N","N","N","N","SYSTEM","SYSTEM","1"
"C","E","33007","33007","C",,"N","Altri interessi attivi da Amministrazioni Centrali","N","NULL","N","N","11","NULL","N","N","808","N","N","N","N","N","N",0,"N","N","N","N","N","SYSTEM","SYSTEM","1"
"C","E","33008","33008","C",,"N","Altri interessi attivi da Amministrazioni Locali","N","NULL","N","N","11","NULL","N","N","810","N","N","N","N","N","N",0,"N","N","N","N","N","SYSTEM","SYSTEM","1"
"C","E","33009","33009","C",,"N","Altri interessi attivi da Enti previdenziali","N","NULL","N","N","11","NULL","N","N","812","N","N","N","N","N","N",0,"N","N","N","N","N","SYSTEM","SYSTEM","1"
"C","E","33010","33010","C",,"N","Altri interessi attivi da altri soggetti","N","NULL","N","N","11","NULL","N","N","814","N","N","N","N","N","N",0,"N","N","N","N","N","SYSTEM","SYSTEM","1"
"C","E","35001","35001","C",,"N","Indennizzi assicurativi su beni immobili","N","NULL","N","N","12","NULL","N","N","819","N","N","N","N","N","N",0,"N","N","N","N","N","SYSTEM","SYSTEM","1"
"C","E","35002","35002","C",,"N","Indennizzi assicurativi su beni mobili","N","NULL","N","N","12","NULL","N","N","821","N","N","N","N","N","N",0,"N","N","N","N","N","SYSTEM","SYSTEM","1"
"C","E","35003","35003","C",,"N","Altri indennizzi assicurativi contro i danni","N","NULL","N","N","12","NULL","N","N","823","N","N","N","N","N","N",0,"N","N","N","N","N","SYSTEM","SYSTEM","1"
"C","E","35004","35004","C",,"N","Altri indennizzi assicurativi","N","NULL","N","N","12","NULL","N","N","826","N","N","N","N","N","N",0,"N","N","N","N","N","SYSTEM","SYSTEM","1"
"C","E","35005","35005","C",,"N","Rimborsi ricevuti per spese di personale (comando, distacco, fuori ruolo, convenzioni, ecc?) ","N","NULL","N","N","12","NULL","N","N","830","N","N","N","N","N","N",0,"N","N","N","N","N","SYSTEM","SYSTEM","1"
"C","E","35006","35006","C",,"N","Entrate per rimborsi di imposte indirette","N","NULL","N","N","12","NULL","N","N","833","N","N","N","N","N","N",0,"N","N","N","N","N","SYSTEM","SYSTEM","1"
"C","E","35007","35007","C",,"N","Entrate da rimborsi di IVA a credito","N","NULL","N","N","12","NULL","N","N","835","N","N","N","N","N","N",0,"N","N","N","N","N","SYSTEM","SYSTEM","1"
"C","E","35008","35008","C",,"N","Entrate da rimborsi di imposte dirette","N","NULL","N","N","12","NULL","N","N","837","N","N","N","N","N","N",0,"N","N","N","N","N","SYSTEM","SYSTEM","1"
"C","E","35009","35009","C",,"N","Entrate da rimborsi, recuperi e restituzioni di somme non dovute o incassate in eccesso da Amministrazioni Centrali","N","NULL","N","N","12","NULL","N","N","840","N","N","N","N","N","N",0,"N","N","N","N","N","SYSTEM","SYSTEM","1"
"C","E","35010","35010","C",,"N","Entrate da rimborsi, recuperi e restituzioni di somme non dovute o incassate in eccesso da Amministrazioni Locali","N","NULL","N","N","12","NULL","N","N","842","N","N","N","N","N","N",0,"N","N","N","N","N","SYSTEM","SYSTEM","1"
"C","E","35011","35011","C",,"N","Entrate da rimborsi, recuperi e restituzioni di somme non dovute o incassate in eccesso da Enti Previdenziali","N","NULL","N","N","12","NULL","N","N","844","N","N","N","N","N","N",0,"N","N","N","N","N","SYSTEM","SYSTEM","1"
"C","E","35012","35012","C",,"N","Restituzione di ratei di borse di studio","N","NULL","N","N","12","NULL","N","N","846","N","N","N","N","N","N",0,"N","N","N","N","N","SYSTEM","SYSTEM","1"
"C","E","35013","35013","C",,"N","Entrate da rimborsi, recuperi e restituzioni di somme non dovute o incassate in eccesso da Famiglie","N","NULL","N","N","12","NULL","N","N","847","N","N","N","N","N","N",0,"N","N","N","N","N","SYSTEM","SYSTEM","1"
"C","E","35014","35014","C",,"N","Entrate da rimborsi, recuperi e restituzioni di somme non dovute o incassate in eccesso da Imprese","N","NULL","N","N","12","NULL","N","N","849","N","N","N","N","N","N",0,"N","N","N","N","N","SYSTEM","SYSTEM","1"
"C","E","35015","35015","C",,"N","Entrate da rimborsi, recuperi e restituzioni di somme non dovute o incassate in eccesso da Istituzioni Sociali Private","N","NULL","N","N","12","NULL","N","N","851","N","N","N","N","N","N",0,"N","N","N","N","N","SYSTEM","SYSTEM","1"
"C","E","35016","35016","C",,"N","Entrate da rimborsi, recuperi e restituzioni di somme non dovute o incassate in eccesso dal Resto del mondo","N","NULL","N","N","12","NULL","N","N","853","N","N","N","N","N","N",0,"N","N","N","N","N","SYSTEM","SYSTEM","1"
"C","E","35017","35017","C",,"N","Incassi per azioni di regresso nei confronti di terzi","N","NULL","N","N","12","NULL","N","N","856","N","N","N","N","N","N",0,"Y","N","N","Y","N","SYSTEM","SYSTEM","1"
"C","E","35018","35018","C",,"N","Incassi per azioni di surroga nei confronti di terzi","N","NULL","N","N","12","NULL","N","N","858","N","N","N","N","N","N",0,"Y","N","N","Y","N","SYSTEM","SYSTEM","1"
"C","E","35019","35019","C",,"N","Altre entrate correnti","N","NULL","N","N","12","NULL","N","N","862","N","N","N","N","N","N",0,"N","N","N","N","N","SYSTEM","SYSTEM","1"
"C","E","44001","44001","C",,"N","Alienazione di autovetture","N","NULL","N","N","09","NULL","Y","Y","876","N","N","N","N","N","N",0,"N","N","N","N","N","SYSTEM","SYSTEM","1"
"C","E","44002","44002","C",,"N","Alienazione di altri automessi e di mezzi di trasporto terrestri","N","NULL","N","N","09","NULL","Y","Y","877","N","N","N","N","N","N",0,"N","N","N","N","N","SYSTEM","SYSTEM","1"
"C","E","44003","44003","C",,"N","Alienazione di velivoli","N","NULL","N","N","09","NULL","Y","Y","879","N","N","N","N","N","N",0,"N","N","N","N","N","SYSTEM","SYSTEM","1"
"C","E","44004","44004","C",,"N","Alienazione di battelli ed imbarcazioni","N","NULL","N","N","09","NULL","Y","Y","881","N","N","N","N","N","N",0,"N","N","N","N","N","SYSTEM","SYSTEM","1"
"C","E","44005","44005","C",,"N","Alienazione di altri mezzi di trasporto","N","NULL","N","N","09","NULL","Y","Y","883","N","N","N","N","N","N",0,"Y","N","N","Y","N","SYSTEM","SYSTEM","1"
"C","E","44006","44006","C",,"N","Alienazione di mobili e arredi per ufficio","N","NULL","N","N","09","NULL","Y","Y","886","N","N","N","N","N","N",0,"N","N","N","N","N","SYSTEM","SYSTEM","1"
"C","E","44007","44007","C",,"N","Alienazione di macchinari","N","NULL","N","N","09","NULL","Y","Y","893","N","N","N","N","N","N",0,"N","N","N","N","N","SYSTEM","SYSTEM","1"
"C","E","44008","44008","C",,"N","Alienazione di impianti","N","NULL","N","N","09","NULL","Y","Y","895","N","N","N","N","N","N",0,"N","N","N","N","N","SYSTEM","SYSTEM","1"
"C","E","44009","44009","C",,"N","Alienazione di attrezzature scientifiche","N","NULL","N","N","09","NULL","Y","Y","898","N","N","N","N","N","N",0,"N","N","N","N","N","SYSTEM","SYSTEM","1"
"C","E","44010","44010","C",,"N","Alienazione di attrezzature sanitarie","N","NULL","N","N","09","NULL","Y","Y","900","N","N","N","N","N","N",0,"N","N","N","N","N","SYSTEM","SYSTEM","1"
"C","E","44011","44011","C",,"N","Alienazione di altre attrezzature","N","NULL","N","N","09","NULL","Y","Y","902","N","N","N","N","N","N",0,"N","N","N","N","N","SYSTEM","SYSTEM","1"
"C","E","44012","44012","C",,"N","Alienazione di macchine per ufficio","N","NULL","N","N","09","NULL","Y","Y","905","N","N","N","N","N","N",0,"N","N","N","N","N","SYSTEM","SYSTEM","1"
"C","E","44013","44013","C",,"N","Alienazione di server","N","NULL","N","N","09","NULL","Y","Y","908","N","N","N","N","N","N",0,"N","N","N","N","N","SYSTEM","SYSTEM","1"
"C","E","44014","44014","C",,"N","Alienazione di postazioni di lavoro","N","NULL","N","N","09","NULL","Y","Y","910","N","N","N","N","N","N",0,"N","N","N","N","N","SYSTEM","SYSTEM","1"
"C","E","44015","44015","C",,"N","Alienazione di periferiche","N","NULL","N","N","09","NULL","Y","Y","912","N","N","N","N","N","N",0,"N","N","N","N","N","SYSTEM","SYSTEM","1"
"C","E","44016","44016","C",,"N","Alienazione di apparati di telecomunicazione","N","NULL","N","N","09","NULL","Y","Y","914","N","N","N","N","N","N",0,"N","N","N","N","N","SYSTEM","SYSTEM","1"
"C","E","44017","44017","C",,"N","Alienazione di altro hardware","N","NULL","N","N","09","NULL","Y","Y","916","N","N","N","N","N","N",0,"N","N","N","N","N","SYSTEM","SYSTEM","1"
"C","E","44018","44018","C",,"N","Alienazione di fabbricati ad uso abitativo","N","NULL","Y","N","09","NULL","Y","Y","919","N","N","N","N","N","N",0,"Y","N","N","Y","N","SYSTEM","SYSTEM","1"
"C","E","44019","44019","C",,"N","Alienazione di fabbricati ad uso strumentale","N","NULL","Y","N","09","NULL","Y","Y","929","N","N","N","N","N","N",0,"N","N","N","N","N","SYSTEM","SYSTEM","1"
"C","E","44020","44020","C",,"N","Alienazione di fabbricati industriali e costruzioni leggere","N","NULL","Y","N","09","NULL","Y","Y","921","N","N","N","N","N","N",0,"N","N","N","N","N","SYSTEM","SYSTEM","1"
"C","E","44021","44021","C",,"N","Alienazione di fabbricati rurali","N","NULL","Y","N","09","NULL","Y","Y","923","N","N","N","N","N","N",0,"N","N","N","N","N","SYSTEM","SYSTEM","1"
"C","E","44022","44022","C",,"N","Alienazione di fabbricati ospedalieri e altre strutture sanitarie","N","NULL","Y","N","09","NULL","Y","Y","925","N","N","N","N","N","N",0,"N","N","N","N","N","SYSTEM","SYSTEM","1"
"C","E","44023","44023","C",,"N","Alienazione di infrastrutture telematiche","N","NULL","Y","N","09","NULL","Y","Y","927","N","N","N","N","N","N",0,"N","N","N","N","N","SYSTEM","SYSTEM","1"
"C","E","44024","44024","C",,"N","Alienazione di altri beni immobili","N","NULL","Y","N","09","NULL","Y","Y","931","N","N","N","N","N","N",0,"N","N","N","N","N","SYSTEM","SYSTEM","1"
"C","E","44025","44025","C",,"N","Alienazione di oggetti di valore","N","NULL","N","N","09","NULL","Y","Y","934","N","N","N","N","N","N",0,"N","N","N","N","N","SYSTEM","SYSTEM","1"
"C","E","92006","92006","C","N","N","Trasferimenti da Agenzie Fiscali per operazioni conto terzi","Y","NULL","N","N","NULL","NULL","N","N","1226","N","N","N","N","N","N",0,"Y","N","N","N","N","SYSTEM","SYSTEM","1"
"C","E","92007","92007","C","N","N","Trasferimenti da enti di regolazione dell'attivita' economica per operazioni conto terzi","Y","NULL","N","N","NULL","NULL","N","N","1228","N","N","N","N","N","N",0,"Y","N","N","N","N","SYSTEM","SYSTEM","1"
"C","E","92008","92008","C","N","N","Trasferimenti da Gruppo Equitalia per operazioni conto terzi","Y","NULL","N","N","NULL","NULL","N","N","1230","N","N","N","N","N","N",0,"Y","N","N","N","N","SYSTEM","SYSTEM","1"
"D","S","71003","71003","C","Y","N","Versamenti di ritenute erariali su redditi da lavoro dipendente riscosse per conto terzi","Y","NULL","N","N","NULL","NULL","N","N","1010","N","N","N","N","N","N",0,"N","N","N","N","N","SYSTEM","SYSTEM","1"
"D","S","71004","71004","C","Y","N","Versamenti di ritenute previdenziali e assistenziali su redditi da lavoro dipendente riscosse per conto terzi","Y","NULL","N","N","NULL","NULL","N","N","1013","N","N","N","N","N","N",0,"N","N","N","N","N","SYSTEM","SYSTEM","1"
"D","S","71005","71005","C","Y","N","Altri versamenti di ritenute al personale dipendente per conto di terzi","Y","NULL","N","N","NULL","NULL","N","N","1016","N","N","N","N","N","N",0,"N","N","N","N","N","SYSTEM","SYSTEM","1"
"D","S","71006","71006","C","Y","N","Versamenti di ritenute erariali su redditi da lavoro autonomo per conto terzi","Y","NULL","N","N","NULL","NULL","N","N","1020","N","N","N","N","N","N",0,"N","N","N","N","N","SYSTEM","SYSTEM","1"
"D","S","71007","71007","C","Y","N","Versamenti di ritenute previdenziali e assistenziali su redditi da lavoro autonomo per conto terzi","Y","NULL","N","N","NULL","NULL","N","N","1023","N","N","N","N","N","N",0,"N","N","N","N","N","SYSTEM","SYSTEM","1"
"D","S","71008","71008","C","Y","N","Altri versamenti di ritenute al personale con contratto di lavoro autonomo per conto di terzi","Y","NULL","N","N","NULL","NULL","N","N","1026","N","N","N","N","N","N",0,"N","N","N","N","N","SYSTEM","SYSTEM","1"
"D","S","71009","71009","C","Y","N","Spese non andate a buon fine","Y","NULL","N","N","NULL","NULL","N","N","1030","N","N","N","N","N","N",0,"N","N","N","N","N","SYSTEM","SYSTEM","1"
"D","S","71010","71010","C","Y","N","Costituzione fondi economali e carte aziendali","Y","NULL","N","N","NULL","NULL","N","N","1033","N","N","N","N","N","N",0,"N","N","N","N","N","SYSTEM","SYSTEM","1"
"D","S","71011","71011","C","Y","N","Altre uscite per partite di giro","Y","NULL","N","N","NULL","NULL","N","N","1036","N","N","N","N","N","N",0,"N","N","N","N","N","SYSTEM","SYSTEM","1"
"D","S","71012","71012","C","Y","N","Versamento delle ritenute per scissione contabile IVA (split payment)","Y","NULL","N","N","NULL","NULL","N","N","1000","N","N","N","N","N","N",0,"N","N","N","N","N","SYSTEM","SYSTEM","1"
"D","S","71013","71013","C","Y","N","Versamento delle ritenute erariali su prestazioni sociali","Y","NULL","N","N","NULL","NULL","N","N","1003","N","N","N","N","N","N",0,"N","N","N","N","N","SYSTEM","SYSTEM","1"
"D","S","72001","72001","C","Y","N","Acquisto di beni per conto di terzi","Y","NULL","N","N","NULL","NULL","N","N","1042","N","N","N","N","N","N",0,"Y","N","N","N","N","SYSTEM","SYSTEM","1"
"D","S","72002","72002","C","Y","N","Acquisto di servizi per conto di terzi","Y","NULL","N","N","NULL","NULL","N","N","1045","N","N","N","N","N","N",0,"Y","N","N","N","N","SYSTEM","SYSTEM","1"
"D","S","72003","72003","C","Y","N","Trasferimenti per conto terzi a Ministeri","Y","NULL","N","N","NULL","NULL","N","N","1049","N","N","N","N","N","N",0,"Y","N","N","N","N","SYSTEM","SYSTEM","1"
"D","S","72004","72004","C","Y","N","Trasferimenti per conto terzi a Presidenza del Consiglio dei Ministri","Y","NULL","N","N","NULL","NULL","N","N","1051","N","N","N","N","N","N",0,"Y","N","N","N","N","SYSTEM","SYSTEM","1"
"D","S","72005","72005","C","Y","N","Trasferimenti per conto terzi a Organi Costituzionali e di rilievo costituzionale","Y","NULL","N","N","NULL","NULL","N","N","1053","N","N","N","N","N","N",0,"Y","N","N","N","N","SYSTEM","SYSTEM","1"
"D","S","72006","72006","C","Y","N","Trasferimenti per conto terzi a Agenzie Fiscali","Y","NULL","N","N","NULL","NULL","N","N","1055","N","N","N","N","N","N",0,"Y","N","N","N","N","SYSTEM","SYSTEM","1"
"D","S","72007","72007","C","Y","N","Trasferimenti per conto terzi a enti di regolazione dell'attivita' economica","Y","NULL","N","N","NULL","NULL","N","N","1057","N","N","N","N","N","N",0,"Y","N","N","N","N","SYSTEM","SYSTEM","1"
"D","S","72008","72008","C","Y","N","Trasferimenti per conto terzi a Gruppo Equitalia","Y","NULL","N","N","NULL","NULL","N","N","1059","N","N","N","N","N","N",0,"Y","N","N","N","N","SYSTEM","SYSTEM","1"
"D","S","72009","72009","C","Y","N","Trasferimenti per conto terzi a Anas S.p.A.","Y","NULL","N","N","NULL","NULL","N","N","1061","N","N","N","N","N","N",0,"Y","N","N","N","N","SYSTEM","SYSTEM","1"
"D","S","72010","72010","C","Y","N","Trasferimenti per conto terzi a altri enti centrali produttori di servizi economici","Y","NULL","N","N","NULL","NULL","N","N","1063","N","N","N","N","N","N",0,"Y","N","N","N","N","SYSTEM","SYSTEM","1"
"D","S","72011","72011","C","Y","N","Trasferimenti per conto terzi a autorita' amministrative indipendenti","Y","NULL","N","N","NULL","NULL","N","N","1065","N","N","N","N","N","N",0,"Y","N","N","N","N","SYSTEM","SYSTEM","1"
"D","S","72012","72012","C","Y","N","Trasferimenti per conto terzi a enti centrali a struttura associativa","Y","NULL","N","N","NULL","NULL","N","N","1067","N","N","N","N","N","N",0,"Y","N","N","N","N","SYSTEM","SYSTEM","1"
"D","S","72013","72013","C","Y","N","Trasferimenti per conto terzi a enti centrali produttori di servizi assistenziali, ricreativi e culturali","Y","NULL","N","N","NULL","NULL","N","N","1069","N","N","N","N","N","N",0,"Y","N","N","N","N","SYSTEM","SYSTEM","1"
"D","S","72014","72014","C","Y","N","Trasferimenti per conto terzi a enti e istituzioni centrali di ricerca e Istituti e stazioni sperimentali per la ricerca","Y","NULL","N","N","NULL","NULL","N","N","1071","N","N","N","N","N","N",0,"Y","N","N","N","N","SYSTEM","SYSTEM","1"
"D","S","72015","72015","C","Y","N","Trasferimenti per conto terzi a altre Amministrazioni Centrali n.a.c.","Y","NULL","N","N","NULL","NULL","N","N","1073","N","N","N","N","N","N",0,"Y","N","N","N","N","SYSTEM","SYSTEM","1"
"D","S","72016","72016","C","Y","N","Trasferimenti per conto terzi a Regioni e province autonome","Y","NULL","N","N","NULL","NULL","N","N","1076","N","N","N","N","N","N",0,"Y","N","N","N","N","SYSTEM","SYSTEM","1"
"D","S","72017","72017","C","Y","N","Trasferimenti per conto terzi a Province","Y","NULL","N","N","NULL","NULL","N","N","1078","N","N","N","N","N","N",0,"Y","N","N","N","N","SYSTEM","SYSTEM","1"
"D","S","72018","72018","C","Y","N","Trasferimenti per conto terzi a Comuni","Y","NULL","N","N","NULL","NULL","N","N","1080","N","N","N","N","N","N",0,"Y","N","N","N","N","SYSTEM","SYSTEM","1"
"D","S","72019","72019","C","Y","N","Trasferimenti per conto terzi a Citta' metropolitane e Roma capitale","Y","NULL","N","N","NULL","NULL","N","N","1082","N","N","N","N","N","N",0,"Y","N","N","N","N","SYSTEM","SYSTEM","1"
"D","S","72020","72020","C","Y","N","Trasferimenti per conto terzi a Unioni di Comuni","Y","NULL","N","N","NULL","NULL","N","N","1084","N","N","N","N","N","N",0,"Y","N","N","N","N","SYSTEM","SYSTEM","1"
"D","S","72021","72021","C","Y","N","Trasferimenti per conto terzi a Comunita' Montane","Y","NULL","N","N","NULL","NULL","N","N","1086","N","N","N","N","N","N",0,"Y","N","N","N","N","SYSTEM","SYSTEM","1"
"D","S","72022","72022","C","Y","N","Trasferimenti per conto terzi a Camere di Commercio","Y","NULL","N","N","NULL","NULL","N","N","1088","N","N","N","N","N","N",0,"Y","N","N","N","N","SYSTEM","SYSTEM","1"
"D","S","72023","72023","C","Y","N","Trasferimenti per conto terzi a Universita'","Y","NULL","N","N","NULL","NULL","N","N","1090","N","N","N","N","N","N",0,"Y","N","N","N","N","SYSTEM","SYSTEM","1"
"D","S","72024","72024","C","Y","N","Trasferimenti per conto terzi a Parchi nazionali e consorzi ed enti autonomi gestori di parchi e aree naturali protette","Y","NULL","N","N","NULL","NULL","N","N","1092","N","N","N","N","N","N",0,"Y","N","N","N","N","SYSTEM","SYSTEM","1"
"D","S","72025","72025","C","Y","N","Trasferimenti per conto terzi a Autorita' Portuali","Y","NULL","N","N","NULL","NULL","N","N","1094","N","N","N","N","N","N",0,"Y","N","N","N","N","SYSTEM","SYSTEM","1"
"D","S","72026","72026","C","Y","N","Trasferimenti per conto terzi a Aziende sanitarie locali ","Y","NULL","N","N","NULL","NULL","N","N","1096","N","N","N","N","N","N",0,"Y","N","N","N","N","SYSTEM","SYSTEM","1"
"D","S","72027","72027","C","Y","N","Trasferimenti per conto terzi a Aziende ospedaliere e Aziende ospedaliere universitarie integrate con il SSN","Y","NULL","N","N","NULL","NULL","N","N","1098","N","N","N","N","N","N",0,"Y","N","N","N","N","SYSTEM","SYSTEM","1"
"D","S","72028","72028","C","Y","N","Trasferimenti per conto terzi a policlinici","Y","NULL","N","N","NULL","NULL","N","N","1100","N","N","N","N","N","N",0,"Y","N","N","N","N","SYSTEM","SYSTEM","1"
"D","S","72029","72029","C","Y","N","Trasferimenti per conto terzi a Istituti di ricovero e cura a carattere scientifico pubblici","Y","NULL","N","N","NULL","NULL","N","N","1102","N","N","N","N","N","N",0,"Y","N","N","N","N","SYSTEM","SYSTEM","1"
"D","S","72030","72030","C","Y","N","Trasferimenti per conto terzi a altre Amministrazioni Locali produttrici di servizi sanitari","Y","NULL","N","N","NULL","NULL","N","N","1104","N","N","N","N","N","N",0,"Y","N","N","N","N","SYSTEM","SYSTEM","1"
"D","S","72031","72031","C","Y","N","Trasferimenti per conto terzi a Agenzie regionali per le erogazioni in agricoltura","Y","NULL","N","N","NULL","NULL","N","N","1106","N","N","N","N","N","N",0,"Y","N","N","N","N","SYSTEM","SYSTEM","1"
"D","S","72032","72032","C","Y","N","Trasferimenti per conto terzi a altri enti e agenzie regionali e sub regionali","Y","NULL","N","N","NULL","NULL","N","N","1108","N","N","N","N","N","N",0,"Y","N","N","N","N","SYSTEM","SYSTEM","1"
"D","S","72033","72033","C","Y","N","Trasferimenti per conto terzi a Consorzi di enti locali","Y","NULL","N","N","NULL","NULL","N","N","1110","N","N","N","N","N","N",0,"Y","N","N","N","N","SYSTEM","SYSTEM","1"
"D","S","72034","72034","C","Y","N","Trasferimenti per conto terzi a Fondazioni e istituzioni liriche locali e a teatri stabili di iniziativa pubblica","Y","NULL","N","N","NULL","NULL","N","N","1112","N","N","N","N","N","N",0,"Y","N","N","N","N","SYSTEM","SYSTEM","1"
"D","S","72035","72035","C","Y","N","Trasferimenti per conto terzi a altre Amministrazioni Locali n.a.c.","Y","NULL","N","N","NULL","NULL","N","N","1114","N","N","N","N","N","N",0,"Y","N","N","N","N","SYSTEM","SYSTEM","1"
"D","S","72036","72036","C","Y","N","Trasferimenti per conto terzi a INPS","Y","NULL","N","N","NULL","NULL","N","N","1117","N","N","N","N","N","N",0,"Y","N","N","N","N","SYSTEM","SYSTEM","1"
"D","S","72037","72037","C","Y","N","Trasferimenti per conto terzi a INAIL","Y","NULL","N","N","NULL","NULL","N","N","1119","N","N","N","N","N","N",0,"Y","N","N","N","N","SYSTEM","SYSTEM","1"
"D","S","72038","72038","C","Y","N","Trasferimenti per conto terzi a altri Enti di Previdenza n.a.c.","Y","NULL","N","N","NULL","NULL","N","N","1121","N","N","N","N","N","N",0,"Y","N","N","N","N","SYSTEM","SYSTEM","1"
"D","S","72039","72039","C","Y","N","Trasferimenti per conto terzi a Famiglie","Y","NULL","N","N","NULL","NULL","N","N","1125","N","N","N","N","N","N",0,"Y","N","N","N","N","SYSTEM","SYSTEM","1"
"D","S","72040","72040","C","Y","N","Trasferimenti per conto terzi a Imprese controllate","Y","NULL","N","N","NULL","NULL","N","N","1128","N","N","N","N","N","N",0,"Y","N","N","N","N","SYSTEM","SYSTEM","1"
"D","S","72041","72041","C","Y","N","Trasferimenti per conto terzi a altre imprese partecipate","Y","NULL","N","N","NULL","NULL","N","N","1130","N","N","N","N","N","N",0,"Y","N","N","N","N","SYSTEM","SYSTEM","1"
"D","S","72042","72042","C","Y","N","Trasferimenti per conto terzi a altre imprese","Y","NULL","N","N","NULL","NULL","N","N","1132","N","N","N","N","N","N",0,"Y","N","N","N","N","SYSTEM","SYSTEM","1"
"D","S","72043","72043","C","Y","N","Trasferimenti per conto terzi a Istituzioni Sociali Private ","Y","NULL","N","N","NULL","NULL","N","N","1135","N","N","N","N","N","N",0,"Y","N","N","N","N","SYSTEM","SYSTEM","1"
"D","S","72044","72044","C","Y","N","Trasferimenti per conto terzi all'Unione Europea e al Resto del Mondo","Y","NULL","N","N","NULL","NULL","N","N","1138","N","N","N","N","N","N",0,"Y","N","N","N","N","SYSTEM","SYSTEM","1"
"D","S","72045","72045","C","Y","N","Costituzione di depositi cauzionali o contrattuali presso terzi","Y","NULL","N","N","NULL","NULL","N","N","1142","N","N","N","N","N","N",0,"Y","N","N","N","N","SYSTEM","SYSTEM","1"
"D","S","72046","72046","C","Y","N","Restituzione di depositi cauzionali o contrattuali di terzi","Y","NULL","N","N","NULL","NULL","N","N","1145","N","N","N","N","N","N",0,"N","N","N","N","N","SYSTEM","SYSTEM","1"
"D","S","72047","72047","C","Y","N","Versamenti di imposte e tasse di natura corrente riscosse per conto di terzi","Y","NULL","N","N","NULL","NULL","N","N","1149","N","N","N","N","N","N",0,"Y","N","N","N","N","SYSTEM","SYSTEM","1"
"D","S","72048","72048","C","Y","N","Versamenti di imposte in conto capitale riscosse per conto di terzi","Y","NULL","N","N","NULL","NULL","N","N","1152","N","N","N","N","N","N",0,"Y","N","N","N","N","SYSTEM","SYSTEM","1"
"D","S","72049","72049","C","Y","N","Altre uscite per conto terzi n.a.c.","Y","NULL","N","N","NULL","NULL","N","N","1156","N","N","N","N","N","N",0,"Y","N","N","N","N","SYSTEM","SYSTEM","1"
"D","S","10014","10014","C","Y","N","Altri fondi n.a.c.","N","NULL","N","N","NULL","NULL","N","N","486","Y","N","N","N","N","N",0,"N","Y","N","N","N","SYSTEM","SYSTEM","1"
