TI_APPARTENENZA,TI_GESTIONE,CD_ELEMENTO_VOCE,CD_PROPRIO_ELEMENTO,TI_ELEMENTO_VOCE,FL_LIMITE_ASS_OBBLIG,FL_VOCE_PERSONALE,DS_ELEMENTO_VOCE,FL_PARTITA_GIRO,CD_CAPOCONTO_FIN,FL_VOCE_SAC,FL_VOCE_NON_SOGG_IMP_AUT,COD_CLA_E,COD_CLA_S,FL_RECON,FL_INV_BENI_PATR,ID_CLASSIFICAZIONE,FL_VOCE_FONDO,FL_CHECK_TERZO_SIOPE,FL_INV_BENI_COMP,FL_LIMITE_SPESA,FL_PRELIEVO,FL_SOGGETTO_PRELIEVO,PERC_PRELIEVO_PDGP_ENTRATE,FL_SOLO_RESIDUO,FL_SOLO_COMPETENZA,FL_TROVATO,FL_AZZERA_RESIDUI,FL_MISSIONI,UTCR,UTUV,PG_VER_REC
"D","S","13053","13053","C","Y","N","Noleggio della Nave ""Urania""","N","C","N","N","NULL","04","Y","N","226","N","N","N","N","N","N",0,"N","N","N","N","N","SYSTEM","SYSTEM","1"
"D","S","13054","13054","C","Y","N","Noleggio di natanti ed imbarcazioni","N","C","N","N","NULL","04","Y","N","227","N","N","N","N","N","N",0,"N","N","N","N","N","SYSTEM","SYSTEM","1"
"D","S","13055","13055","C","Y","N","Noleggio di velivoli","N","C","N","N","NULL","04","Y","N","228","N","N","N","N","N","N",0,"N","N","N","N","N","SYSTEM","SYSTEM","1"
"C","E","44026","44026","C",,"N","Alienazione di diritti reali","N","NULL","N","N","09","NULL","Y","Y","937","N","N","N","N","N","N",0,"N","N","N","N","N","SYSTEM","SYSTEM","1"
"C","E","44027","44027","C",,"N","Alienazione di materiale bibliografico","N","NULL","N","N","09","NULL","Y","Y","940","N","N","N","N","N","N",0,"N","N","N","N","N","SYSTEM","SYSTEM","1"
"C","E","44028","44028","C",,"N","Cessione di terreni agricoli","N","NULL","Y","N","09","NULL","Y","Y","944","N","N","N","N","N","N",0,"N","N","N","N","N","SYSTEM","SYSTEM","1"
"C","E","44029","44029","C",,"N","Cessione di terreni edificabili","N","NULL","Y","N","09","NULL","Y","Y","946","N","N","N","N","N","N",0,"N","N","N","N","N","SYSTEM","SYSTEM","1"
"C","E","44030","44030","C",,"N","Alienazione di software","N","NULL","N","N","09","NULL","Y","Y","950","N","N","N","N","N","N",0,"N","N","N","N","N","SYSTEM","SYSTEM","1"
"C","E","44031","44031","C",,"N","Alienazione di brevetti","N","NULL","N","N","09","NULL","Y","Y","953","N","N","N","N","N","N",0,"N","N","E","N","N","SYSTEM","SYSTEM","1"
"C","E","44032","44032","C",,"N","Alienazione di opere dell'ingegno e diritti d'autore","N","NULL","N","N","09","NULL","Y","Y","956","N","N","N","N","N","N",0,"N","N","N","N","N","SYSTEM","SYSTEM","1"
"C","E","44033","44033","C",,"N","Alienazione di altri beni immateriali","N","NULL","N","N","09","NULL","Y","Y","959","N","N","N","N","N","N",0,"N","N","N","N","N","SYSTEM","SYSTEM","1"
"C","E","44034","44034","C",,"N","Alienazione di mobili e arredi per alloggi e pertinenze","N","NULL","N","N","09","NULL","Y","Y","888","N","N","N","N","N","N",0,"N","N","N","N","N","SYSTEM","SYSTEM","1"
"C","E","44035","44035","C",,"N","Alienazione di mobili e arredi per laboratori","N","NULL","N","N","09","NULL","Y","Y","890","N","N","N","N","N","N",0,"N","N","N","N","N","SYSTEM","SYSTEM","1"
"C","E","51001","51001","C",,"N","Alienazione di partecipazioni in imprese controllate","N","NULL","Y","N","10","NULL","Y","Y","966","N","N","N","N","N","N",0,"N","N","N","N","N","SYSTEM","SYSTEM","1"
"C","E","51002","51002","C",,"N","Alienazione di partecipazioni in altre imprese partecipate","N","NULL","Y","N","10","NULL","N","Y","968","N","N","N","N","N","N",0,"N","N","N","N","N","SYSTEM","SYSTEM","1"
"C","E","51003","51003","C",,"N","Alienazione di partecipazioni in altre imprese","N","NULL","Y","N","10","NULL","N","Y","970","N","N","N","N","N","N",0,"N","N","N","N","N","SYSTEM","SYSTEM","1"
"C","E","52001","52001","C",,"N","Riscossione delle quote di ammortamento sui prestiti a breve termine concessi al personale","N","NULL","Y","N","10","NULL","N","N","975","N","N","N","N","N","N",0,"N","N","N","N","N","SYSTEM","SYSTEM","1"
"C","E","53001","53001","C",,"N","Riscossione delle quote di ammortamento sui prestiti a medio-lungo termine concessi al personale","N","NULL","Y","N","10","NULL","N","N","980","N","N","N","N","N","N",0,"N","N","N","N","N","SYSTEM","SYSTEM","1"
"C","E","63001","63001","C","N","N","Accensione mutui da istituti di credito","N","NULL","Y","N","NULL","NULL","N","N","988","N","N","N","N","N","N",0,"N","N","N","N","N","SYSTEM","SYSTEM","1"
"C","E","63002","63002","C",,"N","Accensione mutui da Cassa Depositi e Prestiti s.p.a.","N","NULL","Y","N","13","NULL","N","N","986","N","N","N","N","N","N",0,"N","N","N","N","N","SYSTEM","SYSTEM","1"
"C","E","71001","71001","C","N","N","Anticipazioni di cassa","N","NULL","Y","N","NULL","NULL","N","N","994","N","N","N","N","N","N",0,"N","N","N","N","N","SYSTEM","SYSTEM","1"
"C","E","91001","91001","C","N","N","Ritenuta del 4% sui contributi pubblici","Y","NULL","N","N","NULL","NULL","N","N","1166","N","N","N","N","N","N",0,"N","N","N","N","N","SYSTEM","SYSTEM","1"
"C","E","91002","91002","C","N","N","Altre ritenute n.a.c.","Y","NULL","N","N","NULL","NULL","N","N","1176","N","N","N","N","N","N",0,"N","N","N","N","N","SYSTEM","SYSTEM","1"
"C","E","91003","91003","C","N","N","Ritenute erariali su redditi da lavoro dipendente per conto terzi","Y","NULL","N","N","NULL","NULL","N","N","1181","N","N","N","N","N","N",0,"N","N","N","N","N","SYSTEM","SYSTEM","1"
"C","E","91004","91004","C","N","N","Ritenute previdenziali e assistenziali su redditi da lavoro dipendente per conto terzi","Y","NULL","N","N","NULL","NULL","N","N","1184","N","N","N","N","N","N",0,"N","N","N","N","N","SYSTEM","SYSTEM","1"
"C","E","91005","91005","C","N","N","Altre ritenute al personale dipendente per conto di terzi","Y","NULL","N","N","NULL","NULL","N","N","1187","N","N","N","N","N","N",0,"N","N","N","N","N","SYSTEM","SYSTEM","1"
"C","E","91006","91006","C","N","N","Ritenute erariali su redditi da lavoro autonomo per conto terzi","Y","NULL","N","N","NULL","NULL","N","N","1191","N","N","N","N","N","N",0,"N","N","N","N","N","SYSTEM","SYSTEM","1"
"C","E","91007","91007","C","N","N","Ritenute previdenziali e assistenziali su redditi da lavoro autonomo per conto terzi","Y","NULL","N","N","NULL","NULL","N","N","1194","N","N","N","N","N","N",0,"N","N","N","N","N","SYSTEM","SYSTEM","1"
"C","E","91008","91008","C","N","N","Altre ritenute al personale con contratto di lavoro autonomo per conto di terzi","Y","NULL","N","N","NULL","NULL","N","N","1197","N","N","N","N","N","N",0,"N","N","N","N","N","SYSTEM","SYSTEM","1"
"C","E","91009","91009","C","N","N","Entrate a seguito di spese non andate a buon fine","Y","NULL","N","N","NULL","NULL","N","N","1201","N","N","N","N","N","N",0,"N","N","N","N","N","SYSTEM","SYSTEM","1"
"C","E","91010","91010","C","N","N","Rimborso di fondi economali e carte aziendali","Y","NULL","N","N","NULL","NULL","N","N","1204","N","N","N","N","N","N",0,"N","N","N","N","N","SYSTEM","SYSTEM","1"
"C","E","91011","91011","C","N","N","Altre entrate per partite di giro diverse","Y","NULL","N","N","NULL","NULL","N","N","1207","N","N","N","N","N","N",0,"N","N","N","N","N","SYSTEM","SYSTEM","1"
"C","E","91012","91012","C",,"N","Ritenute per scissione contabile IVA (split payment)","Y","NULL","N","N","NULL","NULL","N","N","1171","N","N","N","N","N","N",0,"N","N","N","N","N","SYSTEM","SYSTEM","1"
"C","E","91013","91013","C",,"N","Ritenute erariali su prestazioni sociali","Y","NULL","N","N","NULL","NULL","N","N","1174","N","N","N","N","N","N",0,"N","N","N","N","N","SYSTEM","SYSTEM","1"
"C","E","92001","92001","C","N","N","Rimborso per acquisti di beni per conto di terzi","Y","NULL","N","N","NULL","NULL","N","N","1213","N","N","N","N","N","N",0,"Y","N","N","N","N","SYSTEM","SYSTEM","1"
"C","E","92002","92002","C","N","N","Rimborso per acquisto di servizi per conto di terzi","Y","NULL","N","N","NULL","NULL","N","N","1216","N","N","N","N","N","N",0,"Y","N","N","N","N","SYSTEM","SYSTEM","1"
"C","E","92003","92003","C","N","N","Trasferimenti da Ministeri per operazioni conto terzi","Y","NULL","N","N","NULL","NULL","N","N","1220","N","N","N","N","N","N",0,"Y","N","N","N","N","SYSTEM","SYSTEM","1"
"C","E","92004","92004","C","N","N","Trasferimenti da Presidenza del Consiglio dei Ministri per operazioni conto terzi","Y","NULL","N","N","NULL","NULL","N","N","1222","N","N","N","N","N","N",0,"Y","N","N","N","N","SYSTEM","SYSTEM","1"
"C","E","92005","92005","C","N","N","Trasferimenti da Organi Costituzionali e di rilievo costituzionale per operazioni conto terzi","Y","NULL","N","N","NULL","NULL","N","N","1224","N","N","N","N","N","N",0,"Y","N","N","N","N","SYSTEM","SYSTEM","1"
"C","E","21001","21001","C",,"N","Contributo di funzionamento del MIUR - Assegnazioni ordinarie","N","NULL","Y","N","01","NULL","N","N","519","N","Y","N","N","N","N",0,"N","N","N","N","N","SYSTEM","SYSTEM","1"
"C","E","21002","21002","C",,"N","Finanziamenti MIUR in attuazione della nuova intesa di programma per il Mezzogiorno","N","NULL","Y","N","02","NULL","Y","N","520","N","Y","N","N","N","N",0,"N","N","N","N","N","SYSTEM","SYSTEM","1"
"C","E","21003","21003","C",,"N","Finanziamenti MIUR relativi ai Programmi Operativi Nazionali (PON)","N","NULL","N","N","03","NULL","Y","N","521","N","Y","N","N","N","N",0,"N","N","N","N","N","SYSTEM","SYSTEM","1"
"C","E","21004","21004","C",,"N","Finanziamenti MIUR per l'attivita' di sviluppo delle aree depresse (CLUSTER)","N","NULL","N","N","02","NULL","Y","N","522","N","Y","N","N","N","N",0,"N","N","N","N","N","SYSTEM","SYSTEM","1"
"C","E","21005","21005","C",,"N","Finanziamenti MIUR relativi al Fondo per gli Investimenti della Ricerca di Base (FIRB)","N","NULL","N","N","02","NULL","Y","N","523","N","Y","N","N","N","N",0,"N","N","N","N","N","SYSTEM","SYSTEM","1"
"C","E","21006","21006","C",,"N","Finanziamenti MIUR relativi al Fondo Integrativo Speciale per la Ricerca (FISR)","N","NULL","N","N","02","NULL","Y","N","524","N","Y","N","N","N","N",0,"N","N","N","N","N","SYSTEM","SYSTEM","1"
"C","E","21007","21007","C",,"N","Finanziamenti MIUR relativi al Fondo Agevolato per la Ricerca Industriale (FAR)","N","NULL","N","N","02","NULL","Y","N","525","N","Y","N","N","N","N",0,"N","N","N","N","N","SYSTEM","SYSTEM","1"
"C","E","21008","21008","C",,"N","Finanziamenti MIUR relativi ai Programmi di ricerca di Rilevante Interesse Nazionale (PRIN)","N","NULL","N","N","02","NULL","Y","N","526","N","Y","N","N","N","N",0,"N","N","N","N","N","SYSTEM","SYSTEM","1"
"C","E","21009","21009","C",,"N","Finanziamenti MIUR per i progetti strategici e di diffusione della cultura scientifica","N","NULL","N","N","02","NULL","Y","N","527","N","Y","N","N","N","N",0,"N","N","N","N","N","SYSTEM","SYSTEM","1"
"C","E","21010","21010","C",,"N","Contributo MIUR per le spese complessive del Laboratorio di Luce di Sincrotrone di Grenoble","N","NULL","N","N","02","NULL","Y","N","528","N","Y","N","N","N","N",0,"N","N","N","N","N","SYSTEM","SYSTEM","1"
"C","E","21011","21011","C",,"N","Finanziamenti MIUR per altre iniziative progettuali","N","NULL","N","N","03","NULL","Y","N","529","N","Y","N","N","N","N",0,"N","N","N","N","N","SYSTEM","SYSTEM","1"
"C","E","21012","21012","C",,"N","Finanziamenti ministeriali ai sensi della legge 16 aprile 1987, n. 183 (Fondo di rotazione)","N","NULL","N","N","03","NULL","N","N","530","N","Y","N","N","N","N",0,"N","N","N","N","N","SYSTEM","SYSTEM","1"
"C","E","21013","21013","C",,"N","Finanziamenti MiSE relativi al progetto Industria 2015","N","NULL","N","N","03","NULL","Y","N","531","N","Y","N","N","N","N",0,"N","N","N","N","N","SYSTEM","SYSTEM","1"
"C","E","21014","21014","C",,"N","Altri finanziamenti e contributi ministeriali","N","NULL","N","N","03","NULL","Y","N","532","N","Y","N","N","N","N",0,"N","N","N","N","N","SYSTEM","SYSTEM","1"
"C","E","21015","21015","C",,"N","Finanziamenti da Presidenza del Consiglio dei Ministri","N","NULL","N","N","03","NULL","Y","N","542","N","Y","N","N","N","N",0,"N","N","N","N","N","SYSTEM","SYSTEM","1"
"C","E","21016","21016","C",,"N","Finanziamenti da Organi Costituzionali e di rilievo costituzionale","N","NULL","N","N","03","NULL","Y","N","544","N","Y","N","N","N","N",0,"N","N","N","N","N","SYSTEM","SYSTEM","1"
"C","E","21017","21017","C",,"N","Finanziamenti da Agenzie Fiscali","N","NULL","N","N","06","NULL","Y","N","546","N","Y","N","N","N","N",0,"N","N","N","N","N","SYSTEM","SYSTEM","1"
"C","E","21018","21018","C",,"N","Trasferimenti da enti di regolazione dell'attivita' economica","N","NULL","N","N","06","NULL","Y","N","548","N","Y","N","N","N","N",0,"N","N","N","N","N","SYSTEM","SYSTEM","1"
"C","E","21019","21019","C",,"N","Finanziamenti da Gruppo Equitalia","N","NULL","N","N","06","NULL","Y","N","550","N","Y","N","N","N","N",0,"N","N","N","N","N","SYSTEM","SYSTEM","1"
"C","E","21020","21020","C",,"N","Finanziamenti da Anas S.p.A.","N","NULL","N","N","06","NULL","Y","N","552","N","Y","N","N","N","N",0,"N","N","N","N","N","SYSTEM","SYSTEM","1"
"C","E","21021","21021","C",,"N","Finanziamenti da altri enti centrali produttori di servizi economici","N","NULL","N","N","06","NULL","Y","N","554","N","Y","N","N","N","N",0,"N","N","N","N","N","SYSTEM","SYSTEM","1"
"C","E","21022","21022","C",,"N","Finanziamenti da autorita' amministrative indipendenti","N","NULL","N","N","06","NULL","Y","N","556","N","Y","N","N","N","N",0,"N","N","N","N","N","SYSTEM","SYSTEM","1"
"C","E","21023","21023","C",,"N","Finanziamenti da enti centrali produttori di servizi assistenziali, ricreativi e culturali","N","NULL","N","N","06","NULL","Y","N","558","N","Y","N","N","N","N",0,"N","N","N","N","N","SYSTEM","SYSTEM","1"
"C","E","21024","21024","C",,"N","Trasferimenti da altri enti e istituzioni di ricerca","N","NULL","N","N","06","NULL","Y","N","560","N","Y","N","N","N","N",0,"N","N","N","N","N","SYSTEM","SYSTEM","1"
"C","E","21025","21025","C",,"N","Finanziamenti delle Regioni relativi ai Programmi Operativi Regionali (POR)","N","NULL","N","N","05","NULL","Y","N","563","N","Y","N","N","N","N",0,"N","N","N","N","N","SYSTEM","SYSTEM","1"
"C","E","21026","21026","C",,"N","Altri finanziamenti da Regioni e province autonome","N","NULL","N","N","05","NULL","Y","N","564","N","Y","N","N","N","N",0,"N","N","N","N","N","SYSTEM","SYSTEM","1"
"C","E","21027","21027","C",,"N","Finanziamenti da Province","N","NULL","N","N","05","NULL","Y","N","566","N","Y","N","N","N","N",0,"N","N","N","N","N","SYSTEM","SYSTEM","1"
"C","E","21028","21028","C",,"N","Finanziamenti da Comuni","N","NULL","N","N","05","NULL","Y","N","568","N","Y","N","N","N","N",0,"N","N","N","N","N","SYSTEM","SYSTEM","1"
"C","E","21029","21029","C",,"N","Finanziamenti da Citta' metropolitane e Roma capitale","N","NULL","N","N","05","NULL","Y","N","570","N","Y","N","N","N","N",0,"N","N","N","N","N","SYSTEM","SYSTEM","1"
"C","E","21030","21030","C",,"N","Finanziamenti da Unioni di Comuni","N","NULL","N","N","05","NULL","Y","N","572","N","Y","N","N","N","N",0,"N","N","N","N","N","SYSTEM","SYSTEM","1"
"C","E","21031","21031","C",,"N","Finanziamenti da Comunita' Montane","N","NULL","N","N","05","NULL","Y","N","574","N","Y","N","N","N","N",0,"N","N","N","N","N","SYSTEM","SYSTEM","1"
"C","E","21032","21032","C",,"N","Finanziamenti da Camere di Commercio","N","NULL","N","N","06","NULL","Y","N","576","N","Y","N","N","N","N",0,"N","N","N","N","N","SYSTEM","SYSTEM","1"
"C","E","21033","21033","C",,"N","Finanziamenti da Universita' pubbliche","N","NULL","N","N","06","NULL","Y","N","578","N","Y","N","N","N","N",0,"N","N","N","N","N","SYSTEM","SYSTEM","1"
"C","E","21034","21034","C",,"N","Finanziamenti da Parchi nazionali e consorzi ed enti autonomi gestori di parchi e aree naturali protette","N","NULL","N","N","06","NULL","Y","N","580","N","Y","N","N","N","N",0,"N","N","N","N","N","SYSTEM","SYSTEM","1"
"C","E","21035","21035","C",,"N","Finanziamenti da Autorita' Portuali","N","NULL","N","N","06","NULL","Y","N","582","N","Y","N","N","N","N",0,"N","N","N","N","N","SYSTEM","SYSTEM","1"
"C","E","21036","21036","C",,"N","Finanziamenti da Aziende sanitarie locali ","N","NULL","N","N","06","NULL","Y","N","584","N","Y","N","N","N","N",0,"N","N","N","N","N","SYSTEM","SYSTEM","1"
"C","E","21037","21037","C",,"N","Finanziamenti da Aziende ospedaliere e Aziende ospedaliere universitarie integrate con il SSN","N","NULL","N","N","06","NULL","Y","N","586","N","Y","N","N","N","N",0,"N","N","N","N","N","SYSTEM","SYSTEM","1"
"C","E","21038","21038","C",,"N","Finanziamenti da Policlinici pubblici","N","NULL","N","N","06","NULL","Y","N","588","N","Y","N","N","N","N",0,"N","N","N","N","N","SYSTEM","SYSTEM","1"
"C","E","21039","21039","C",,"N","Finanziamenti da Istituti di ricovero e cura a carattere scientifico pubblici","N","NULL","N","N","06","NULL","Y","N","590","N","Y","N","N","N","N",0,"N","N","N","N","N","SYSTEM","SYSTEM","1"
"C","E","21040","21040","C",,"N","Finanziamenti da altre Amministrazioni Locali produttrici di servizi sanitari","N","NULL","N","N","06","NULL","Y","N","592","N","Y","N","N","N","N",0,"N","N","N","N","N","SYSTEM","SYSTEM","1"
"C","E","21041","21041","C",,"N","Finanziamenti da Agenzie regionali per le erogazioni in agricoltura","N","NULL","N","N","06","NULL","Y","N","594","N","Y","N","N","N","N",0,"N","N","N","N","N","SYSTEM","SYSTEM","1"
"C","E","21042","21042","C",,"N","Finanziamenti da altri enti e agenzie regionali e sub regionali","N","NULL","N","N","06","NULL","Y","N","596","N","Y","N","N","N","N",0,"N","N","N","N","N","SYSTEM","SYSTEM","1"
"C","E","21043","21043","C",,"N","Finanziamenti da Consorzi di enti locali","N","NULL","N","N","06","NULL","Y","N","598","N","Y","N","N","N","N",0,"N","N","N","N","N","SYSTEM","SYSTEM","1"
"C","E","21044","21044","C",,"N","Finanziamenti da Istituzioni liriche locali e da teatri stabili di iniziativa pubblica","N","NULL","N","N","06","NULL","Y","N","600","N","Y","N","N","N","N",0,"N","N","N","N","N","SYSTEM","SYSTEM","1"
"C","E","21045","21045","C",,"N","Finanziamenti da altre Amministrazioni Locali","N","NULL","N","N","06","NULL","Y","N","602","N","Y","N","N","N","N",0,"N","N","N","N","N","SYSTEM","SYSTEM","1"
"C","E","21046","21046","C",,"N","Finanziamenti da INPS","N","NULL","N","N","06","NULL","Y","N","605","N","Y","N","N","N","N",0,"N","N","N","N","N","SYSTEM","SYSTEM","1"
"C","E","21047","21047","C",,"N","Finanziamenti da INAIL","N","NULL","N","N","06","NULL","Y","N","607","N","Y","N","N","N","N",0,"N","N","N","N","N","SYSTEM","SYSTEM","1"
"C","E","21048","21048","C",,"N","Finanziamenti da altri Enti di Previdenza","N","NULL","N","N","06","NULL","Y","N","609","N","Y","N","N","N","N",0,"N","N","N","N","N","SYSTEM","SYSTEM","1"
"C","E","21049","21049","C",,"N","Finanziamenti da soggetti privati, non esercenti attivit? di impresa","N","NULL","N","N","07","NULL","Y","N","613","N","N","N","N","N","N",0,"N","N","N","N","N","SYSTEM","SYSTEM","1"
"C","E","21050","21050","C",,"N","Finanziamenti da imprese controllate","N","NULL","N","N","07","NULL","Y","N","617","N","N","N","N","N","N",0,"N","N","N","N","N","SYSTEM","SYSTEM","1"
"C","E","21051","21051","C",,"N","Finanziamenti da imprese partecipate","N","NULL","N","N","07","NULL","Y","N","619","N","N","N","N","N","N",0,"N","N","N","N","N","SYSTEM","SYSTEM","1"
"C","E","21052","21052","C",,"N","Finanziamenti da altre imprese","N","NULL","N","N","07","NULL","Y","N","621","N","N","N","N","N","N",0,"N","N","N","N","N","SYSTEM","SYSTEM","1"
"C","E","21053","21053","C",,"N","Finanziamenti da Istituzioni Sociali Private","N","NULL","N","N","07","NULL","Y","N","625","N","Y","N","N","N","N",0,"N","N","N","N","N","SYSTEM","SYSTEM","1"
"C","E","21054","21054","C",,"N","Finanziamenti della Comunita' Europea nell'ambito dei Programmi Quadro","N","NULL","N","N","04","NULL","Y","N","630","N","N","N","N","N","N",0,"N","N","N","N","N","SYSTEM","SYSTEM","1"
"C","E","21055","21055","C",,"N","Finanziamenti della Comunita' Europea per il Programma ""Horizon 2020""","N","NULL","N","N","04","NULL","Y","N","631","N","N","N","N","N","N",0,"N","N","N","N","N","SYSTEM","SYSTEM","1"
"C","E","21056","21056","C",,"N","Altri finanziamenti della Comunita' Europea","N","NULL","N","N","04","NULL","Y","N","632","N","N","N","N","N","N",0,"N","N","N","N","N","SYSTEM","SYSTEM","1"
"C","E","21057","21057","C",,"N","Finanziamenti di altri soggetti, pubblici e privati, di Paesi aderenti alla Comunita' Europea","N","NULL","N","N","04","NULL","Y","N","633","N","N","N","N","N","N",0,"N","N","N","N","N","SYSTEM","SYSTEM","1"
"C","E","21058","21058","C",,"N","Finanziamenti di altri soggetti, pubblici e privati, di Paesi non comunitari e di organismi internazionali","N","NULL","N","N","04","NULL","Y","N","636","N","N","N","N","N","N",0,"N","N","N","N","N","SYSTEM","SYSTEM","1"
"C","E","21060","21060","C",,"N","Contributo di funzionamento del MIUR - finanziamento delle progettualit? di carattere straordinario","N","NULL","Y","N","01","NULL","N","N","533","N","Y","N","N","N","N",0,"N","N","N","N","N","SYSTEM","SYSTEM","1"
"C","E","21061","21061","C",,"N","Contributo di funzionamento del MIUR - finanziamento dei progetti bandiera e di interesse","N","NULL","Y","N","01","NULL","N","N","534","N","Y","N","N","N","N",0,"N","N","N","N","N","SYSTEM","SYSTEM","1"
"C","E","21062","21062","C",,"N","Contributo di funzionamento del MIUR - finanziamento delle attivit? a valenza internazionale","N","NULL","Y","N","01","NULL","N","N","535","N","Y","N","N","N","N",0,"N","N","N","N","N","SYSTEM","SYSTEM","1"
"C","E","21063","21063","C",,"N","Contributo di funzionamento del MIUR - finanziamento dei progetti premiali","N","NULL","Y","N","01","NULL","N","N","536","N","Y","N","N","N","N",0,"N","N","N","N","N","SYSTEM","SYSTEM","1"
"C","E","21064","21064","C",,"N","Contributo di funzionamento del MIUR - altre assegnazioni straordinarie","N","NULL","Y","N","01","NULL","N","N","537","N","Y","N","N","N","N",0,"N","N","N","N","N","SYSTEM","SYSTEM","1"
"C","E","21065","21065","C",,"N","Trasferimenti correnti da istituzioni scolastiche","N","NULL","N","N","02","NULL","Y","N","540","N","Y","N","N","N","N",0,"N","N","N","N","N","SYSTEM","SYSTEM","1"
"C","E","21066","21066","C","N","N","Finanziamento MEF - DCPM 11.04.2018 - art. 1 comma 668 legge n. 205/2017 (Stabilizzazione)","N","NULL","Y","N","03","NULL","N","N","538","N","Y","N","N","N","N",0,"N","N","N","N","N","SYSTEM","SYSTEM","1"
"C","E","31001","31001","C",,"N","Proventi dalla vendita di beni di consumo","N","NULL","N","N","08","NULL","Y","N","726","N","N","N","N","N","N",0,"N","N","N","N","N","SYSTEM","SYSTEM","1"
"C","E","31002","31002","C",,"N","Proventi dalla vendita di medicinali e altri beni di consumo sanitario","N","NULL","N","N","08","NULL","Y","N","728","N","N","N","N","N","N",0,"N","N","N","N","N","SYSTEM","SYSTEM","1"
"C","E","31003","31003","C",,"N","Proventi dalla vendita di flora e fauna","N","NULL","N","N","08","NULL","Y","N","730","N","N","N","N","N","N",0,"N","N","N","N","N","SYSTEM","SYSTEM","1"
"C","E","31004","31004","C",,"N","Proventi da energia, acqua, gas e riscaldamento","N","NULL","N","N","08","NULL","Y","N","732","N","N","N","N","N","N",0,"N","N","N","N","N","SYSTEM","SYSTEM","1"
"C","E","31005","31005","C",,"N","Proventi derivanti dallo sfruttamento di brevetti","N","NULL","N","N","11","NULL","Y","N","734","N","N","N","N","N","N",0,"N","N","E","N","N","SYSTEM","SYSTEM","1"
"C","E","31006","31006","C",,"N","Proventi dalla vendita di riviste e pubblicazioni","N","NULL","N","N","08","NULL","Y","N","736","N","N","N","N","N","N",0,"N","N","N","N","N","SYSTEM","SYSTEM","1"
"C","E","31007","31007","C",,"N","Proventi dall'uso di locali adibiti a riunioni non istituzionali","N","NULL","N","N","11","NULL","Y","N","746","N","N","N","N","N","N",0,"N","N","N","N","N","SYSTEM","SYSTEM","1"
"C","E","31008","31008","C",,"N","Proventi da servizi di accesso a banche dati e pubblicazioni on line","N","NULL","N","N","08","NULL","Y","N","748","N","N","N","N","N","N",0,"N","N","N","N","N","SYSTEM","SYSTEM","1"
"C","E","31009","31009","C",,"N","Proventi da servizi per formazione e addestramento","N","NULL","N","N","08","NULL","Y","N","750","N","N","N","N","N","N",0,"N","N","N","N","N","SYSTEM","SYSTEM","1"
"C","E","31010","31010","C",,"N","Proventi da servizi sanitari","N","NULL","N","N","08","NULL","Y","N","752","N","N","N","N","N","N",0,"N","N","N","N","N","SYSTEM","SYSTEM","1"
"C","E","31011","31011","C",,"N","Proventi da licenze d'uso per software","N","NULL","N","N","11","NULL","Y","N","754","N","N","N","N","N","N",0,"N","N","N","N","N","SYSTEM","SYSTEM","1"
"C","E","31012","31012","C",,"N","Proventi da consulenze","N","NULL","N","N","08","NULL","Y","N","756","N","N","N","N","N","N",0,"N","N","N","N","N","SYSTEM","SYSTEM","1"
"C","E","31013","31013","C",,"N","Proventi da servizi informatici","N","NULL","N","N","08","NULL","Y","N","758","N","N","N","N","N","N",0,"N","N","N","N","N","SYSTEM","SYSTEM","1"
"C","E","31014","31014","C",,"N","Proventi da servizi ispettivi e controllo","N","NULL","N","N","08","NULL","Y","N","760","N","N","N","N","N","N",0,"N","N","N","N","N","SYSTEM","SYSTEM","1"
"C","E","31015","31015","C",,"N","Proventi da servizi di arbitrato e collaudi","N","NULL","N","N","08","NULL","Y","N","762","N","N","N","N","N","N",0,"N","N","N","N","N","SYSTEM","SYSTEM","1"
"C","E","31016","31016","C",,"N","Proventi da attivita' di monitoraggio e controllo ambientale","N","NULL","N","N","08","NULL","Y","N","764","N","N","N","N","N","N",0,"N","N","N","N","N","SYSTEM","SYSTEM","1"
"C","E","31017","31017","C",,"N","Proventi da analisi e studi nel campo della ricerca","N","NULL","N","N","08","NULL","Y","N","766","N","N","N","N","N","N",0,"N","N","N","N","N","SYSTEM","SYSTEM","1"
"C","E","31018","31018","C",,"N","Proventi dallo svolgimento di attivita' di certificazione","N","NULL","N","N","08","NULL","Y","N","768","N","N","N","N","N","N",0,"N","N","N","N","N","SYSTEM","SYSTEM","1"
"C","E","31019","31019","C",,"N","Proventi per organizzazione convegni","N","NULL","N","N","08","NULL","Y","N","770","N","N","N","N","N","N",0,"N","N","N","N","N","SYSTEM","SYSTEM","1"
"C","E","31020","31020","C",,"N","Altri proventi","N","NULL","N","N","08","NULL","Y","N","772","N","N","N","N","N","N",0,"N","N","N","N","N","SYSTEM","SYSTEM","1"
