TI_APPARTENENZA,TI_GESTIONE,CD_ELEMENTO_VOCE,CD_PROPRIO_ELEMENTO,TI_ELEMENTO_VOCE,FL_LIMITE_ASS_OBBLIG,FL_VOCE_PERSONALE,DS_ELEMENTO_VOCE,FL_PARTITA_GIRO,CD_CAPOCONTO_FIN,FL_VOCE_SAC,FL_VOCE_NON_SOGG_IMP_AUT,COD_CLA_E,COD_CLA_S,FL_RECON,FL_INV_BENI_PATR,ID_CLASSIFICAZIONE,FL_VOCE_FONDO,FL_CHECK_TERZO_SIOPE,FL_INV_BENI_COMP,FL_LIMITE_SPESA,FL_PRELIEVO,FL_SOGGETTO_PRELIEVO,PERC_PRELIEVO_PDGP_ENTRATE,FL_SOLO_RESIDUO,FL_SOLO_COMPETENZA,FL_TROVATO,FL_AZZERA_RESIDUI,FL_MISSIONI,UTCR,UTUV,PG_VER_REC
"D","S","13012","13012","C","Y","N","Altri materiali tecnico-specialistici non sanitari","N","C","N","N","NULL","04","Y","N","140","N","N","N","N","N","N",0,"N","N","N","N","N","SYSTEM","SYSTEM","1"
"D","S","13013","13013","C","Y","N","Strumenti tecnico-specialistici non sanitari","N","C","N","N","NULL","04","Y","N","142","N","N","N","N","N","N",0,"N","N","N","N","N","SYSTEM","SYSTEM","1"
"D","S","13014","13014","C","Y","N","Beni per attivita' di rappresentanza ","N","C","N","N","NULL","03","Y","N","144","N","N","N","Y","N","N",0,"N","N","N","N","N","SYSTEM","SYSTEM","1"
"D","S","13015","13015","C","Y","N","Generi alimentari","N","C","N","N","NULL","03","Y","N","146","N","N","N","N","N","N",0,"N","N","N","N","N","SYSTEM","SYSTEM","1"
"D","S","13016","13016","C","Y","N","Stampati specialistici","N","C","N","N","NULL","03","Y","N","148","N","N","N","N","N","N",0,"N","N","N","N","N","SYSTEM","SYSTEM","1"
"D","S","13017","13017","C","Y","N","Altri beni e materiali di consumo","N","C","N","N","NULL","03","Y","N","150","N","N","N","N","N","N",0,"N","N","N","N","N","SYSTEM","SYSTEM","1"
"D","S","13018","13018","C","Y","N","Fauna","N","C","N","N","NULL","04","Y","N","153","N","N","N","N","N","N",0,"N","N","N","N","N","SYSTEM","SYSTEM","1"
"D","S","13019","13019","C","Y","N","Flora","N","C","N","N","NULL","04","Y","N","155","N","N","N","N","N","N",0,"N","N","N","N","N","SYSTEM","SYSTEM","1"
"D","S","13020","13020","C","Y","N","Prodotti farmaceutici ed emoderivati","N","C","N","N","NULL","04","Y","N","158","N","N","N","N","N","N",0,"N","N","N","N","N","SYSTEM","SYSTEM","1"
"D","S","13021","13021","C","Y","N","Sangue ed emocomponenti","N","C","N","N","NULL","04","Y","N","160","N","N","N","N","N","N",0,"N","N","N","N","N","SYSTEM","SYSTEM","1"
"D","S","13022","13022","C","Y","N","Dispositivi medici","N","C","N","N","NULL","04","Y","N","162","N","N","N","N","N","N",0,"N","N","N","N","N","SYSTEM","SYSTEM","1"
"D","S","13023","13023","C","Y","N","Prodotti dietetici","N","C","N","N","NULL","04","Y","N","164","N","N","N","N","N","N",0,"N","N","N","N","N","SYSTEM","SYSTEM","1"
"D","S","13024","13024","C","Y","N","Prodotti chimici","N","C","N","N","NULL","04","Y","N","166","N","N","N","N","N","N",0,"N","N","N","N","N","SYSTEM","SYSTEM","1"
"D","S","13025","13025","C","Y","N","Materali e prodotti per uso veterinario","N","C","N","N","NULL","04","Y","N","168","N","N","N","N","N","N",0,"N","N","N","N","N","SYSTEM","SYSTEM","1"
"D","S","13026","13026","C","Y","N","Altri beni e prodotti sanitari ","N","C","N","N","NULL","04","Y","N","170","N","N","N","N","N","N",0,"N","N","N","N","N","SYSTEM","SYSTEM","1"
"D","S","13027","13027","C","Y","N","Organi istituzionali dell'amministrazione - Indennita'","N","A","Y","N","NULL","01","N","N","174","N","N","N","N","N","N",0,"N","N","N","N","N","SYSTEM","SYSTEM","1"
"D","S","13028","13028","C","Y","N","Organi istituzionali dell'amministrazione - Rimborsi ","N","A","Y","N","NULL","01","N","N","176","N","N","N","N","N","N",0,"N","N","N","N","Y","SYSTEM","SYSTEM","1"
"D","S","13029","13029","C","Y","N","Compensi agli organi istituzionali di revisione, di controllo ed altri incarichi istituzionali dell'amministrazione","N","A","Y","N","NULL","01","N","N","178","N","N","N","N","N","N",0,"N","N","N","N","N","SYSTEM","SYSTEM","1"
"D","S","13030","13030","C","Y","N","Rimborso spese di missione e trasferta del personale dipendente","N","B","N","N","NULL","02","N","N","181","N","N","N","Y","N","N",0,"N","N","N","N","Y","SYSTEM","SYSTEM","1"
"D","S","13031","13031","C","Y","N","Rimborso spese di missione e trasferta del personale non soggette ai limiti di spesa","N","B","N","N","NULL","02","N","N","182","N","N","N","N","N","N",0,"N","N","N","N","Y","SYSTEM","SYSTEM","1"
"D","S","13032","13032","C","Y","Y","Indennit? di trasferimento e prima sistemazione del personale","N","B","Y","N","NULL","02","N","N","183","N","N","N","N","N","N",0,"N","N","N","N","N","SYSTEM","SYSTEM","1"
"D","S","13033","13033","C","Y","N","Spese di trasferta del personale associato e degli assegnisti di ricerca","N","C","N","N","NULL","04","N","N","185","N","N","N","N","N","N",0,"N","N","N","N","Y","SYSTEM","SYSTEM","1"
"D","S","13034","13034","C","Y","N","Professori visitatori","N","C","N","N","NULL","04","Y","N","186","N","N","N","N","N","N",0,"N","N","N","N","N","SYSTEM","SYSTEM","1"
"D","S","13035","13035","C","Y","N","Rimborso spese missione ricercatori italiani e stranieri in ambito accordi mobilit? internazionale","N","H","N","N","NULL","04","N","N","187","N","N","N","N","N","N",0,"N","N","N","N","Y","SYSTEM","SYSTEM","1"
"D","S","13036","13036","C","Y","N","Rimborso spese agli organi istituzionali di revisione, di controllo e altri incarichi istituzionali dell'ente","N","A","N","N","NULL","01","N","N","188","N","N","N","N","N","N",0,"N","N","N","N","Y","SYSTEM","SYSTEM","1"
"D","S","13037","13037","C","Y","N","Pubblicita'","N","C","N","N","NULL","03","Y","N","191","N","N","N","Y","N","N",0,"N","N","N","N","N","SYSTEM","SYSTEM","1"
"D","S","13038","13038","C","Y","N","Spese per l'organizzazione di convegni","N","C","N","N","NULL","04","Y","N","193","N","N","N","N","N","N",0,"N","N","N","N","Y","SYSTEM","SYSTEM","1"
"D","S","13039","13039","C","Y","N","Spese per la partecipazione a convegni","N","C","N","N","NULL","04","N","N","194","N","N","N","N","N","N",0,"N","N","N","N","Y","SYSTEM","SYSTEM","1"
"D","S","13040","13040","C","Y","N","Mostre ed altre spese per relazioni pubbliche","N","C","N","N","NULL","04","Y","N","197","N","N","N","Y","N","N",0,"N","N","N","N","N","SYSTEM","SYSTEM","1"
"D","S","13041","13041","C","Y","N","Acquisto di servizi per formazione obbligatoria","N","B","N","N","NULL","02","N","N","201","N","N","N","Y","N","N",0,"N","N","N","N","Y","SYSTEM","SYSTEM","1"
"D","S","13042","13042","C","Y","N","Acquisto di servizi per la formazione generica e discrezionale","N","B","N","N","NULL","02","N","N","203","N","N","N","Y","N","N",0,"N","N","N","N","Y","SYSTEM","SYSTEM","1"
"D","S","13043","13043","C","Y","N","Canoni di telefonia fissa","N","C","N","N","NULL","03","Y","N","206","N","N","N","N","N","N",0,"N","N","N","N","N","SYSTEM","SYSTEM","1"
"D","S","13044","13044","C","Y","N","Canoni di telefonia mobile","N","C","N","N","NULL","03","Y","N","208","N","N","N","N","N","N",0,"N","N","N","N","N","SYSTEM","SYSTEM","1"
"D","S","13045","13045","C","Y","N","Accesso a banche dati e a pubblicazioni on line","N","C","N","N","NULL","04","Y","N","210","N","N","N","N","N","N",0,"N","N","N","N","N","SYSTEM","SYSTEM","1"
"D","S","13046","13046","C","Y","N","Energia elettrica","N","C","N","N","NULL","03","Y","N","212","N","N","N","N","N","N",0,"N","N","N","N","N","SYSTEM","SYSTEM","1"
"D","S","13047","13047","C","Y","N","Acqua","N","C","N","N","NULL","03","Y","N","214","N","N","N","N","N","N",0,"N","N","N","N","N","SYSTEM","SYSTEM","1"
"D","S","13048","13048","C","Y","N","Gas","N","C","N","N","NULL","03","Y","N","216","N","N","N","N","N","N",0,"N","N","N","N","N","SYSTEM","SYSTEM","1"
"D","S","13049","13049","C","Y","N","Spese di condominio e di gestione comune di locali ed immobili","N","C","N","N","NULL","03","Y","N","218","N","N","N","N","N","N",0,"N","N","N","N","N","SYSTEM","SYSTEM","1"
"C","E","92009","92009","C","N","N","Trasferimenti da Anas S.p.A. per operazioni conto terzi","Y","NULL","N","N","NULL","NULL","N","N","1232","N","N","N","N","N","N",0,"Y","N","N","N","N","SYSTEM","SYSTEM","1"
"C","E","92010","92010","C","N","N","Trasferimenti da altri enti centrali produttori di servizi economici per operazioni conto terzi","Y","NULL","N","N","NULL","NULL","N","N","1234","N","N","N","N","N","N",0,"Y","N","N","N","N","SYSTEM","SYSTEM","1"
"C","E","92011","92011","C","N","N","Trasferimenti da autorita' amministrative indipendenti per operazioni conto terzi","Y","NULL","N","N","NULL","NULL","N","N","1236","N","N","N","N","N","N",0,"Y","N","N","N","N","SYSTEM","SYSTEM","1"
"C","E","92012","92012","C","N","N","Trasferimenti da enti centrali a struttura associativa per operazioni conto terzi","Y","NULL","N","N","NULL","NULL","N","N","1238","N","N","N","N","N","N",0,"Y","N","N","N","N","SYSTEM","SYSTEM","1"
"C","E","92013","92013","C","N","N","Trasferimenti da enti centrali produttori di servizi assistenziali, ricreativi e culturali per operazioni conto terzi","Y","NULL","N","N","NULL","NULL","N","N","1240","N","N","N","N","N","N",0,"Y","N","N","N","N","SYSTEM","SYSTEM","1"
"C","E","92014","92014","C","N","N","Trasferimenti da enti e istituzioni centrali di ricerca e Istituti e stazioni sperimentali per la ricerca per operazioni conto terzi","Y","NULL","N","N","NULL","NULL","N","N","1242","N","N","N","N","N","N",0,"Y","N","N","N","N","SYSTEM","SYSTEM","1"
"C","E","92015","92015","C","N","N","Trasferimenti da altre Amministrazioni Centrali n.a.c. per operazioni conto terzi","Y","NULL","N","N","NULL","NULL","N","N","1244","N","N","N","N","N","N",0,"Y","N","N","N","N","SYSTEM","SYSTEM","1"
"C","E","92016","92016","C","N","N","Trasferimenti da Regioni e province autonome per operazioni conto terzi","Y","NULL","N","N","NULL","NULL","N","N","1247","N","N","N","N","N","N",0,"Y","N","N","N","N","SYSTEM","SYSTEM","1"
"C","E","92017","92017","C","N","N","Trasferimenti da Province per operazioni conto terzi","Y","NULL","N","N","NULL","NULL","N","N","1249","N","N","N","N","N","N",0,"Y","N","N","N","N","SYSTEM","SYSTEM","1"
"C","E","92018","92018","C","N","N","Trasferimenti da Comuni per operazioni conto terzi","Y","NULL","N","N","NULL","NULL","N","N","1251","N","N","N","N","N","N",0,"Y","N","N","N","N","SYSTEM","SYSTEM","1"
"C","E","92019","92019","C","N","N","Trasferimenti da Citta' metropolitane e Roma capitale per operazioni conto terzi","Y","NULL","N","N","NULL","NULL","N","N","1253","N","N","N","N","N","N",0,"Y","N","N","N","N","SYSTEM","SYSTEM","1"
"C","E","92020","92020","C","N","N","Trasferimenti da Unioni di Comuni per operazioni conto terzi","Y","NULL","N","N","NULL","NULL","N","N","1255","N","N","N","N","N","N",0,"Y","N","N","N","N","SYSTEM","SYSTEM","1"
"C","E","92021","92021","C","N","N","Trasferimenti da Comunita' Montane per operazioni conto terzi","Y","NULL","N","N","NULL","NULL","N","N","1257","N","N","N","N","N","N",0,"Y","N","N","N","N","SYSTEM","SYSTEM","1"
"C","E","92022","92022","C","N","N","Trasferimenti da Camere di Commercio per operazioni conto terzi","Y","NULL","N","N","NULL","NULL","N","N","1259","N","N","N","N","N","N",0,"Y","N","N","N","N","SYSTEM","SYSTEM","1"
"C","E","92023","92023","C","N","N","Trasferimenti da Universita' per operazioni conto terzi","Y","NULL","N","N","NULL","NULL","N","N","1261","N","N","N","N","N","N",0,"Y","N","N","N","N","SYSTEM","SYSTEM","1"
"C","E","92024","92024","C","N","N","Trasferimenti da Parchi nazionali e consorzi ed enti autonomi gestori di parchi e aree naturali protette per operazioni conto terzi","Y","NULL","N","N","NULL","NULL","N","N","1263","N","N","N","N","N","N",0,"Y","N","N","N","N","SYSTEM","SYSTEM","1"
"C","E","92025","92025","C","N","N","Trasferimenti da Autorita' Portuali per operazioni conto terzi","Y","NULL","N","N","NULL","NULL","N","N","1265","N","N","N","N","N","N",0,"Y","N","N","N","N","SYSTEM","SYSTEM","1"
"C","E","92026","92026","C","N","N","Trasferimenti da Aziende sanitarie locali  per operazioni conto terzi","Y","NULL","N","N","NULL","NULL","N","N","1267","N","N","N","N","N","N",0,"Y","N","N","N","N","SYSTEM","SYSTEM","1"
"C","E","92027","92027","C","N","N","Trasferimenti da Aziende ospedaliere e Aziende ospedaliere universitarie integrate con il SSN per operazioni conto terzi","Y","NULL","N","N","NULL","NULL","N","N","1269","N","N","N","N","N","N",0,"Y","N","N","N","N","SYSTEM","SYSTEM","1"
"C","E","92028","92028","C","N","N","Trasferimenti da policlinici per operazioni conto terzi","Y","NULL","N","N","NULL","NULL","N","N","1271","N","N","N","N","N","N",0,"Y","N","N","N","N","SYSTEM","SYSTEM","1"
"C","E","92029","92029","C","N","N","Trasferimenti da Istituti di ricovero e cura a carattere scientifico pubblici per operazioni conto terzi","Y","NULL","N","N","NULL","NULL","N","N","1273","N","N","N","N","N","N",0,"Y","N","N","N","N","SYSTEM","SYSTEM","1"
"C","E","92030","92030","C","N","N","Trasferimenti da altre Amministrazioni Locali produttrici di servizi sanitari per operazioni conto terzi","Y","NULL","N","N","NULL","NULL","N","N","1275","N","N","N","N","N","N",0,"Y","N","N","N","N","SYSTEM","SYSTEM","1"
"C","E","92031","92031","C","N","N","Trasferimenti da Agenzie regionali per le erogazioni in agricoltura per operazioni conto terzi","Y","NULL","N","N","NULL","NULL","N","N","1277","N","N","N","N","N","N",0,"Y","N","N","N","N","SYSTEM","SYSTEM","1"
"C","E","92032","92032","C","N","N","Trasferimenti da altri enti e agenzie regionali e sub regionali per operazioni conto terzi","Y","NULL","N","N","NULL","NULL","N","N","1279","N","N","N","N","N","N",0,"Y","N","N","N","N","SYSTEM","SYSTEM","1"
"C","E","92033","92033","C","N","N","Trasferimenti da Consorzi di enti locali per operazioni conto terzi","Y","NULL","N","N","NULL","NULL","N","N","1281","N","N","N","N","N","N",0,"Y","N","N","N","N","SYSTEM","SYSTEM","1"
"C","E","92034","92034","C","N","N","Trasferimenti da Fondazioni e istituzioni liriche locali e da teatri stabili di iniziativa pubblica per operazioni conto terzi","Y","NULL","N","N","NULL","NULL","N","N","1283","N","N","N","N","N","N",0,"Y","N","N","N","N","SYSTEM","SYSTEM","1"
"C","E","92035","92035","C","N","N","Trasferimenti da altre Amministrazioni Locali n.a.c. per operazioni conto terzi","Y","NULL","N","N","NULL","NULL","N","N","1285","N","N","N","N","N","N",0,"Y","N","N","N","N","SYSTEM","SYSTEM","1"
"C","E","92036","92036","C","N","N","Trasferimenti da INPS per operazioni conto terzi","Y","NULL","N","N","NULL","NULL","N","N","1288","N","N","N","N","N","N",0,"Y","N","N","N","N","SYSTEM","SYSTEM","1"
"C","E","92037","92037","C","N","N","Trasferimenti da INAIL per operazioni conto terzi","Y","NULL","N","N","NULL","NULL","N","N","1290","N","N","N","N","N","N",0,"Y","N","N","N","N","SYSTEM","SYSTEM","1"
"C","E","92038","92038","C","N","N","Trasferimenti da altri Enti di Previdenza n.a.c. per operazioni conto terzi","Y","NULL","N","N","NULL","NULL","N","N","1292","N","N","N","N","N","N",0,"Y","N","N","N","N","SYSTEM","SYSTEM","1"
"C","E","92039","92039","C","N","N","Trasferimenti da Famiglie per operazioni conto terzi","Y","NULL","N","N","NULL","NULL","N","N","1296","N","N","N","N","N","N",0,"Y","N","N","N","N","SYSTEM","SYSTEM","1"
"C","E","92040","92040","C","N","N","Trasferimenti da imprese controllate per operazioni conto terzi","Y","NULL","N","N","NULL","NULL","N","N","1299","N","N","N","N","N","N",0,"Y","N","N","N","N","SYSTEM","SYSTEM","1"
"C","E","92041","92041","C","N","N","Trasferimenti da altre imprese partecipate per operazioni conto terzi","Y","NULL","N","N","NULL","NULL","N","N","1301","N","N","N","N","N","N",0,"Y","N","N","N","N","SYSTEM","SYSTEM","1"
"C","E","92042","92042","C","N","N","Trasferimenti da altre imprese per operazioni conto terzi","Y","NULL","N","N","NULL","NULL","N","N","1303","N","N","N","N","N","N",0,"Y","N","N","N","N","SYSTEM","SYSTEM","1"
"C","E","92043","92043","C","N","N","Trasferimenti da Istituzioni Sociali Private  per operazioni conto terzi","Y","NULL","N","N","NULL","NULL","N","N","1306","N","N","N","N","N","N",0,"Y","N","N","N","N","SYSTEM","SYSTEM","1"
"C","E","92044","92044","C","N","N","Trasferimenti dall'Unione Europea e dal Resto del Mondo per operazioni conto terzi","Y","NULL","N","N","NULL","NULL","N","N","1309","N","N","N","N","N","N",0,"Y","N","N","N","N","SYSTEM","SYSTEM","1"
"C","E","92045","92045","C","N","N","Costituzione di depositi cauzionali o contrattuali di terzi","Y","NULL","N","N","NULL","NULL","N","N","1313","N","N","N","N","N","N",0,"Y","N","N","N","N","SYSTEM","SYSTEM","1"
"C","E","92046","92046","C","N","N","Restituzione di depositi cauzionali o contrattuali presso terzi","Y","NULL","N","N","NULL","NULL","N","N","1316","N","N","N","N","N","N",0,"N","N","N","N","N","SYSTEM","SYSTEM","1"
"C","E","92047","92047","C","N","N","Riscossione di imposte di natura corrente per conto di terzi","Y","NULL","N","N","NULL","NULL","N","N","1320","N","N","N","N","N","N",0,"Y","N","N","N","N","SYSTEM","SYSTEM","1"
"C","E","92048","92048","C","N","N","Riscossione di imposte in conto capitale per conto di terzi","Y","NULL","N","N","NULL","NULL","N","N","1323","N","N","N","N","N","N",0,"Y","N","N","N","N","SYSTEM","SYSTEM","1"
"C","E","92049","92049","C","N","N","Altre entrate per conto terzi","Y","NULL","N","N","NULL","NULL","N","N","1327","N","N","N","N","N","N",0,"Y","N","N","N","N","SYSTEM","SYSTEM","1"
"D","S","00000","00000","C","Y","N","Avanzo di competenza","N","NULL","N","N","NULL","NULL","N","N","NULL","Y","N","N","N","N","N",0,"N","N","N","N","N","SYSTEM","SYSTEM","1"
"D","S","10001","10001","C","Y","N","Fondo di riserva","N","NULL","N","N","NULL","NULL","N","N","476","Y","N","N","N","N","N",0,"N","Y","N","N","N","SYSTEM","SYSTEM","1"
"D","S","10002","10002","C","Y","N","Fondo per il finanziamento di programmi di monitoraggio e controllo","N","NULL","N","N","NULL","NULL","N","N","477","Y","N","N","N","N","N",0,"N","Y","N","N","N","SYSTEM","SYSTEM","1"
"D","S","10003","10003","C","Y","N","Fondo rischi ed oneri","N","NULL","N","N","NULL","NULL","N","N","480","Y","N","N","N","N","N",0,"N","Y","N","N","N","SYSTEM","SYSTEM","1"
"D","S","10004","10004","C","Y","N","Fondo per rinnovi contrattuali","N","NULL","N","N","NULL","NULL","N","N","483","Y","N","N","N","N","N",0,"N","Y","N","N","N","SYSTEM","SYSTEM","1"
"D","S","10005","10005","C","Y","N","Versamenti IVA a debito per le gestioni commerciali","N","I","N","N","NULL","06","N","N","490","N","N","N","N","N","N",0,"N","N","N","N","N","SYSTEM","SYSTEM","1"
"D","S","10006","10006","C","Y","N","Premi di assicurazione su beni mobili","N","C","N","N","NULL","03","Y","N","494","N","N","N","N","N","N",0,"N","N","N","N","N","SYSTEM","SYSTEM","1"
"D","S","10007","10007","C","Y","N","Premi di assicurazione su beni immobili","N","C","N","N","NULL","03","Y","N","496","N","N","N","N","N","N",0,"N","N","N","N","N","SYSTEM","SYSTEM","1"
"D","S","10008","10008","C","Y","N","Premi di assicurazione per responsabilita' civile verso terzi","N","C","N","N","NULL","03","N","N","498","N","N","N","N","N","N",0,"N","N","N","N","N","SYSTEM","SYSTEM","1"
"D","S","10009","10009","C","Y","N","Premi di assicurazione contro i danni","N","C","N","N","NULL","03","Y","N","500","N","N","N","N","N","N",0,"N","N","N","N","N","SYSTEM","SYSTEM","1"
"D","S","10010","10010","C","Y","N","Spese dovute a sanzioni","N","J","N","N","NULL","14","N","N","504","N","N","N","N","N","N",0,"N","N","N","N","N","SYSTEM","SYSTEM","1"
"D","S","10011","10011","C","Y","N","Spese per risarcimento danni","N","J","N","N","NULL","14","N","N","507","N","N","N","N","N","N",0,"N","N","N","N","N","SYSTEM","SYSTEM","1"
"D","S","10012","10012","C","Y","N","Spese per indennizzi","N","J","N","N","NULL","14","N","N","510","N","N","N","N","N","N",0,"N","N","N","N","N","SYSTEM","SYSTEM","1"
"D","S","10013","10013","C","Y","N","Oneri da contenzioso","N","J","N","N","NULL","14","N","N","513","N","N","N","N","N","N",0,"N","N","N","N","N","SYSTEM","SYSTEM","1"
"D","S","11001","11001","C","Y","Y","Arretrati per anni precedenti corrisposti al personale a tempo indeterminato","N","B","Y","N","NULL","02","N","N","1","N","N","N","N","N","N",0,"N","N","N","N","N","SYSTEM","SYSTEM","1"
"D","S","11002","11002","C","Y","Y","Stipendi ed assegni fissi per il personale a tempo indeterminato","N","B","Y","N","NULL","02","N","N","3","N","N","N","N","N","N",0,"N","N","N","N","N","SYSTEM","SYSTEM","1"
"D","S","11003","11003","C","Y","Y","Straordinario per il personale a tempo indeterminato","N","B","Y","N","NULL","02","N","N","5","N","N","N","N","N","N",0,"N","N","N","N","N","SYSTEM","SYSTEM","1"
"D","S","11004","11004","C","Y","Y","Indennita' ed altri compensi, esclusi i rimborsi spesa per missione, corrisposti al personale a tempo indeterminato","N","B","Y","N","NULL","02","N","N","7","N","N","N","N","N","N",0,"N","N","N","N","N","SYSTEM","SYSTEM","1"
"D","S","11005","11005","C","Y","N","Salario accessorio","N","B","Y","N","NULL","02","N","N","8","N","N","N","N","N","N",0,"N","N","N","N","N","SYSTEM","SYSTEM","1"
"D","S","11006","11006","C","Y","N","Compensi per prestazioni professionali rientranti in specifiche disposizioni di legge corrisposti al personale a tempo indeterminato","N","B","N","N","NULL","02","N","N","9","N","N","N","N","N","N",0,"N","N","N","N","N","SYSTEM","SYSTEM","1"
"D","S","11007","11007","C","Y","N","Equo premio per attivita' inventiva ","N","B","Y","N","NULL","02","N","N","10","N","N","N","N","N","N",0,"N","N","N","N","N","SYSTEM","SYSTEM","1"
"D","S","11008","11008","C","Y","Y","Arretrati per anni precedenti corrisposti al personale a tempo determinato/Fonti interne","N","B","Y","N","NULL","02","N","N","13","N","N","N","N","N","N",0,"N","N","N","N","N","SYSTEM","SYSTEM","1"
"D","S","11009","11009","C","Y","Y","Arretrati per anni precedenti corrisposti al personale a tempo determinato/Fonti esterne","N","B","Y","N","NULL","02","N","N","14","N","N","N","N","N","N",0,"N","N","N","N","N","SYSTEM","SYSTEM","1"
"D","S","11010","11010","C","Y","Y","Arretrati per anni precedenti corrisposti al personale a tempo determinato/Tipo Privatistico","N","B","Y","N","NULL","02","N","N","15","N","N","N","N","N","N",0,"N","N","N","N","N","SYSTEM","SYSTEM","1"
"D","S","11011","11011","C","Y","Y","Stipendi ed assegni fissi per il personale a tempo determinato da fonti interne","N","B","Y","N","NULL","02","N","N","17","N","N","N","N","N","N",0,"N","N","N","N","N","SYSTEM","SYSTEM","1"
"D","S","11012","11012","C","Y","Y","Stipendi ed assegni fissi per il personale a tempo determinato/Fonti esterne","N","B","Y","N","NULL","02","N","N","18","N","N","N","N","N","N",0,"N","N","N","N","N","SYSTEM","SYSTEM","1"
"D","S","11013","11013","C","Y","Y","Stipendi ed assegni fissi per il personale assunto con contratto di tipo privatistico","N","B","Y","N","NULL","02","N","N","19","N","N","N","N","N","N",0,"N","N","N","N","N","SYSTEM","SYSTEM","1"
"D","S","13056","13056","C","Y","N","Noleggi di altri mezzi di trasporto stradali","N","C","N","N","NULL","03","Y","N","229","N","N","N","N","N","N",0,"N","N","N","N","N","SYSTEM","SYSTEM","1"
"D","S","13057","13057","C","Y","N","Noleggi di attrezzature scientifiche e sanitarie","N","C","N","N","NULL","03","Y","N","231","N","N","N","N","N","N",0,"N","N","N","N","N","SYSTEM","SYSTEM","1"
"D","S","13058","13058","C","Y","N","Noleggi di hardware","N","C","N","N","NULL","03","Y","N","233","N","N","N","N","N","N",0,"N","N","N","N","N","SYSTEM","SYSTEM","1"
"D","S","13059","13059","C","Y","N","Fitti di terreni ","N","C","N","N","NULL","03","Y","N","235","N","N","N","N","N","N",0,"N","N","N","N","N","SYSTEM","SYSTEM","1"
"D","S","13060","13060","C","Y","N","Licenze d'uso per software","N","C","N","N","NULL","03","Y","N","237","N","N","N","N","N","N",0,"N","N","N","N","N","SYSTEM","SYSTEM","1"
"D","S","13061","13061","C","Y","N","Altre licenze d'uso","N","C","N","N","NULL","03","Y","N","239","N","N","N","N","N","N",0,"N","N","N","N","N","SYSTEM","SYSTEM","1"
"D","S","13062","13062","C","Y","N","Noleggi di impianti e macchinari","N","C","N","N","NULL","03","Y","N","241","N","N","N","N","N","N",0,"N","N","N","N","N","SYSTEM","SYSTEM","1"
"D","S","13063","13063","C","Y","N","Leasing operativo di autovetture","N","C","N","N","NULL","03","Y","N","246","N","N","N","Y","N","N",0,"N","N","N","N","N","SYSTEM","SYSTEM","1"
"D","S","13064","13064","C","Y","N","Leasing operativo di altri mezzi di trasporto stradale","N","C","N","N","NULL","03","Y","N","247","N","N","N","N","N","N",0,"N","N","N","N","N","SYSTEM","SYSTEM","1"
"D","S","13065","13065","C","Y","N","Leasing operativo relativo a natanti, imbarcazioni e velivoli","N","C","N","N","NULL","04","Y","N","248","N","N","N","N","N","N",0,"N","N","N","N","N","SYSTEM","SYSTEM","1"
"D","S","13066","13066","C","Y","N","Leasing operativo di attrezzature e macchinari","N","C","N","N","NULL","03","Y","N","250","N","N","N","N","N","N",0,"N","N","N","N","N","SYSTEM","SYSTEM","1"
"D","S","13067","13067","C","Y","N","Leasing operativo di altri beni","N","C","N","N","NULL","03","Y","N","252","N","N","N","N","N","N",0,"N","N","N","N","N","SYSTEM","SYSTEM","1"
"D","S","13068","13068","C","Y","N","Manutenzione ordinaria e riparazioni di autovetture","N","C","N","N","NULL","03","Y","N","255","N","N","N","Y","N","N",0,"N","N","N","N","N","SYSTEM","SYSTEM","1"
"D","S","13069","13069","C","Y","N","Manutenzione ordinaria e riparazioni di altri mezzi di trasporto stradale","N","C","N","N","NULL","03","Y","N","256","N","N","N","N","N","N",0,"N","N","N","N","N","SYSTEM","SYSTEM","1"
"D","S","13070","13070","C","Y","N","Manutenzione ordinaria e riparazioni della Nave ""Urania""","N","C","N","N","NULL","04","Y","N","257","N","N","N","N","N","N",0,"N","N","N","N","N","SYSTEM","SYSTEM","1"
"D","S","13071","13071","C","Y","N","Manutenzione ordinaria e riparazioni di natanti, imbarcazioni e velivoli","N","C","N","N","NULL","04","Y","N","258","N","N","N","N","N","N",0,"N","N","N","N","N","SYSTEM","SYSTEM","1"
"D","S","13072","13072","C","Y","N","Manutenzione ordinaria e riparazioni di mobili e arredi","N","C","N","N","NULL","03","Y","N","260","N","N","N","N","N","N",0,"N","N","N","N","N","SYSTEM","SYSTEM","1"
