TI_APPARTENENZA,TI_GESTIONE,CD_ELEMENTO_VOCE,CD_PROPRIO_ELEMENTO,TI_ELEMENTO_VOCE,FL_LIMITE_ASS_OBBLIG,FL_VOCE_PERSONALE,DS_ELEMENTO_VOCE,FL_PARTITA_GIRO,CD_CAPOCONTO_FIN,FL_VOCE_SAC,FL_VOCE_NON_SOGG_IMP_AUT,COD_CLA_E,COD_CLA_S,FL_RECON,FL_INV_BENI_PATR,ID_CLASSIFICAZIONE,FL_VOCE_FONDO,FL_CHECK_TERZO_SIOPE,FL_INV_BENI_COMP,FL_LIMITE_SPESA,FL_PRELIEVO,FL_SOGGETTO_PRELIEVO,PERC_PRELIEVO_PDGP_ENTRATE,FL_SOLO_RESIDUO,FL_SOLO_COMPETENZA,FL_TROVATO,FL_AZZERA_RESIDUI,FL_MISSIONI,UTCR,UTUV,PG_VER_REC
"D","S","13073","13073","C","Y","N","Manutenzione ordinaria e riparazioni di impianti e macchinari","N","C","N","N","NULL","04","Y","N","262","N","N","N","N","N","N",0,"N","N","N","N","N","SYSTEM","SYSTEM","1"
"D","S","13074","13074","C","Y","N","Manutenzione ordinaria e riparazioni di attrezzature","N","C","N","N","NULL","04","Y","N","264","N","N","N","N","N","N",0,"N","N","N","N","N","SYSTEM","SYSTEM","1"
"D","S","13075","13075","C","Y","N","Manutenzione ordinaria e riparazioni di macchine per ufficio ","N","C","N","N","NULL","04","Y","N","266","N","N","N","N","N","N",0,"N","N","N","N","N","SYSTEM","SYSTEM","1"
"D","S","13076","13076","C","Y","N","Manutenzione ordinaria e riparazioni di beni immobili di proprieta'","N","C","N","N","NULL","03","Y","N","268","N","N","N","Y","N","N",0,"N","N","N","N","N","SYSTEM","SYSTEM","1"
"D","S","13077","13077","C","Y","N","Manutenzione ordinaria e riparazioni di beni immobili in locazione, in comodato o in uso","N","C","N","N","NULL","03","Y","N","269","N","N","N","Y","N","N",0,"N","N","N","N","N","SYSTEM","SYSTEM","1"
"D","S","13078","13078","C","Y","N","Incarichi libero professionali di studi, ricerca e consulenza","N","C","N","N","NULL","04","Y","N","272","N","N","N","N","N","N",0,"N","N","N","N","N","SYSTEM","SYSTEM","1"
"D","S","13079","13079","C","Y","N","Esperti per commissioni, comitati e consigli","N","C","N","N","NULL","04","N","N","274","N","N","N","N","N","N",0,"N","N","N","N","Y","SYSTEM","SYSTEM","1"
"D","S","13080","13080","C","Y","N","Interpretariato e traduzioni","N","C","N","N","NULL","04","Y","N","277","N","N","N","N","N","N",0,"N","N","N","N","N","SYSTEM","SYSTEM","1"
"D","S","13081","13081","C","Y","N","Perizie","N","C","N","N","NULL","04","Y","N","279","N","N","N","N","N","N",0,"N","N","N","N","N","SYSTEM","SYSTEM","1"
"D","S","13082","13082","C","Y","N","Prestazioni di natura contabile, tributaria e del lavoro","N","C","N","N","NULL","04","Y","N","283","N","N","N","N","N","N",0,"N","N","N","N","N","SYSTEM","SYSTEM","1"
"D","S","13083","13083","C","Y","N","Prestazioni tecnico-scientifiche a fini di ricerca","N","C","N","N","NULL","04","Y","N","285","N","N","N","N","N","N",0,"N","N","N","N","N","SYSTEM","SYSTEM","1"
"D","S","13084","13084","C","Y","N","Deposito, mantenimento e tutela dei brevetti","N","C","N","N","NULL","04","Y","N","287","N","N","N","N","N","N",0,"N","N","E","N","N","SYSTEM","SYSTEM","1"
"D","S","13085","13085","C","Y","N","Altre prestazioni professionali e specialistiche ","N","C","N","N","NULL","04","Y","N","289","N","N","N","N","N","N",0,"N","N","N","N","N","SYSTEM","SYSTEM","1"
"D","S","13086","13086","C","Y","N","Servizi da agenzie di lavoro interinale","N","C","N","N","NULL","04","Y","N","292","N","N","N","N","N","N",0,"N","N","N","N","N","SYSTEM","SYSTEM","1"
"D","S","13087","13087","C","Y","N","Collaborazioni coordinate e a progetto","N","C","N","N","NULL","04","Y","N","294","N","N","N","N","N","N",0,"N","N","N","N","Y","SYSTEM","SYSTEM","1"
"D","S","13088","13088","C","Y","N","Vigilanza","N","C","N","N","NULL","03","Y","N","299","N","N","N","N","N","N",0,"N","N","N","N","N","SYSTEM","SYSTEM","1"
"D","S","13089","13089","C","Y","N","Pulizia","N","C","N","N","NULL","03","Y","N","301","N","N","N","N","N","N",0,"N","N","N","N","N","SYSTEM","SYSTEM","1"
"D","S","13090","13090","C","Y","N","Servizi di lavanderia","N","C","N","N","NULL","03","Y","N","302","N","N","N","N","N","N",0,"N","N","N","N","N","SYSTEM","SYSTEM","1"
"D","S","13091","13091","C","Y","N","Trasporti, traslochi e facchinaggio","N","C","N","N","NULL","03","Y","N","304","N","N","N","N","N","N",0,"N","N","N","N","Y","SYSTEM","SYSTEM","1"
"D","S","13092","13092","C","Y","N","Acquisto di buoni taxi","N","C","N","N","NULL","03","Y","N","305","N","N","N","Y","N","N",0,"N","N","N","N","N","SYSTEM","SYSTEM","1"
"D","S","13093","13093","C","Y","N","Stampa e rilegatura di pubblicazioni","N","C","N","N","NULL","04","Y","N","307","N","N","N","N","N","N",0,"N","N","N","N","N","SYSTEM","SYSTEM","1"
"D","S","13094","13094","C","Y","N","Rimozione e smaltimento di rifiuti tossico-nocivi e di altri materiali","N","C","N","N","NULL","04","Y","N","309","N","N","N","N","N","N",0,"N","N","N","N","N","SYSTEM","SYSTEM","1"
"D","S","13095","13095","C","Y","N","Mensa","N","C","N","N","NULL","04","N","N","312","N","N","N","N","N","N",0,"N","N","N","N","N","SYSTEM","SYSTEM","1"
"D","S","13096","13096","C","Y","N","Pubblicazione bandi di gara","N","C","N","N","NULL","03","Y","N","316","N","N","N","N","N","N",0,"N","N","N","N","N","SYSTEM","SYSTEM","1"
"D","S","13097","13097","C","Y","N","Spese postali e telegrafiche","N","C","N","N","NULL","03","Y","N","318","N","N","N","N","N","N",0,"N","N","N","N","N","SYSTEM","SYSTEM","1"
"D","S","13098","13098","C","Y","N","Spese notarili","N","C","N","N","NULL","04","Y","N","320","N","N","N","N","N","N",0,"N","N","N","N","N","SYSTEM","SYSTEM","1"
"D","S","13099","13099","C","Y","N","Oneri per fideiussioni","N","L","N","N","NULL","07","N","N","325","N","N","N","N","N","N",0,"N","N","N","N","N","SYSTEM","SYSTEM","1"
"D","S","13100","13100","C","Y","N","Spese per commissioni bancarie","N","L","N","N","NULL","07","N","N","326","N","N","N","N","N","N",0,"N","N","N","N","N","SYSTEM","SYSTEM","1"
"D","S","13101","13101","C","Y","N","Spese per accertamenti sanitari, ivi comprese le spese per visite fiscali","N","B","N","N","NULL","02","N","N","329","N","N","N","N","N","N",0,"N","N","N","N","N","SYSTEM","SYSTEM","1"
"D","S","13102","13102","C","Y","N","Gestione e manutenzione applicazioni","N","C","N","N","NULL","03","Y","N","332","N","N","N","N","N","N",0,"N","N","N","N","N","SYSTEM","SYSTEM","1"
"D","S","13103","13103","C","Y","N","Spese per la progettazione, lo sviluppo, la gestone e la manutenzione di servizi applicativi integrati e siti web","N","C","N","N","NULL","04","Y","N","334","N","N","N","N","N","N",0,"N","N","N","N","N","SYSTEM","SYSTEM","1"
"D","S","13104","13104","C","Y","N","Servizi di rete per trasmissione dati e VoIP e relativa manutenzione","N","C","N","N","NULL","03","Y","N","336","N","N","N","N","N","N",0,"N","N","N","N","N","SYSTEM","SYSTEM","1"
"D","S","13105","13105","C","Y","N","Servizi per la gestione documentale","N","C","N","N","NULL","03","Y","N","342","N","N","N","N","N","N",0,"N","N","N","N","N","SYSTEM","SYSTEM","1"
"D","S","13106","13106","C","Y","N","Servizi di consulenza e prestazioni professionali ICT","N","C","N","N","NULL","04","Y","N","344","N","N","N","N","N","N",0,"N","N","N","N","N","SYSTEM","SYSTEM","1"
"D","S","13107","13107","C","Y","N","Spese legali","N","C","N","N","NULL","03","N","N","349","N","N","N","N","N","N",0,"N","N","N","N","N","SYSTEM","SYSTEM","1"
"D","S","13108","13108","C","Y","N","Quote di iscrizione ad associazioni","N","C","N","N","NULL","04","Y","N","351","N","N","N","N","N","N",0,"N","N","N","N","N","SYSTEM","SYSTEM","1"
"D","S","13109","13109","C","Y","N","Spese per componenti commissioni concorso e selezione del personale","N","B","N","N","NULL","02","N","N","353","N","N","N","N","N","N",0,"N","N","N","N","Y","SYSTEM","SYSTEM","1"
"D","S","13110","13110","C","Y","N","Spese per funzionamento dei Panel di Valutazione","N","C","N","N","NULL","03","N","N","354","N","N","N","N","N","N",0,"N","N","N","N","N","SYSTEM","SYSTEM","1"
"D","S","13111","13111","C","Y","N","Spese per funzionamento delle commissioni di gara","N","C","N","N","NULL","03","N","N","355","N","N","N","N","N","N",0,"N","N","N","N","N","SYSTEM","SYSTEM","1"
"D","S","13112","13112","C","Y","N","Giardinaggio","N","C","N","N","NULL","03","Y","N","357","N","N","N","N","N","N",0,"N","N","N","N","N","SYSTEM","SYSTEM","1"
"D","S","13113","13113","C","Y","N","Spese per l'organizzazione di corsi di formazione","N","C","N","N","NULL","04","N","N","359","N","N","N","N","N","N",0,"N","N","N","N","N","SYSTEM","SYSTEM","1"
"D","S","13114","13114","C","Y","N","Servizi per attivita' di rappresentanza ","N","C","N","N","NULL","03","Y","N","361","N","N","N","Y","N","N",0,"N","N","N","N","N","SYSTEM","SYSTEM","1"
"D","S","13115","13115","C","Y","N","Altri servizi non altrimenti classificabili","N","C","N","N","NULL","03","Y","N","365","N","N","N","N","N","N",0,"N","N","N","N","N","SYSTEM","SYSTEM","1"
"D","S","13116","13116","C","Y","N","Patrocini legali","N","C","N","N","NULL","03","Y","N","281","N","N","N","N","N","N",0,"N","N","N","N","N","SYSTEM","SYSTEM","1"
"D","S","13117","13117","C","Y","N","Servizi per i sistemi informativi e le telecomunicazioni","N","C","N","N","NULL","04","Y","N","338","N","N","N","N","N","N",0,"N","N","N","N","N","SYSTEM","SYSTEM","1"
"D","S","13118","13118","C","Y","N","Indennita' di missione e trasferta del personale dipendente","N","B","N","N","NULL","02","N","N","189","N","N","N","N","N","N",0,"N","N","N","N","Y","SYSTEM","SYSTEM","1"
"D","S","13119","13119","C","Y","N","Servizi di sicurezza dei sistemi informativi e di telecomunicazione","N","C","N","N","NULL","03","Y","N","340","N","N","N","N","N","N",0,"N","N","N","N","N","SYSTEM","SYSTEM","1"
"D","S","13120","13120","C","Y","N","Noleggio di altri beni mobili","N","C","N","N","NULL","03","Y","N","243","N","N","N","N","N","N",0,"N","N","N","N","N","SYSTEM","SYSTEM","1"
"D","S","13121","13121","C","Y","N","Tirocini formativi extracurriculari","N","D","N","N","NULL","05","Y","N","296","N","N","N","N","N","N",0,"N","N","N","N","N","SYSTEM","SYSTEM","1"
"D","S","13122","13122","C","Y","N","Altri servizi informatici e di telecomunicazioni","N","C","N","N","NULL","04","Y","N","346","N","N","N","N","N","N",0,"N","N","N","N","N","SYSTEM","SYSTEM","1"
"D","S","13123","13123","C","Y","N","Spese connesse con la comunicazione via web","N","C","N","N","NULL","04","Y","N","363","N","N","N","N","N","N",0,"N","N","N","N","N","SYSTEM","SYSTEM","1"
"D","S","14001","14001","C","Y","N","Trasferimenti correnti a enti e istituzioni centrali di ricerca e Istituti e stazioni sperimentali per la ricerca","N","E","N","N","NULL","04","Y","N","376","N","N","N","N","N","N",0,"N","N","N","N","N","SYSTEM","SYSTEM","1"
"D","S","14002","14002","C","Y","N","Trasferimenti correnti al Ministero dell'economia in attuazione di norme in materia di contenimento di spesa (DL 112/2008 e DL 78/2010)","N","J","Y","N","NULL","14","N","N","378","N","N","N","N","N","N",0,"N","N","N","N","N","SYSTEM","SYSTEM","1"
"D","S","14003","14003","C","Y","N","Trasferimenti correnti a Regioni e province autonome","N","C","N","N","NULL","04","Y","N","381","N","N","N","N","N","N",0,"N","N","N","N","N","SYSTEM","SYSTEM","1"
"D","S","14004","14004","C","Y","N","Trasferimenti correnti a universita' ","N","E","N","N","NULL","04","Y","N","383","N","N","N","N","N","N",0,"N","N","N","N","N","SYSTEM","SYSTEM","1"
"D","S","14005","14005","C","Y","N","Finanziamento dei dottorati di ricerca","N","D","N","N","NULL","05","Y","N","384","N","N","N","N","N","N",0,"N","N","N","N","N","SYSTEM","SYSTEM","1"
"D","S","14006","14006","C","Y","N","Trasferimenti correnti a aziende sanitarie regionali e locali","N","C","N","N","NULL","04","Y","N","386","N","N","N","N","N","N",0,"N","N","N","N","N","SYSTEM","SYSTEM","1"
"D","S","14007","14007","C","Y","N","Trasferimenti correnti a aziende ospedaliere e a aziende ospedaliere universitarie integrate con il S.S.N.","N","C","N","N","NULL","04","Y","N","388","N","N","N","N","N","N",0,"N","N","N","N","N","SYSTEM","SYSTEM","1"
"D","S","11014","11014","C","Y","N","Retribuzioni degli operai agricoli a tempo determinato","N","B","N","N","NULL","02","N","N","20","N","N","N","N","N","N",0,"N","N","N","N","N","SYSTEM","SYSTEM","1"
"D","S","11015","11015","C","Y","Y","Straordinario per il personale a tempo determinato/Fonti interne","N","B","Y","N","NULL","02","N","N","22","N","N","N","N","N","N",0,"N","N","N","N","N","SYSTEM","SYSTEM","1"
"D","S","11016","11016","C","Y","Y","Straordinario per il personale a tempo determinato/Fonti esterne","N","B","Y","N","NULL","02","N","N","23","N","N","N","N","N","N",0,"N","N","N","N","N","SYSTEM","SYSTEM","1"
"D","S","11017","11017","C","Y","Y","Indennita' ed altri compensi, esclusi i rimborsi spesa documentati per missione, corrisposti al personale a tempo determinato/Fonti interne","N","B","Y","N","NULL","02","N","N","25","N","N","N","N","N","N",0,"N","N","N","N","N","SYSTEM","SYSTEM","1"
"D","S","11018","11018","C","Y","Y","Indennita' ed altri compensi, esclusi i rimborsi spesa documentati per missione, corrisposti al personale a tempo determinato/Fonti esterne","N","B","Y","N","NULL","02","N","N","26","N","N","N","N","N","N",0,"N","N","N","N","N","SYSTEM","SYSTEM","1"
"D","S","11019","11019","C","Y","N","Compensi incentivanti di cui all'art. 28, comma 4, D.P.R. 568/'87 corrisposti al personale a tempo determinato/Fonti esterne","N","B","Y","N","NULL","02","N","N","27","N","N","N","N","N","N",0,"N","N","N","N","N","SYSTEM","SYSTEM","1"
"D","S","11020","11020","C","Y","N","Compensi incentivanti di cui all'art. 28, comma 4, D.P.R. 568/'87 corrisposti al personale a tempo determinato/Fonti interne","N","B","Y","N","NULL","02","N","N","28","N","N","N","N","N","N",0,"N","N","N","N","N","SYSTEM","SYSTEM","1"
"D","S","11021","11021","C","Y","N","Compensi per prestazioni professionali rientranti in specifiche disposizioni di legge corrisposti al personale a tempo determinto/Fonti interne","N","B","N","N","NULL","02","N","N","29","N","N","N","N","N","N",0,"N","N","N","N","N","SYSTEM","SYSTEM","1"
"D","S","11022","11022","C","Y","N","Compensi per prestazioni professionali rientranti in specifiche disposizioni di legge corrisposti al personale a tempo determinto/Fonti esterne","N","B","N","N","NULL","02","N","N","30","N","N","N","N","N","N",0,"N","N","N","N","N","SYSTEM","SYSTEM","1"
"D","S","11023","11023","C","Y","N","Assegni di ricerca","N","C","N","N","NULL","05","Y","N","35","N","N","N","N","N","N",0,"N","N","N","N","N","SYSTEM","SYSTEM","1"
"D","S","11024","11024","C","Y","N","Benefici di natura assistenziale e sociale","N","B","N","N","NULL","02","N","N","38","N","N","N","N","N","N",0,"N","N","N","N","N","SYSTEM","SYSTEM","1"
"D","S","11025","11025","C","Y","N","Buoni pasto","N","B","N","N","NULL","02","Y","N","40","N","N","N","N","N","N",0,"N","N","N","N","N","SYSTEM","SYSTEM","1"
"D","S","11026","11026","C","Y","N","Accantonamento per nuove assunzione di personale a tempo determinato","N","B","N","N","NULL","04","N","N","42","N","N","N","N","N","N",0,"N","N","N","N","N","SYSTEM","SYSTEM","1"
"D","S","11027","11027","C","Y","N","Altre spese per il personale","N","B","N","N","NULL","02","N","N","43","N","N","N","N","N","N",0,"N","N","N","N","N","SYSTEM","SYSTEM","1"
"D","S","11028","11028","C","Y","Y","Contributi obbligatori per il personale a tempo indeterminato","N","B","Y","N","NULL","02","N","N","48","N","N","N","N","N","N",0,"N","N","N","N","N","SYSTEM","SYSTEM","1"
"D","S","11029","11029","C","Y","Y","Contributi obbligatori per il personale a tempo determinato/ Fonti interne","N","B","Y","N","NULL","02","N","N","49","N","N","N","N","N","N",0,"N","N","N","N","N","SYSTEM","SYSTEM","1"
"D","S","11030","11030","C","Y","Y","Contributi obbligatori per il personale a tempo determinato/ Fonti esterne","N","B","Y","N","NULL","02","N","N","50","N","N","N","N","N","N",0,"N","N","N","N","N","SYSTEM","SYSTEM","1"
"D","S","11031","11031","C","Y","Y","Contributi obbligatori per il personale a tempo determinato/ Tipo Privatistico","N","B","Y","N","NULL","02","N","N","51","N","N","N","N","N","N",0,"N","N","N","N","N","SYSTEM","SYSTEM","1"
"D","S","11032","11032","C","Y","N","Imposte, contributi previdenziali a carico ente","N","B","Y","N","NULL","02","N","N","52","N","N","N","N","N","N",0,"N","N","N","N","N","SYSTEM","SYSTEM","1"
"D","S","11033","11033","C","Y","Y","Assegni familiari corrisposti a personale a tempo indeterminato","N","B","Y","N","NULL","02","N","N","57","N","N","N","N","N","N",0,"N","N","N","N","N","SYSTEM","SYSTEM","1"
"D","S","11034","11034","C","Y","Y","Assegni familiari corrisposti a personale a tempo determinato/Fonti interne","N","B","Y","N","NULL","02","N","N","58","N","N","N","N","N","N",0,"N","N","N","N","N","SYSTEM","SYSTEM","1"
"D","S","11035","11035","C","Y","Y","Assegni familiari corrisposti a personale a tempo determinato/Fonti esterne","N","B","Y","N","NULL","02","N","N","59","N","N","N","N","N","N",0,"N","N","N","N","N","SYSTEM","SYSTEM","1"
"D","S","11036","11036","C","Y","Y","Equo indennizzo","N","B","N","N","NULL","02","N","N","61","N","N","N","N","N","N",0,"N","N","N","N","N","SYSTEM","SYSTEM","1"
"D","S","11037","11037","C","Y","N","Trattamento di fine servizio per il personale a tempo indeterminato ","N","O","Y","N","NULL","11","N","N","63","N","N","N","N","N","N",0,"N","N","N","N","N","SYSTEM","SYSTEM","1"
"D","S","11038","11038","C","Y","N","Trattamento di fine rapporto per il personale a tempo indeterminato","N","O","Y","N","NULL","11","N","N","64","N","N","N","N","N","N",0,"N","N","N","N","N","SYSTEM","SYSTEM","1"
"D","S","11039","11039","C","Y","N","Liquidazione buoni fruttiferi postali per il TFR del personale iscritto INPS","N","O","Y","N","NULL","11","N","N","65","N","N","N","N","N","N",0,"N","N","N","N","N","SYSTEM","SYSTEM","1"
"D","S","11040","11040","C","Y","N","Trattamento di fine rapporto per il personale a tempo determinato","N","O","Y","N","NULL","11","N","N","66","N","N","N","N","N","N",0,"N","N","N","N","N","SYSTEM","SYSTEM","1"
"D","S","11041","11041","C","Y","N","Trasferimento TFR del personale comandato a tempo indeterminato","N","O","Y","N","NULL","11","N","N","67","N","N","N","N","N","N",0,"N","N","N","N","N","SYSTEM","SYSTEM","1"
"D","S","11042","11042","C","Y","N","Accantonamento per rinnovo contrattuale del personale a tempo determinato su fonti esterne","N","B","N","N","NULL","02","N","N","44","N","N","N","N","N","N",0,"N","N","N","N","N","SYSTEM","SYSTEM","1"
"D","S","11043","11043","C","Y","Y","Compet. access. altre amministaz. a personale a tempo indeterm. comandato o per attivit? in convenz.","N","B","N","N","NULL","02","N","N","11","N","N","N","N","N","N",0,"N","N","N","N","N","SYSTEM","SYSTEM","1"
"D","S","11044","11044","C","Y","Y","Compet. access. altre amministaz. a personale t. determ./f. interne comandato o attivit? in convenz.","N","B","N","N","NULL","02","N","N","31","N","N","N","N","N","N",0,"N","N","N","N","N","SYSTEM","SYSTEM","1"
"D","S","11045","11045","C","Y","Y","Compet. access. altre amministaz. a personale t. determ./f. esterne comandato o attivit? in convenz.","N","B","N","N","NULL","02","N","N","32","N","N","N","N","N","N",0,"N","N","N","N","N","SYSTEM","SYSTEM","1"
"D","S","11046","11046","C","Y","Y","Ulteriore quota di restribuzione accessoria per il personale a tempo determinato su fonti esterne","N","B","N","N","NULL","02","N","N","33","N","N","N","N","N","N",0,"N","N","N","N","N","SYSTEM","SYSTEM","1"
"D","S","11047","11047","C","Y","Y","Contributi previdenza complementare e di solidariet?","N","B","N","N","NULL","NULL","N","N","54","N","N","N","N","N","N",0,"N","N","N","N","N","SYSTEM","SYSTEM","1"
"D","S","12001","12001","C","Y","N","Imposta regionale sulle attivita' produttive (IRAP)","N","I","N","N","NULL","06","N","N","72","N","N","N","N","N","N",0,"N","N","N","N","N","SYSTEM","SYSTEM","1"
"D","S","12002","12002","C","Y","N","Imposta regionale sulle attivita' produttive a carico dell'ente sugli emolumenti al personale a tempo indeterminato","N","I","Y","N","NULL","07","N","N","73","N","N","N","N","N","N",0,"N","N","N","N","N","SYSTEM","SYSTEM","1"
"D","S","12003","12003","C","Y","Y","Imposta regionale sulle attivita' produttive a carico dell'ente sugli emolumenti al personale a tempo determinato / Fonti interne","N","I","Y","N","NULL","06","N","N","74","N","N","N","N","N","N",0,"N","N","N","N","N","SYSTEM","SYSTEM","1"
"D","S","12004","12004","C","Y","Y","Imposta regionale sulle attivita' produttive a carico dell'ente sugli emolumenti al personale a tempo determinato / Fonti esterne","N","I","Y","N","NULL","06","N","N","75","N","N","N","N","N","N",0,"N","N","N","N","N","SYSTEM","SYSTEM","1"
"D","S","12005","12005","C","Y","Y","Imposta regionale sulle attivita' produttive a carico dell'ente sugli emolumenti al personale a tempo determinato con contratto di tipo privatistico","N","I","Y","N","NULL","06","N","N","76","N","N","N","N","N","N",0,"N","N","N","N","N","SYSTEM","SYSTEM","1"
"D","S","12006","12006","C","Y","N","Imposta di registro e di bollo","N","I","N","N","NULL","06","N","N","79","N","N","N","N","N","N",0,"N","N","N","N","N","SYSTEM","SYSTEM","1"
"D","S","12007","12007","C","Y","N","Imposta comunale sulla pubblicita' e diritto sulle pubbliche affissioni","N","I","N","N","NULL","06","N","N","82","N","N","N","N","N","N",0,"N","N","N","N","N","SYSTEM","SYSTEM","1"
"D","S","12008","12008","C","Y","N","Tributo speciale per il deposito in discarica dei rifiuti solidi","N","I","N","N","NULL","06","N","N","85","N","N","N","N","N","N",0,"N","N","N","N","N","SYSTEM","SYSTEM","1"
"D","S","12009","12009","C","Y","N","Tributo funzione tutela e protezione ambiente","N","I","N","N","NULL","06","N","N","88","N","N","N","N","N","N",0,"N","N","N","N","N","SYSTEM","SYSTEM","1"
"D","S","12010","12010","C","Y","N","Tassa e/o tariffa smaltimento rifiuti solidi urbani","N","I","N","N","NULL","06","N","N","91","N","N","N","N","N","N",0,"N","N","N","N","N","SYSTEM","SYSTEM","1"
"D","S","12011","12011","C","Y","N","Tassa e/o canone occupazione spazi e aree pubbliche","N","I","N","N","NULL","06","N","N","94","N","N","N","N","N","N",0,"N","N","N","N","N","SYSTEM","SYSTEM","1"
"D","S","12012","12012","C","Y","N","Tassa sulle emissioni di anidride solforosa","N","I","N","N","NULL","06","N","N","97","N","N","N","N","N","N",0,"N","N","N","N","N","SYSTEM","SYSTEM","1"
"D","S","12013","12013","C","Y","N","Tassa di proprieta' dei veicoli a motore","N","I","N","N","NULL","06","N","N","100","N","N","N","N","N","N",0,"N","N","N","N","N","SYSTEM","SYSTEM","1"
"D","S","12014","12014","C","Y","N","Imposte sul reddito delle societa' (IRES)","N","I","N","N","NULL","06","N","N","103","N","N","N","N","N","N",0,"N","N","N","N","N","SYSTEM","SYSTEM","1"
"D","S","12015","12015","C","Y","N","Imposta comunale sugli immobili (ICI) ","N","I","N","N","NULL","06","N","N","106","N","N","N","N","N","N",0,"N","N","N","N","N","SYSTEM","SYSTEM","1"
"D","S","12016","12016","C","Y","N","Imposta Municipale Propria (IMU) e Tributo per servizi indivisibili (TASI)","N","I","N","N","NULL","06","N","N","109","N","N","N","N","N","N",0,"N","N","N","N","N","SYSTEM","SYSTEM","1"
"D","S","12017","12017","C","Y","N","Tributi sulle successioni e donazioni ","N","I","N","N","NULL","06","N","N","112","N","N","N","N","N","N",0,"N","N","N","N","N","SYSTEM","SYSTEM","1"
"D","S","12018","12018","C","Y","N","Altre imposte e tasse a carico dell'ente ","N","I","N","N","NULL","06","N","N","115","N","N","N","N","N","N",0,"N","N","N","N","N","SYSTEM","SYSTEM","1"
"D","S","13001","13001","C","Y","N","Giornali e riviste","N","C","N","N","NULL","03","Y","N","120","N","N","N","N","N","N",0,"N","N","N","N","N","SYSTEM","SYSTEM","1"
"D","S","13002","13002","C","Y","N","Pubblicazioni","N","C","N","N","NULL","03","Y","N","122","N","N","N","N","N","N",0,"N","N","N","N","N","SYSTEM","SYSTEM","1"
"D","S","13003","13003","C","Y","N","Carta, cancelleria e stampati","N","C","N","N","NULL","03","Y","N","125","N","N","N","N","N","N",0,"N","N","N","N","N","SYSTEM","SYSTEM","1"
"D","S","13004","13004","C","Y","N","Carburanti, combustibili e lubrificanti per impianti di riscaldamento","N","C","N","N","NULL","03","Y","N","127","N","N","N","N","N","N",0,"N","N","N","N","N","SYSTEM","SYSTEM","1"
"D","S","13005","13005","C","Y","N","Carburanti, combustibili e lubrificanti per autovetture","N","C","N","N","NULL","03","Y","N","128","N","N","N","Y","N","N",0,"N","N","N","N","Y","SYSTEM","SYSTEM","1"
"D","S","13006","13006","C","Y","N","Carburanti, combustibili e lubrificanti per altri mezzi di trasporto stradali","N","C","N","N","NULL","03","Y","N","129","N","N","N","N","N","N",0,"N","N","N","N","Y","SYSTEM","SYSTEM","1"
"D","S","13007","13007","C","Y","N","Carburanti, combustibili e lubrificanti per natanti, imbarcazioni e velivoli","N","C","N","N","NULL","04","Y","N","130","N","N","N","N","N","N",0,"N","N","N","N","Y","SYSTEM","SYSTEM","1"
"D","S","13008","13008","C","Y","N","Equipaggiamento","N","C","N","N","NULL","04","Y","N","132","N","N","N","N","N","N",0,"N","N","N","N","N","SYSTEM","SYSTEM","1"
"D","S","13009","13009","C","Y","N","Vestiario","N","C","N","N","NULL","04","Y","N","134","N","N","N","N","N","N",0,"N","N","N","N","N","SYSTEM","SYSTEM","1"
"D","S","13010","13010","C","Y","N","Accessori per uffici e alloggi","N","C","N","N","NULL","03","Y","N","136","N","N","N","N","N","N",0,"N","N","N","N","N","SYSTEM","SYSTEM","1"
"D","S","13011","13011","C","Y","N","Materiale informatico","N","C","N","N","NULL","03","Y","N","138","N","N","N","N","N","N",0,"N","N","N","N","N","SYSTEM","SYSTEM","1"
"D","S","13050","13050","C","Y","N","Utenze e canoni per altri servizi ","N","C","N","N","NULL","03","Y","N","220","N","N","N","N","N","N",0,"N","N","N","N","N","SYSTEM","SYSTEM","1"
"D","S","13051","13051","C","Y","N","Locazione di beni immobili","N","C","N","N","NULL","03","Y","N","223","N","N","N","N","N","N",0,"N","N","N","N","N","SYSTEM","SYSTEM","1"
"D","S","13052","13052","C","Y","N","Noleggi di autovetture","N","C","N","N","NULL","03","Y","N","225","N","N","N","Y","N","N",0,"N","N","N","N","N","SYSTEM","SYSTEM","1"
