"pg_esecuzione","pg_riga","ti_messaggio","messaggio","trace","note","dacr","duva","utcr","utuv","pg_ver_rec"
"101582","127","W","CONFIGURAZIONE_CNR con PK(2018, *, ELEMENTO_VOCE_SPECIALE, CD_TITOLO_CAPITOLO_BIL_CNR_NO_SAC) già esistente","NULL","NULL","2018-01-08T14:09:04.000","2018-01-08T14:09:04.000","$$$$RIBALTAMENTO$$$$","$$$$RIBALTAMENTO$$$$","1"
"101582","128","W","CONFIGURAZIONE_CNR con PK(2018, *, PIANO_RIPARTO, IM_CF_AMM_ALTRO) già esistente","NULL","NULL","2018-01-08T14:09:04.000","2018-01-08T14:09:04.000","$$$$RIBALTAMENTO$$$$","$$$$RIBALTAMENTO$$$$","1"
"101582","129","W","CONFIGURAZIONE_CNR con PK(2018, DATA, RIACCERTAMENTO_RESIDUI, STATO) già esistente","NULL","NULL","2018-01-08T14:09:04.000","2018-01-08T14:09:04.000","$$$$RIBALTAMENTO$$$$","$$$$RIBALTAMENTO$$$$","1"
"101582","130","I","Creazione dell'esercizio contabile 2018 per i CDS e impostazione delle percentuali di copertura impegni. Lock tabelle ESERCIZIO, PRC_COPERTURA_OBBLIG, NUMERAZIONE_DOC_CONT.","NULL","NULL","2018-01-08T14:09:04.000","2018-01-08T14:09:04.000","$$$$RIBALTAMENTO$$$$","$$$$RIBALTAMENTO$$$$","1"
"101582","131","I","Inserimento esercizio contabile per CdS: 001","NULL","NULL","2018-01-08T14:09:04.000","2018-01-08T14:09:04.000","$$$$RIBALTAMENTO$$$$","$$$$RIBALTAMENTO$$$$","1"
"101582","132","I","Inserimento esercizio contabile per CdS: 000","NULL","NULL","2018-01-08T14:09:04.000","2018-01-08T14:09:04.000","$$$$RIBALTAMENTO$$$$","$$$$RIBALTAMENTO$$$$","1"
"101582","133","I","Creazione dei parametri CDS per l'esercizio contabile 2018 per i CDS validi. Lock tabella PARAMETRI_CDS.","NULL","NULL","2018-01-08T14:09:04.000","2018-01-08T14:09:04.000","$$$$RIBALTAMENTO$$$$","$$$$RIBALTAMENTO$$$$","1"
"101582","134","I","Creazione della tabella CHIUSURA_COEP per l'esercizio contabile 2018 per i CDS validi. Lock tabella CHIUSURA_COEP.","NULL","NULL","2018-01-08T14:09:04.000","2018-01-08T14:09:04.000","$$$$RIBALTAMENTO$$$$","$$$$RIBALTAMENTO$$$$","1"
"101582","135","I","Ribaltamento tabella di identificazione dei collegamenti tra conti di partita di giro su 2018. Lock tabella ASS_PARTITA_GIRO.","NULL","NULL","2018-01-08T14:09:04.000","2018-01-08T14:09:04.000","$$$$RIBALTAMENTO$$$$","$$$$RIBALTAMENTO$$$$","1"
"101582","136","I","Ribaltamento elenco dei CDS che sono gestiti in versamento via interfaccia sull'esercizio 2018. Lock tabella LIQUID_CORI_INTERF_CDS","NULL","NULL","2018-01-08T14:09:04.000","2018-01-08T14:09:04.000","$$$$RIBALTAMENTO$$$$","$$$$RIBALTAMENTO$$$$","1"
"101582","137","I","Ribaltamento elenco dei CDS che sono gestiti in versamento via interfaccia sull'esercizio 2018. Lock tabella LIQUID_IVA_INTERF_CDS","NULL","NULL","2018-01-08T14:09:04.000","2018-01-08T14:09:04.000","$$$$RIBALTAMENTO$$$$","$$$$RIBALTAMENTO$$$$","1"
"101582","138","I","Ribaltamento UO che hanno una gestione dell'IVA esterna sull'esercizio 2018. Lock tabella LIQUID_IVA_ESTERNA","NULL","NULL","2018-01-08T14:09:04.000","2018-01-08T14:09:04.000","$$$$RIBALTAMENTO$$$$","$$$$RIBALTAMENTO$$$$","1"
"101575","1","E","Lo script di ribaltamento per il PDGP ט giא stato eseguito con successo per l'esercizio 2018: non ט possibile eseguirlo nuovamente.","NULL","NULL","2018-01-08T12:46:22.000","2018-01-08T12:46:22.000","$$$$RIBALTAMENTO$$$$","$$$$RIBALTAMENTO$$$$","1"
"101575","2","E","Errore non gestito: ORA-20020: Lo script di ribaltamento per il PDGP ט giא stato eseguito con successo per l'esercizio 2018: non ט possibile eseguirlo nuovamente.
","NULL","NULL","2018-01-08T12:46:22.000","2018-01-08T12:46:22.000","$$$$RIBALTAMENTO$$$$","$$$$RIBALTAMENTO$$$$","1"
"101576","1","E","Lo script di ribaltamento per il PDGP ט giא stato eseguito con successo per l'esercizio 2018: non ט possibile eseguirlo nuovamente.","NULL","NULL","2018-01-08T12:47:23.000","2018-01-08T12:47:23.000","$$$$RIBALTAMENTO$$$$","$$$$RIBALTAMENTO$$$$","1"
"101576","2","E","Errore non gestito: ORA-20020: Lo script di ribaltamento per il PDGP ט giא stato eseguito con successo per l'esercizio 2018: non ט possibile eseguirlo nuovamente.
","NULL","NULL","2018-01-08T12:47:23.000","2018-01-08T12:47:23.000","$$$$RIBALTAMENTO$$$$","$$$$RIBALTAMENTO$$$$","1"
"101577","1","I","Inserimento dell'esercizio base 2018. Lock tabella ESERCIZIO_BASE","NULL","NULL","2018-01-08T12:49:44.000","2018-01-08T12:49:44.000","$$$$RIBALTAMENTO$$$$","$$$$RIBALTAMENTO$$$$","1"
"101577","2","I","Inserimento dei Parametri CNR per l'esercizio base 2018. Lock tabella PARAMETRI_CNR","NULL","NULL","2018-01-08T12:49:44.000","2018-01-08T12:49:44.000","$$$$RIBALTAMENTO$$$$","$$$$RIBALTAMENTO$$$$","1"
"101577","3","W","Parametri CNR per l'esercizio base 2018 giא esistenti","NULL","NULL","2018-01-08T12:49:44.000","2018-01-08T12:49:44.000","$$$$RIBALTAMENTO$$$$","$$$$RIBALTAMENTO$$$$","1"
"101577","4","I","Inserimento dell'esercizio contabile 2018 per l'ente. Lock tabelle ESERCIZIO, NUMERAZIONE_DOC_CONT","NULL","NULL","2018-01-08T12:49:44.000","2018-01-08T12:49:44.000","$$$$RIBALTAMENTO$$$$","$$$$RIBALTAMENTO$$$$","1"
"101577","5","W","Esercizio contabile 2018 per l'ente giא esistente","NULL","NULL","2018-01-08T12:49:45.000","2018-01-08T12:49:45.000","$$$$RIBALTAMENTO$$$$","$$$$RIBALTAMENTO$$$$","1"
"101577","6","E","Errore non gestito: ORA-02291: restrizione di integrità violata (PCIR009.FK_NUMERAZIONE_DOC_CONT00) - chiave madre non trovata
","NULL","NULL","2018-01-08T12:49:45.000","2018-01-08T12:49:45.000","$$$$RIBALTAMENTO$$$$","$$$$RIBALTAMENTO$$$$","1"
"101579","1","I","Inserimento dell'esercizio base 2018. Lock tabella ESERCIZIO_BASE","NULL","NULL","2018-01-08T13:26:22.000","2018-01-08T13:26:22.000","$$$$RIBALTAMENTO$$$$","$$$$RIBALTAMENTO$$$$","1"
"101579","2","I","Inserimento dei Parametri CNR per l'esercizio base 2018. Lock tabella PARAMETRI_CNR","NULL","NULL","2018-01-08T13:26:22.000","2018-01-08T13:26:22.000","$$$$RIBALTAMENTO$$$$","$$$$RIBALTAMENTO$$$$","1"
"101579","3","I","Inserimento dell'esercizio contabile 2018 per l'ente. Lock tabelle ESERCIZIO, NUMERAZIONE_DOC_CONT","NULL","NULL","2018-01-08T13:26:22.000","2018-01-08T13:26:22.000","$$$$RIBALTAMENTO$$$$","$$$$RIBALTAMENTO$$$$","1"
"101579","4","W","Esercizio contabile 2018 per l'ente giא esistente","NULL","NULL","2018-01-08T13:26:22.000","2018-01-08T13:26:22.000","$$$$RIBALTAMENTO$$$$","$$$$RIBALTAMENTO$$$$","1"
"101579","5","E","Errore non gestito: ORA-02291: restrizione di integrità violata (PCIR009.FK_NUMERAZIONE_DOC_CONT00) - chiave madre non trovata
","NULL","NULL","2018-01-08T13:26:22.000","2018-01-08T13:26:22.000","$$$$RIBALTAMENTO$$$$","$$$$RIBALTAMENTO$$$$","1"
"101581","1","I","Inserimento dell'esercizio base 2018. Lock tabella ESERCIZIO_BASE","NULL","NULL","2018-01-08T14:07:17.000","2018-01-08T14:07:17.000","$$$$RIBALTAMENTO$$$$","$$$$RIBALTAMENTO$$$$","1"
"101581","2","I","Inserimento dei Parametri CNR per l'esercizio base 2018. Lock tabella PARAMETRI_CNR","NULL","NULL","2018-01-08T14:07:17.000","2018-01-08T14:07:17.000","$$$$RIBALTAMENTO$$$$","$$$$RIBALTAMENTO$$$$","1"
"101581","3","I","Inserimento dell'esercizio contabile 2018 per l'ente 999. Lock tabelle ESERCIZIO, NUMERAZIONE_DOC_CONT","NULL","NULL","2018-01-08T14:07:17.000","2018-01-08T14:07:17.000","$$$$RIBALTAMENTO$$$$","$$$$RIBALTAMENTO$$$$","1"
"101581","4","E","Errore non gestito: ORA-00001: violata restrizione di unicità (PCIR009.PX_BILANCIO_PREVENTIVO)
ORA-06512: a \"PCIR009.CNRCTB054\", line 992
ORA-06512: a \"PCIR009.CNRCTB055\", line 1873
ORA-06512: a \"PCIR009.CNRCTB005\", line 33
ORA-06512: a \"PCIR009.AI_ESERCIZIO\", line 42
ORA-04088: errore durante esecuzione del trigger 'PCIR009.AI_ESERCIZIO'
","NULL","NULL","2018-01-08T14:07:17.000","2018-01-08T14:07:17.000","$$$$RIBALTAMENTO$$$$","$$$$RIBALTAMENTO$$$$","1"
"101582","1","I","Inserimento dell'esercizio base 2018. Lock tabella ESERCIZIO_BASE","NULL","NULL","2018-01-08T14:09:03.000","2018-01-08T14:09:03.000","$$$$RIBALTAMENTO$$$$","$$$$RIBALTAMENTO$$$$","1"
"101582","2","I","Inserimento dei Parametri CNR per l'esercizio base 2018. Lock tabella PARAMETRI_CNR","NULL","NULL","2018-01-08T14:09:03.000","2018-01-08T14:09:03.000","$$$$RIBALTAMENTO$$$$","$$$$RIBALTAMENTO$$$$","1"
"101582","3","I","Inserimento dell'esercizio contabile 2018 per l'ente 999. Lock tabelle ESERCIZIO, NUMERAZIONE_DOC_CONT","NULL","NULL","2018-01-08T14:09:03.000","2018-01-08T14:09:03.000","$$$$RIBALTAMENTO$$$$","$$$$RIBALTAMENTO$$$$","1"
"101582","4","I","Inserimento di TIPO_VARIAZIONE per l'esercizio base 2018. Lock tabella TIPO_VARIAZIONE","NULL","NULL","2018-01-08T14:09:03.000","2018-01-08T14:09:03.000","$$$$RIBALTAMENTO$$$$","$$$$RIBALTAMENTO$$$$","1"
"101582","5","I","Ribaltamento Classificazioni Entrate sull'esercizio 2018. Lock tabella CLASSIFICAZIONE_ENTRATE","NULL","NULL","2018-01-08T14:09:03.000","2018-01-08T14:09:03.000","$$$$RIBALTAMENTO$$$$","$$$$RIBALTAMENTO$$$$","1"
"101582","6","I","Ribaltamento Classificazioni Spese sull'esercizio 2018. Lock tabella CLASSIFICAZIONE_SPESE","NULL","NULL","2018-01-08T14:09:03.000","2018-01-08T14:09:03.000","$$$$RIBALTAMENTO$$$$","$$$$RIBALTAMENTO$$$$","1"
"101582","7","I","Ribaltamento Parametri Livelli sull'esercizio 2018. Lock tabella PARAMETRI_LIVELLI","NULL","NULL","2018-01-08T14:09:03.000","2018-01-08T14:09:03.000","$$$$RIBALTAMENTO$$$$","$$$$RIBALTAMENTO$$$$","1"
"101582","8","I","Ribaltamento dell'anagrafica dei capitoli sull'esercizio 2018. Lock tabelle ELEMENTO_VOCE, VOCE_F, VOCE_F_SALDI_CMP","NULL","NULL","2018-01-08T14:09:03.000","2018-01-08T14:09:03.000","$$$$RIBALTAMENTO$$$$","$$$$RIBALTAMENTO$$$$","1"
"101582","9","I","Ribaltamento delle associazioni elementi voce, funzioni e tipologia di cds sull'esercizio 2018. Lock tabella ASS_EV_FUNZ_TIPOCDS","NULL","NULL","2018-01-08T14:09:03.000","2018-01-08T14:09:03.000","$$$$RIBALTAMENTO$$$$","$$$$RIBALTAMENTO$$$$","1"
"101582","10","I","Ribaltamento delle associazioni fra elementi voce sull'esercizio 2018. Lock tabella ASS_EV_EV","NULL","NULL","2018-01-08T14:09:03.000","2018-01-08T14:09:03.000","$$$$RIBALTAMENTO$$$$","$$$$RIBALTAMENTO$$$$","1"
"101582","11","I","Ribaltamento Classificazione Voci sull'esercizio 2018. Lock tabella CLASSIFICAZIONE_VOCI","NULL","NULL","2018-01-08T14:09:03.000","2018-01-08T14:09:03.000","$$$$RIBALTAMENTO$$$$","$$$$RIBALTAMENTO$$$$","1"
"101582","12","I","Ribaltamento configurazione CNR sull'esercizio 2018. Lock tabella CONFIGURAZIONE_CNR","NULL","NULL","2018-01-08T14:09:04.000","2018-01-08T14:09:04.000","$$$$RIBALTAMENTO$$$$","$$$$RIBALTAMENTO$$$$","1"
"101582","13","W","CONFIGURAZIONE_CNR con PK(2018, *, OBBLIGATORIETA_ORDINI, PROGETTO_RICHIESTA) già esistente","NULL","NULL","2018-01-08T14:09:04.000","2018-01-08T14:09:04.000","$$$$RIBALTAMENTO$$$$","$$$$RIBALTAMENTO$$$$","1"
"101582","14","W","CONFIGURAZIONE_CNR con PK(2018, *, OBBLIGATORIETA_ORDINI, GAE_RICHIESTA) già esistente","NULL","NULL","2018-01-08T14:09:04.000","2018-01-08T14:09:04.000","$$$$RIBALTAMENTO$$$$","$$$$RIBALTAMENTO$$$$","1"
"101582","15","W","CONFIGURAZIONE_CNR con PK(2018, *, OBBLIGATORIETA_ORDINI, VOCE_RICHIESTA) già esistente","NULL","NULL","2018-01-08T14:09:04.000","2018-01-08T14:09:04.000","$$$$RIBALTAMENTO$$$$","$$$$RIBALTAMENTO$$$$","1"
"101582","16","W","CONFIGURAZIONE_CNR con PK(2018, *, VOCEEP_SPECIALE, DEBITI_CREDITI_DIVERSI_PGIRO) già esistente","NULL","NULL","2018-01-08T14:09:04.000","2018-01-08T14:09:04.000","$$$$RIBALTAMENTO$$$$","$$$$RIBALTAMENTO$$$$","1"
"101582","17","W","CONFIGURAZIONE_CNR con PK(2018, *, ELEMENTO_VOCE_SPECIALE, ONERI_CNR_TEMPO_DET) già esistente","NULL","NULL","2018-01-08T14:09:04.000","2018-01-08T14:09:04.000","$$$$RIBALTAMENTO$$$$","$$$$RIBALTAMENTO$$$$","1"
"101582","18","W","CONFIGURAZIONE_CNR con PK(2018, *, COSTANTI, TOTALE_GIORNI_LAVORATIVI_COSTI_PERSONALE) già esistente","NULL","NULL","2018-01-08T14:09:04.000","2018-01-08T14:09:04.000","$$$$RIBALTAMENTO$$$$","$$$$RIBALTAMENTO$$$$","1"
"101582","19","W","CONFIGURAZIONE_CNR con PK(2018, *, ELEMENTO_VOCE_SPECIALE, RICAVO_FIGURATIVO_ALTRO_CDR) già esistente","NULL","NULL","2018-01-08T14:09:04.000","2018-01-08T14:09:04.000","$$$$RIBALTAMENTO$$$$","$$$$RIBALTAMENTO$$$$","1"
"101582","20","W","CONFIGURAZIONE_CNR con PK(2018, *, ELEMENTO_VOCE_SPECIALE, PRESTAZIONI_DA_STRUTTURE_DELL_ENTE) già esistente","NULL","NULL","2018-01-08T14:09:04.000","2018-01-08T14:09:04.000","$$$$RIBALTAMENTO$$$$","$$$$RIBALTAMENTO$$$$","1"
"101582","21","W","CONFIGURAZIONE_CNR con PK(2018, *, ELEMENTO_VOCE_SPECIALE, ONERI_CNR) già esistente","NULL","NULL","2018-01-08T14:09:04.000","2018-01-08T14:09:04.000","$$$$RIBALTAMENTO$$$$","$$$$RIBALTAMENTO$$$$","1"
"101582","22","W","CONFIGURAZIONE_CNR con PK(2018, *, ELEMENTO_VOCE_SPECIALE, TFR) già esistente","NULL","NULL","2018-01-08T14:09:04.000","2018-01-08T14:09:04.000","$$$$RIBALTAMENTO$$$$","$$$$RIBALTAMENTO$$$$","1"
"101582","23","W","CONFIGURAZIONE_CNR con PK(2018, *, VOCEEP_SPECIALE, BANCA) già esistente","NULL","NULL","2018-01-08T14:09:04.000","2018-01-08T14:09:04.000","$$$$RIBALTAMENTO$$$$","$$$$RIBALTAMENTO$$$$","1"
"101582","24","W","CONFIGURAZIONE_CNR con PK(2018, *, VOCEEP_SPECIALE, CASSA) già esistente","NULL","NULL","2018-01-08T14:09:04.000","2018-01-08T14:09:04.000","$$$$RIBALTAMENTO$$$$","$$$$RIBALTAMENTO$$$$","1"
"101582","25","W","CONFIGURAZIONE_CNR con PK(2018, *, VOCEEP_SPECIALE, SCONTO_ABBUONO_COSTO) già esistente","NULL","NULL","2018-01-08T14:09:04.000","2018-01-08T14:09:04.000","$$$$RIBALTAMENTO$$$$","$$$$RIBALTAMENTO$$$$","1"
"101582","26","W","CONFIGURAZIONE_CNR con PK(2018, *, VOCEEP_SPECIALE, SCONTO_ABBUONO_RICAVO) già esistente","NULL","NULL","2018-01-08T14:09:04.000","2018-01-08T14:09:04.000","$$$$RIBALTAMENTO$$$$","$$$$RIBALTAMENTO$$$$","1"
"101582","27","W","CONFIGURAZIONE_CNR con PK(2018, *, VOCEEP_SPECIALE, ONERI_ACCESSORI) già esistente","NULL","NULL","2018-01-08T14:09:04.000","2018-01-08T14:09:04.000","$$$$RIBALTAMENTO$$$$","$$$$RIBALTAMENTO$$$$","1"
"101582","28","W","CONFIGURAZIONE_CNR con PK(2018, *, VOCEEP_SPECIALE, UTILE_SU_CAMBIO) già esistente","NULL","NULL","2018-01-08T14:09:04.000","2018-01-08T14:09:04.000","$$$$RIBALTAMENTO$$$$","$$$$RIBALTAMENTO$$$$","1"
"101582","29","W","CONFIGURAZIONE_CNR con PK(2018, *, VOCEEP_SPECIALE, BANCA_CDS) già esistente","NULL","NULL","2018-01-08T14:09:04.000","2018-01-08T14:09:04.000","$$$$RIBALTAMENTO$$$$","$$$$RIBALTAMENTO$$$$","1"
"101582","30","W","CONFIGURAZIONE_CNR con PK(2018, *, VOCEEP_SPECIALE, ANTICIPO_MISSIONE) già esistente","NULL","NULL","2018-01-08T14:09:04.000","2018-01-08T14:09:04.000","$$$$RIBALTAMENTO$$$$","$$$$RIBALTAMENTO$$$$","1"
"101582","31","W","CONFIGURAZIONE_CNR con PK(2018, *, GESTIONE_CORI_SPECIALE, STATO_LIQUIDA_CORI) già esistente","NULL","NULL","2018-01-08T14:09:04.000","2018-01-08T14:09:04.000","$$$$RIBALTAMENTO$$$$","$$$$RIBALTAMENTO$$$$","1"
"101582","32","W","CONFIGURAZIONE_CNR con PK(2018, *, FATTURAZIONE_ELETTRONICA, ATTIVA) già esistente","NULL","NULL","2018-01-08T14:09:04.000","2018-01-08T14:09:04.000","$$$$RIBALTAMENTO$$$$","$$$$RIBALTAMENTO$$$$","1"
"101582","33","W","CONFIGURAZIONE_CNR con PK(2018, *, FATTURAZIONE_ELETTRONICA, PASSIVA) già esistente","NULL","NULL","2018-01-08T14:09:04.000","2018-01-08T14:09:04.000","$$$$RIBALTAMENTO$$$$","$$$$RIBALTAMENTO$$$$","1"
"101582","34","W","CONFIGURAZIONE_CNR con PK(2018, *, FATTURAZIONE_ELETTRONICA, MAIL_REFERENTE_TECNICO) già esistente","NULL","NULL","2018-01-08T14:09:04.000","2018-01-08T14:09:04.000","$$$$RIBALTAMENTO$$$$","$$$$RIBALTAMENTO$$$$","1"
"101582","35","W","CONFIGURAZIONE_CNR con PK(2018, *, FATTURAZIONE_ELETTRONICA, TELEFONO_REFERENTE_TECNICO) già esistente","NULL","NULL","2018-01-08T14:09:04.000","2018-01-08T14:09:04.000","$$$$RIBALTAMENTO$$$$","$$$$RIBALTAMENTO$$$$","1"
"101582","36","W","CONFIGURAZIONE_CNR con PK(2018, *, FLUSSO_ORDINATIVI, CODICE_ABI_BT) già esistente","NULL","NULL","2018-01-08T14:09:04.000","2018-01-08T14:09:04.000","$$$$RIBALTAMENTO$$$$","$$$$RIBALTAMENTO$$$$","1"
"101582","37","W","CONFIGURAZIONE_CNR con PK(2018, *, ELEMENTO_VOCE_SPECIALE, RIMBORSO_ANTICIPO) già esistente","NULL","NULL","2018-01-08T14:09:04.000","2018-01-08T14:09:04.000","$$$$RIBALTAMENTO$$$$","$$$$RIBALTAMENTO$$$$","1"
"101582","38","W","CONFIGURAZIONE_CNR con PK(2018, *, ELEMENTO_VOCE_SPECIALE, RECUPERO_CREDITI_DA_TERZI) già esistente","NULL","NULL","2018-01-08T14:09:04.000","2018-01-08T14:09:04.000","$$$$RIBALTAMENTO$$$$","$$$$RIBALTAMENTO$$$$","1"
"101582","39","W","CONFIGURAZIONE_CNR con PK(2018, *, VOCEEP_SPECIALE, MINUSVALENZA) già esistente","NULL","NULL","2018-01-08T14:09:04.000","2018-01-08T14:09:04.000","$$$$RIBALTAMENTO$$$$","$$$$RIBALTAMENTO$$$$","1"
"101582","40","W","CONFIGURAZIONE_CNR con PK(2018, *, VOCEEP_SPECIALE, PLUSVALENZA) già esistente","NULL","NULL","2018-01-08T14:09:04.000","2018-01-08T14:09:04.000","$$$$RIBALTAMENTO$$$$","$$$$RIBALTAMENTO$$$$","1"
"101582","41","W","CONFIGURAZIONE_CNR con PK(2018, *, VOCEEP_SPECIALE, IVA_CREDITO) già esistente","NULL","NULL","2018-01-08T14:09:04.000","2018-01-08T14:09:04.000","$$$$RIBALTAMENTO$$$$","$$$$RIBALTAMENTO$$$$","1"
"101582","42","W","CONFIGURAZIONE_CNR con PK(2018, *, VOCEEP_SPECIALE, IVA_DEBITO) già esistente","NULL","NULL","2018-01-08T14:09:04.000","2018-01-08T14:09:04.000","$$$$RIBALTAMENTO$$$$","$$$$RIBALTAMENTO$$$$","1"
"101582","43","W","CONFIGURAZIONE_CNR con PK(2018, *, VOCEEP_SPECIALE, ERARIO_C_IVA) già esistente","NULL","NULL","2018-01-08T14:09:04.000","2018-01-08T14:09:04.000","$$$$RIBALTAMENTO$$$$","$$$$RIBALTAMENTO$$$$","1"
"101582","44","W","CONFIGURAZIONE_CNR con PK(2018, *, ACCONTO_ADD_COM, PERIODO_VALIDITA) già esistente","NULL","NULL","2018-01-08T14:09:04.000","2018-01-08T14:09:04.000","$$$$RIBALTAMENTO$$$$","$$$$RIBALTAMENTO$$$$","1"
"101582","45","W","CONFIGURAZIONE_CNR con PK(2018, *, CODICE_SIOPE_DEFAULT, MANDATI_ISTITUTI_IVA_COMMERCIALE) già esistente","NULL","NULL","2018-01-08T14:09:04.000","2018-01-08T14:09:04.000","$$$$RIBALTAMENTO$$$$","$$$$RIBALTAMENTO$$$$","1"
"101582","46","W","CONFIGURAZIONE_CNR con PK(2018, *, CODICE_SIOPE_DEFAULT, MANDATI_ISTITUTI_IVA_ISTITUZIONALE) già esistente","NULL","NULL","2018-01-08T14:09:04.000","2018-01-08T14:09:04.000","$$$$RIBALTAMENTO$$$$","$$$$RIBALTAMENTO$$$$","1"
"101582","47","W","CONFIGURAZIONE_CNR con PK(2018, *, CODICE_SIOPE_DEFAULT, REVERSALI_SAC_IVA_COMMERCIALE) già esistente","NULL","NULL","2018-01-08T14:09:04.000","2018-01-08T14:09:04.000","$$$$RIBALTAMENTO$$$$","$$$$RIBALTAMENTO$$$$","1"
"101582","48","W","CONFIGURAZIONE_CNR con PK(2018, *, CODICE_SIOPE_DEFAULT, REVERSALI_SAC_IVA_ISTITUZIONALE) già esistente","NULL","NULL","2018-01-08T14:09:04.000","2018-01-08T14:09:04.000","$$$$RIBALTAMENTO$$$$","$$$$RIBALTAMENTO$$$$","1"
"101582","49","W","CONFIGURAZIONE_CNR con PK(2018, *, CODICE_SIOPE_DEFAULT, MANDATI_SAC_IVA_ISTITUZIONALE) già esistente","NULL","NULL","2018-01-08T14:09:04.000","2018-01-08T14:09:04.000","$$$$RIBALTAMENTO$$$$","$$$$RIBALTAMENTO$$$$","1"
"101582","50","W","CONFIGURAZIONE_CNR con PK(2018, *, CODICE_SIOPE_DEFAULT, MANDATI_SAC_IVA_COMMERCIALE) già esistente","NULL","NULL","2018-01-08T14:09:04.000","2018-01-08T14:09:04.000","$$$$RIBALTAMENTO$$$$","$$$$RIBALTAMENTO$$$$","1"
"101582","51","W","CONFIGURAZIONE_CNR con PK(2018, *, CODICE_SIOPE_DEFAULT, REVERSALE_TRASFERIMENTO) già esistente","NULL","NULL","2018-01-08T14:09:04.000","2018-01-08T14:09:04.000","$$$$RIBALTAMENTO$$$$","$$$$RIBALTAMENTO$$$$","1"
"101582","52","W","CONFIGURAZIONE_CNR con PK(2018, *, DIFFERENZA_ADD_COM_STIPENDI, CONTRIBUTO_RITENUTA) già esistente","NULL","NULL","2018-01-08T14:09:04.000","2018-01-08T14:09:04.000","$$$$RIBALTAMENTO$$$$","$$$$RIBALTAMENTO$$$$","1"
"101582","53","W","CONFIGURAZIONE_CNR con PK(2018, *, PDG_VARIAZIONE, RESPINTA1) già esistente","NULL","NULL","2018-01-08T14:09:04.000","2018-01-08T14:09:04.000","$$$$RIBALTAMENTO$$$$","$$$$RIBALTAMENTO$$$$","1"
"101582","54","W","CONFIGURAZIONE_CNR con PK(2018, *, PDG_VARIAZIONE, RESPINTA2) già esistente","NULL","NULL","2018-01-08T14:09:04.000","2018-01-08T14:09:04.000","$$$$RIBALTAMENTO$$$$","$$$$RIBALTAMENTO$$$$","1"
"101582","55","W","CONFIGURAZIONE_CNR con PK(2018, *, PDG_VARIAZIONE, RESPINTA3) già esistente","NULL","NULL","2018-01-08T14:09:04.000","2018-01-08T14:09:04.000","$$$$RIBALTAMENTO$$$$","$$$$RIBALTAMENTO$$$$","1"
"101582","56","W","CONFIGURAZIONE_CNR con PK(2018, *, PDG_VARIAZIONE, RESPINTA4) già esistente","NULL","NULL","2018-01-08T14:09:04.000","2018-01-08T14:09:04.000","$$$$RIBALTAMENTO$$$$","$$$$RIBALTAMENTO$$$$","1"
"101582","57","W","CONFIGURAZIONE_CNR con PK(2018, *, ELEMENTO_VOCE_SPECIALE, ONERI_CNR_TEMPO_DET_RAP13) già esistente","NULL","NULL","2018-01-08T14:09:04.000","2018-01-08T14:09:04.000","$$$$RIBALTAMENTO$$$$","$$$$RIBALTAMENTO$$$$","1"
"101582","58","W","CONFIGURAZIONE_CNR con PK(2018, *, ELEMENTO_VOCE_SPECIALE, ONERI_CNR_TEMPO_DET_FIN) già esistente","NULL","NULL","2018-01-08T14:09:04.000","2018-01-08T14:09:04.000","$$$$RIBALTAMENTO$$$$","$$$$RIBALTAMENTO$$$$","1"
"101582","59","W","CONFIGURAZIONE_CNR con PK(2018, *, PIANO_RIPARTO, IM_CF_TFR_DET) già esistente","NULL","NULL","2018-01-08T14:09:04.000","2018-01-08T14:09:04.000","$$$$RIBALTAMENTO$$$$","$$$$RIBALTAMENTO$$$$","1"
"101582","60","W","CONFIGURAZIONE_CNR con PK(2018, *, PIANO_RIPARTO, IM_CF_TFR) già esistente","NULL","NULL","2018-01-08T14:09:04.000","2018-01-08T14:09:04.000","$$$$RIBALTAMENTO$$$$","$$$$RIBALTAMENTO$$$$","1"
"101582","61","W","CONFIGURAZIONE_CNR con PK(2018, *, MODULO_SPECIALE, MODULO_SAC) già esistente","NULL","NULL","2018-01-08T14:09:04.000","2018-01-08T14:09:04.000","$$$$RIBALTAMENTO$$$$","$$$$RIBALTAMENTO$$$$","1"
"101582","62","W","CONFIGURAZIONE_CNR con PK(2018, *, VOCEEP_SPECIALE, CONTR_REV_REGOLARIZZ_PGIRO) già esistente","NULL","NULL","2018-01-08T14:09:04.000","2018-01-08T14:09:04.000","$$$$RIBALTAMENTO$$$$","$$$$RIBALTAMENTO$$$$","1"
"101582","63","W","CONFIGURAZIONE_CNR con PK(2018, *, ELEMENTO_VOCE_SPECIALE, TFR_TEMPO_DET) già esistente","NULL","NULL","2018-01-08T14:09:04.000","2018-01-08T14:09:04.000","$$$$RIBALTAMENTO$$$$","$$$$RIBALTAMENTO$$$$","1"
"101582","64","W","CONFIGURAZIONE_CNR con PK(2018, *, CONTO_CORRENTE_BANCA_ITALIA, CODICE) già esistente","NULL","NULL","2018-01-08T14:09:04.000","2018-01-08T14:09:04.000","$$$$RIBALTAMENTO$$$$","$$$$RIBALTAMENTO$$$$","1"
"101585","3","I","Ribaltamento associazioni tra categorie e voci del piano dei conti sull'esercizio 2018. Lock tabella CATEGORIA_GRUPPO_VOCE","NULL","NULL","2018-01-08T14:48:49.000","2018-01-08T14:48:49.000","$$$$RIBALTAMENTO$$$$","$$$$RIBALTAMENTO$$$$","1"
"101585","4","I","Ribaltamento Classificazione Voci in aggiunta sull'esercizio 2018. Lock tabella CLASSIFICAZIONE_VOCI","NULL","NULL","2018-01-08T14:48:49.000","2018-01-08T14:48:49.000","$$$$RIBALTAMENTO$$$$","$$$$RIBALTAMENTO$$$$","1"
"101585","5","I","Ribaltamento Codici SIOPE sull'esercizio 2018. Lock tabella CODICI_SIOPE","NULL","NULL","2018-01-08T14:48:49.000","2018-01-08T14:48:49.000","$$$$RIBALTAMENTO$$$$","$$$$RIBALTAMENTO$$$$","1"
"101585","6","I","Ribaltamento Associazione Tipologia ISTAT - Codici SIOPE sull'esercizio 2018. Lock tabella ASS_TIPOLOGIA_ISTAT_SIOPE","NULL","NULL","2018-01-08T14:48:49.000","2018-01-08T14:48:49.000","$$$$RIBALTAMENTO$$$$","$$$$RIBALTAMENTO$$$$","1"
"101585","7","I","Ribaltamento delle associazioni fra elementi voce e codici siope sull'esercizio 2018. Lock tabella ASS_EV_SIOPE","NULL","NULL","2018-01-08T14:48:49.000","2018-01-08T14:48:49.000","$$$$RIBALTAMENTO$$$$","$$$$RIBALTAMENTO$$$$","1"
"101585","8","I","Ribaltamento Associazione Contributi/ritenute - Codici SIOPE sull'esercizio 2018. Lock tabella ASS_TIPO_CONTR_RITENUTA_SIOPE","NULL","NULL","2018-01-08T14:48:49.000","2018-01-08T14:48:49.000","$$$$RIBALTAMENTO$$$$","$$$$RIBALTAMENTO$$$$","1"
"101585","9","I","Ribaltamento del piano dei conti E/P sull'esercizio 2018. Lock tabella VOCE_EP","NULL","NULL","2018-01-08T14:48:49.000","2018-01-08T14:48:49.000","$$$$RIBALTAMENTO$$$$","$$$$RIBALTAMENTO$$$$","1"
"101585","10","I","Ribaltamento  delle associazioni entrate-ricavi spese-costi sull'esercizio 2018. Lock tabella ASS_EV_VOCEEP","NULL","NULL","2018-01-08T14:48:49.000","2018-01-08T14:48:49.000","$$$$RIBALTAMENTO$$$$","$$$$RIBALTAMENTO$$$$","1"
"101585","11","I","Ribaltamento Parametri Livelli EP sull'esercizio 2018. Lock tabella PARAMETRI_LIVELLI_EP","NULL","NULL","2018-01-08T14:48:49.000","2018-01-08T14:48:49.000","$$$$RIBALTAMENTO$$$$","$$$$RIBALTAMENTO$$$$","1"
"101585","12","I","Ribaltamento Classificazione Voci ep sull'esercizio 2018. Lock tabella CLASSIFICAZIONE_VOCI_EP","NULL","NULL","2018-01-08T14:48:49.000","2018-01-08T14:48:49.000","$$$$RIBALTAMENTO$$$$","$$$$RIBALTAMENTO$$$$","1"
"101585","13","I","Ribaltamento associazione fra categoria inventariale e voce del piano economico","NULL","NULL","2018-01-08T14:48:51.000","2018-01-08T14:48:51.000","$$$$RIBALTAMENTO$$$$","$$$$RIBALTAMENTO$$$$","1"
"101585","14","I","Ribaltamento associazione CNR_ASS_CONTO_GRUPPO_EP","NULL","NULL","2018-01-08T14:48:52.000","2018-01-08T14:48:52.000","$$$$RIBALTAMENTO$$$$","$$$$RIBALTAMENTO$$$$","1"
"101585","15","I","Ribaltamento associazioni tipo cori ed EV sull'esercizio 2018. Lock tabella ASS_TIPO_CORI_EV","NULL","NULL","2018-01-08T14:48:52.000","2018-01-08T14:48:52.000","$$$$RIBALTAMENTO$$$$","$$$$RIBALTAMENTO$$$$","1"
"101585","16","I","Ribaltamento associazione tipo cori e conto EP sull'esercizio 2018. Lock tabella ASS_TIPO_CORI_VOCE_EP","NULL","NULL","2018-01-08T14:48:52.000","2018-01-08T14:48:52.000","$$$$RIBALTAMENTO$$$$","$$$$RIBALTAMENTO$$$$","1"
"101585","17","I","Inserimento delle FIRME per l'esercizio base 2018. Lock tabella FIRME","NULL","NULL","2018-01-08T14:48:52.000","2018-01-08T14:48:52.000","$$$$RIBALTAMENTO$$$$","$$$$RIBALTAMENTO$$$$","1"
"101585","18","I","Ribaltamento record con Pk (999,2017,999.000,0) in LIQUID_CORI sull'esercizio 2018. Lock tabella LIQUID_CORI","NULL","NULL","2018-01-08T14:48:52.000","2018-01-08T14:48:52.000","$$$$RIBALTAMENTO$$$$","$$$$RIBALTAMENTO$$$$","1"
