"pg_esecuzione","pg_riga","ti_messaggio","messaggio","trace","note","dacr","duva","utcr","utuv","pg_ver_rec"
"101573","1","E","Lo script di ribaltamento per il PDGP ט giא stato eseguito con successo per l'esercizio 2018: non ט possibile eseguirlo nuovamente.","NULL","NULL","2018-01-08T12:10:12.000","2018-01-08T12:10:12.000","$$$$RIBALTAMENTO$$$$","$$$$RIBALTAMENTO$$$$","1"
"101573","2","E","Errore non gestito: ORA-20020: Lo script di ribaltamento per il PDGP ט giא stato eseguito con successo per l'esercizio 2018: non ט possibile eseguirlo nuovamente.
","NULL","NULL","2018-01-08T12:10:12.000","2018-01-08T12:10:12.000","$$$$RIBALTAMENTO$$$$","$$$$RIBALTAMENTO$$$$","1"
"101582","65","W","CONFIGURAZIONE_CNR con PK(2018, *, LINEA_ATTIVITA_SPECIALE, LINEA_VERSAMENTO_IVA_SAC) già esistente","NULL","NULL","2018-01-08T14:09:04.000","2018-01-08T14:09:04.000","$$$$RIBALTAMENTO$$$$","$$$$RIBALTAMENTO$$$$","1"
"101582","66","W","CONFIGURAZIONE_CNR con PK(2018, *, COSTANTI, BLACKLIST) già esistente","NULL","NULL","2018-01-08T14:09:04.000","2018-01-08T14:09:04.000","$$$$RIBALTAMENTO$$$$","$$$$RIBALTAMENTO$$$$","1"
"101582","67","W","CONFIGURAZIONE_CNR con PK(2018, *, BILANCIO_ENTE, AVANZO) già esistente","NULL","NULL","2018-01-08T14:09:04.000","2018-01-08T14:09:04.000","$$$$RIBALTAMENTO$$$$","$$$$RIBALTAMENTO$$$$","1"
"101582","68","W","CONFIGURAZIONE_CNR con PK(2018, *, BILANCIO_ENTE, FONDO_CASSA) già esistente","NULL","NULL","2018-01-08T14:09:04.000","2018-01-08T14:09:04.000","$$$$RIBALTAMENTO$$$$","$$$$RIBALTAMENTO$$$$","1"
"101582","69","W","CONFIGURAZIONE_CNR con PK(2018, *, FONDO_ECONOMALE, REINTEGRO_OBBLIGATORIO) già esistente","NULL","NULL","2018-01-08T14:09:04.000","2018-01-08T14:09:04.000","$$$$RIBALTAMENTO$$$$","$$$$RIBALTAMENTO$$$$","1"
"101582","70","W","CONFIGURAZIONE_CNR con PK(2018, *, ORDINI, IMPEGNO_ORDINI_UO_DEST) già esistente","NULL","NULL","2018-01-08T14:09:04.000","2018-01-08T14:09:04.000","$$$$RIBALTAMENTO$$$$","$$$$RIBALTAMENTO$$$$","1"
"101582","71","W","CONFIGURAZIONE_CNR con PK(2018, *, ORDINI, ORDINI_AUT_ROTTURA_UO_DEST) già esistente","NULL","NULL","2018-01-08T14:09:04.000","2018-01-08T14:09:04.000","$$$$RIBALTAMENTO$$$$","$$$$RIBALTAMENTO$$$$","1"
"101582","72","W","CONFIGURAZIONE_CNR con PK(2018, *, BASE_DEDUZIONE_IRPEF, QUOTE_DEDUZIONE) già esistente","NULL","NULL","2018-01-08T14:09:04.000","2018-01-08T14:09:04.000","$$$$RIBALTAMENTO$$$$","$$$$RIBALTAMENTO$$$$","1"
"101582","73","W","CONFIGURAZIONE_CNR con PK(2018, *, BASE_DEDUZIONE_IRPEF, VALORE_BASE) già esistente","NULL","NULL","2018-01-08T14:09:04.000","2018-01-08T14:09:04.000","$$$$RIBALTAMENTO$$$$","$$$$RIBALTAMENTO$$$$","1"
"101582","74","W","CONFIGURAZIONE_CNR con PK(2018, *, CODICE_SIOPE_DEFAULT, MANDATO_ACCREDITAMENTO) già esistente","NULL","NULL","2018-01-08T14:09:04.000","2018-01-08T14:09:04.000","$$$$RIBALTAMENTO$$$$","$$$$RIBALTAMENTO$$$$","1"
"101582","75","W","CONFIGURAZIONE_CNR con PK(2018, *, GESTIONE_IVA, ATTIVA_PRORATA) già esistente","NULL","NULL","2018-01-08T14:09:04.000","2018-01-08T14:09:04.000","$$$$RIBALTAMENTO$$$$","$$$$RIBALTAMENTO$$$$","1"
"101582","76","W","CONFIGURAZIONE_CNR con PK(2018, *, VOCEEP_SPECIALE, RATEI_PASSIVI) già esistente","NULL","NULL","2018-01-08T14:09:04.000","2018-01-08T14:09:04.000","$$$$RIBALTAMENTO$$$$","$$$$RIBALTAMENTO$$$$","1"
"101582","77","W","CONFIGURAZIONE_CNR con PK(2018, *, VOCEEP_SPECIALE, RATEI_ATTIVI) già esistente","NULL","NULL","2018-01-08T14:09:04.000","2018-01-08T14:09:04.000","$$$$RIBALTAMENTO$$$$","$$$$RIBALTAMENTO$$$$","1"
"101582","78","W","CONFIGURAZIONE_CNR con PK(2018, *, VOCEEP_SPECIALE, RISCONTI_PASSIVI) già esistente","NULL","NULL","2018-01-08T14:09:04.000","2018-01-08T14:09:04.000","$$$$RIBALTAMENTO$$$$","$$$$RIBALTAMENTO$$$$","1"
"101582","79","W","CONFIGURAZIONE_CNR con PK(2018, *, VOCEEP_SPECIALE, RISCONTI_ATTIVI) già esistente","NULL","NULL","2018-01-08T14:09:04.000","2018-01-08T14:09:04.000","$$$$RIBALTAMENTO$$$$","$$$$RIBALTAMENTO$$$$","1"
"101582","80","W","CONFIGURAZIONE_CNR con PK(2018, *, VOCEEP_SPECIALE, SOPRAVVENIENZE_PASSIVE) già esistente","NULL","NULL","2018-01-08T14:09:04.000","2018-01-08T14:09:04.000","$$$$RIBALTAMENTO$$$$","$$$$RIBALTAMENTO$$$$","1"
"101582","81","W","CONFIGURAZIONE_CNR con PK(2018, *, VOCEEP_SPECIALE, SOPRAVVENIENZE_ATTIVE) già esistente","NULL","NULL","2018-01-08T14:09:04.000","2018-01-08T14:09:04.000","$$$$RIBALTAMENTO$$$$","$$$$RIBALTAMENTO$$$$","1"
"101582","82","W","CONFIGURAZIONE_CNR con PK(2018, *, VOCEEP_SPECIALE, UTILE_PERDITA_ESERCIZIO) già esistente","NULL","NULL","2018-01-08T14:09:04.000","2018-01-08T14:09:04.000","$$$$RIBALTAMENTO$$$$","$$$$RIBALTAMENTO$$$$","1"
"101582","83","W","CONFIGURAZIONE_CNR con PK(2018, *, VOCEEP_SPECIALE, STATO_PATRIMONIALE) già esistente","NULL","NULL","2018-01-08T14:09:04.000","2018-01-08T14:09:04.000","$$$$RIBALTAMENTO$$$$","$$$$RIBALTAMENTO$$$$","1"
"101582","84","W","CONFIGURAZIONE_CNR con PK(2018, *, VOCEEP_SPECIALE, CONTO_ECONOMICO) già esistente","NULL","NULL","2018-01-08T14:09:04.000","2018-01-08T14:09:04.000","$$$$RIBALTAMENTO$$$$","$$$$RIBALTAMENTO$$$$","1"
"101582","85","W","CONFIGURAZIONE_CNR con PK(2018, *, LIQUID_CORI, LOCALE_ATTIVA) già esistente","NULL","NULL","2018-01-08T14:09:04.000","2018-01-08T14:09:04.000","$$$$RIBALTAMENTO$$$$","$$$$RIBALTAMENTO$$$$","1"
"101582","86","W","CONFIGURAZIONE_CNR con PK(2018, *, VOCEEP_SPECIALE, INSUSSISTENZE_ATTIVE) già esistente","NULL","NULL","2018-01-08T14:09:04.000","2018-01-08T14:09:04.000","$$$$RIBALTAMENTO$$$$","$$$$RIBALTAMENTO$$$$","1"
"101582","87","W","CONFIGURAZIONE_CNR con PK(2018, *, VOCEEP_SPECIALE, INSUSSISTENZE_PASSIVE) già esistente","NULL","NULL","2018-01-08T14:09:04.000","2018-01-08T14:09:04.000","$$$$RIBALTAMENTO$$$$","$$$$RIBALTAMENTO$$$$","1"
"101582","88","W","CONFIGURAZIONE_CNR con PK(2018, *, CHIUSURA_COSTANTI, TERMINE_CREAZIONE_DOCAMM_ES_PREC) già esistente","NULL","NULL","2018-01-08T14:09:04.000","2018-01-08T14:09:04.000","$$$$RIBALTAMENTO$$$$","$$$$RIBALTAMENTO$$$$","1"
"101582","89","W","CONFIGURAZIONE_CNR con PK(2018, *, ELEMENTO_VOCE_SPECIALE, VOCE_APERTURA_FONDO_ECO) già esistente","NULL","NULL","2018-01-08T14:09:04.000","2018-01-08T14:09:04.000","$$$$RIBALTAMENTO$$$$","$$$$RIBALTAMENTO$$$$","1"
"101582","90","W","CONFIGURAZIONE_CNR con PK(2018, *, ELEMENTO_VOCE_SPECIALE, COMPENSAZIONE_CORI) già esistente","NULL","NULL","2018-01-08T14:09:04.000","2018-01-08T14:09:04.000","$$$$RIBALTAMENTO$$$$","$$$$RIBALTAMENTO$$$$","1"
"101582","91","W","CONFIGURAZIONE_CNR con PK(2018, *, VOCEF_SPECIALE, AVANZO_S_CNR) già esistente","NULL","NULL","2018-01-08T14:09:04.000","2018-01-08T14:09:04.000","$$$$RIBALTAMENTO$$$$","$$$$RIBALTAMENTO$$$$","1"
"101582","92","W","CONFIGURAZIONE_CNR con PK(2018, *, VOCEF_SPECIALE, AVANZO_E_CNR) già esistente","NULL","NULL","2018-01-08T14:09:04.000","2018-01-08T14:09:04.000","$$$$RIBALTAMENTO$$$$","$$$$RIBALTAMENTO$$$$","1"
"101582","93","W","CONFIGURAZIONE_CNR con PK(2018, *, VOCEF_SPECIALE, AVANZO_S_CDS) già esistente","NULL","NULL","2018-01-08T14:09:04.000","2018-01-08T14:09:04.000","$$$$RIBALTAMENTO$$$$","$$$$RIBALTAMENTO$$$$","1"
"101582","94","W","CONFIGURAZIONE_CNR con PK(2018, *, VOCEF_SPECIALE, AVANZO_E_CDS) già esistente","NULL","NULL","2018-01-08T14:09:04.000","2018-01-08T14:09:04.000","$$$$RIBALTAMENTO$$$$","$$$$RIBALTAMENTO$$$$","1"
"101582","95","W","CONFIGURAZIONE_CNR con PK(2018, *, ELEMENTO_VOCE_SPECIALE, CD_TITOLO_CAPITOLO_BIL_CNR_SAC) già esistente","NULL","NULL","2018-01-08T14:09:04.000","2018-01-08T14:09:04.000","$$$$RIBALTAMENTO$$$$","$$$$RIBALTAMENTO$$$$","1"
"101582","96","W","CONFIGURAZIONE_CNR con PK(2018, *, VOCEEP_SPECIALE, FATTURE_DA_RICEVERE) già esistente","NULL","NULL","2018-01-08T14:09:04.000","2018-01-08T14:09:04.000","$$$$RIBALTAMENTO$$$$","$$$$RIBALTAMENTO$$$$","1"
"101582","97","W","CONFIGURAZIONE_CNR con PK(2018, *, VOCEEP_SPECIALE, COSTO_IVA_NON_DETRAIBILE) già esistente","NULL","NULL","2018-01-08T14:09:04.000","2018-01-08T14:09:04.000","$$$$RIBALTAMENTO$$$$","$$$$RIBALTAMENTO$$$$","1"
"101582","98","W","CONFIGURAZIONE_CNR con PK(2018, *, VOCEEP_SPECIALE, RICAVO_IVA_NON_DETRAIBILE) già esistente","NULL","NULL","2018-01-08T14:09:04.000","2018-01-08T14:09:04.000","$$$$RIBALTAMENTO$$$$","$$$$RIBALTAMENTO$$$$","1"
"101582","99","W","CONFIGURAZIONE_CNR con PK(2018, *, VOCEEP_SPECIALE, COMMISSIONI_BANCARIE) già esistente","NULL","NULL","2018-01-08T14:09:04.000","2018-01-08T14:09:04.000","$$$$RIBALTAMENTO$$$$","$$$$RIBALTAMENTO$$$$","1"
"101582","100","W","CONFIGURAZIONE_CNR con PK(2018, *, VOCEEP_SPECIALE, PERDITA_SU_CAMBIO) già esistente","NULL","NULL","2018-01-08T14:09:04.000","2018-01-08T14:09:04.000","$$$$RIBALTAMENTO$$$$","$$$$RIBALTAMENTO$$$$","1"
"101582","101","W","CONFIGURAZIONE_CNR con PK(2018, *, VOCEEP_SPECIALE, CONTROPARTITA_MIGRAZIONE_BENI) già esistente","NULL","NULL","2018-01-08T14:09:04.000","2018-01-08T14:09:04.000","$$$$RIBALTAMENTO$$$$","$$$$RIBALTAMENTO$$$$","1"
"101582","102","W","CONFIGURAZIONE_CNR con PK(2018, *, VOCEEP_SPECIALE, PATRIMONIO_NETTO) già esistente","NULL","NULL","2018-01-08T14:09:04.000","2018-01-08T14:09:04.000","$$$$RIBALTAMENTO$$$$","$$$$RIBALTAMENTO$$$$","1"
"101582","103","W","CONFIGURAZIONE_CNR con PK(2018, *, BASE_DEDUZIONE_FAMILY, VALORE_BASE) già esistente","NULL","NULL","2018-01-08T14:09:04.000","2018-01-08T14:09:04.000","$$$$RIBALTAMENTO$$$$","$$$$RIBALTAMENTO$$$$","1"
"101582","104","W","CONFIGURAZIONE_CNR con PK(2018, *, BASE_DEDUZIONE_FAMILY, CONIUGE) già esistente","NULL","NULL","2018-01-08T14:09:04.000","2018-01-08T14:09:04.000","$$$$RIBALTAMENTO$$$$","$$$$RIBALTAMENTO$$$$","1"
"101582","105","W","CONFIGURAZIONE_CNR con PK(2018, *, BASE_DEDUZIONE_FAMILY, FIGLIO) già esistente","NULL","NULL","2018-01-08T14:09:04.000","2018-01-08T14:09:04.000","$$$$RIBALTAMENTO$$$$","$$$$RIBALTAMENTO$$$$","1"
"101580","1","I","Inserimento dell'esercizio base 2018. Lock tabella ESERCIZIO_BASE","NULL","NULL","2018-01-08T13:34:58.000","2018-01-08T13:34:58.000","$$$$RIBALTAMENTO$$$$","$$$$RIBALTAMENTO$$$$","1"
"101580","2","I","Inserimento dei Parametri CNR per l'esercizio base 2018. Lock tabella PARAMETRI_CNR","NULL","NULL","2018-01-08T13:34:58.000","2018-01-08T13:34:58.000","$$$$RIBALTAMENTO$$$$","$$$$RIBALTAMENTO$$$$","1"
"101580","3","I","Inserimento dell'esercizio contabile 2018 per l'ente. Lock tabelle ESERCIZIO, NUMERAZIONE_DOC_CONT","NULL","NULL","2018-01-08T13:34:58.000","2018-01-08T13:34:58.000","$$$$RIBALTAMENTO$$$$","$$$$RIBALTAMENTO$$$$","1"
"101580","4","W","Esercizio contabile 2018 per l'ente giא esistente","NULL","NULL","2018-01-08T13:34:58.000","2018-01-08T13:34:58.000","$$$$RIBALTAMENTO$$$$","$$$$RIBALTAMENTO$$$$","1"
"101580","5","E","Errore non gestito: ORA-02291: restrizione di integrità violata (PCIR009.FK_NUMERAZIONE_DOC_CONT00) - chiave madre non trovata
","NULL","NULL","2018-01-08T13:34:58.000","2018-01-08T13:34:58.000","$$$$RIBALTAMENTO$$$$","$$$$RIBALTAMENTO$$$$","1"
"101582","139","I","Ribaltamento Dipartimento peso sull'esercizio 2018. Lock tabella Dipartimento_peso","NULL","NULL","2018-01-08T14:09:04.000","2018-01-08T14:09:04.000","$$$$RIBALTAMENTO$$$$","$$$$RIBALTAMENTO$$$$","1"
"101582","140","I","Creazione di ASS_UO_AREA per l'esercizio contabile 2018 per le UO valide. Lock tabella ASS_UO_AREA.","NULL","NULL","2018-01-08T14:09:04.000","2018-01-08T14:09:04.000","$$$$RIBALTAMENTO$$$$","$$$$RIBALTAMENTO$$$$","1"
"101582","141","I","Creazione di ASS_DIPARTIMENTO_AREA per l'esercizio contabile 2018 per le Aree valide. Lock tabella ASS_DIPARTIMENTO_AREA.","NULL","NULL","2018-01-08T14:09:04.000","2018-01-08T14:09:04.000","$$$$RIBALTAMENTO$$$$","$$$$RIBALTAMENTO$$$$","1"
"101582","142","I","Ribaltamento dei limiti di spesa sull'esercizio 2018. Lock tabella LIMITE_SPESA","NULL","NULL","2018-01-08T14:09:04.000","2018-01-08T14:09:04.000","$$$$RIBALTAMENTO$$$$","$$$$RIBALTAMENTO$$$$","1"
"101582","143","I","Ribaltamento per PDGP completato, ma con problemi - vedi BATCH_LOG_RIGA con pg_esecuzione 101582. Eseguito rollback.","NULL","NULL","2018-01-08T14:09:05.000","2018-01-08T14:09:05.000","$$$$RIBALTAMENTO$$$$","$$$$RIBALTAMENTO$$$$","1"
"101583","1","I","Inserimento dell'esercizio base 2018. Lock tabella ESERCIZIO_BASE","NULL","NULL","2018-01-08T14:10:56.000","2018-01-08T14:10:56.000","$$$$RIBALTAMENTO$$$$","$$$$RIBALTAMENTO$$$$","1"
"101583","2","I","Inserimento dei Parametri CNR per l'esercizio base 2018. Lock tabella PARAMETRI_CNR","NULL","NULL","2018-01-08T14:10:56.000","2018-01-08T14:10:56.000","$$$$RIBALTAMENTO$$$$","$$$$RIBALTAMENTO$$$$","1"
"101583","3","I","Inserimento dell'esercizio contabile 2018 per l'ente 999. Lock tabelle ESERCIZIO, NUMERAZIONE_DOC_CONT","NULL","NULL","2018-01-08T14:10:56.000","2018-01-08T14:10:56.000","$$$$RIBALTAMENTO$$$$","$$$$RIBALTAMENTO$$$$","1"
"101583","4","I","Inserimento di TIPO_VARIAZIONE per l'esercizio base 2018. Lock tabella TIPO_VARIAZIONE","NULL","NULL","2018-01-08T14:10:56.000","2018-01-08T14:10:56.000","$$$$RIBALTAMENTO$$$$","$$$$RIBALTAMENTO$$$$","1"
"101583","5","I","Ribaltamento Classificazioni Entrate sull'esercizio 2018. Lock tabella CLASSIFICAZIONE_ENTRATE","NULL","NULL","2018-01-08T14:10:56.000","2018-01-08T14:10:56.000","$$$$RIBALTAMENTO$$$$","$$$$RIBALTAMENTO$$$$","1"
"101583","6","I","Ribaltamento Classificazioni Spese sull'esercizio 2018. Lock tabella CLASSIFICAZIONE_SPESE","NULL","NULL","2018-01-08T14:10:56.000","2018-01-08T14:10:56.000","$$$$RIBALTAMENTO$$$$","$$$$RIBALTAMENTO$$$$","1"
"101583","7","I","Ribaltamento Parametri Livelli sull'esercizio 2018. Lock tabella PARAMETRI_LIVELLI","NULL","NULL","2018-01-08T14:10:56.000","2018-01-08T14:10:56.000","$$$$RIBALTAMENTO$$$$","$$$$RIBALTAMENTO$$$$","1"
"101583","8","I","Ribaltamento dell'anagrafica dei capitoli sull'esercizio 2018. Lock tabelle ELEMENTO_VOCE, VOCE_F, VOCE_F_SALDI_CMP","NULL","NULL","2018-01-08T14:10:56.000","2018-01-08T14:10:56.000","$$$$RIBALTAMENTO$$$$","$$$$RIBALTAMENTO$$$$","1"
"101583","9","I","Ribaltamento delle associazioni elementi voce, funzioni e tipologia di cds sull'esercizio 2018. Lock tabella ASS_EV_FUNZ_TIPOCDS","NULL","NULL","2018-01-08T14:10:56.000","2018-01-08T14:10:56.000","$$$$RIBALTAMENTO$$$$","$$$$RIBALTAMENTO$$$$","1"
"101583","10","I","Ribaltamento delle associazioni fra elementi voce sull'esercizio 2018. Lock tabella ASS_EV_EV","NULL","NULL","2018-01-08T14:10:56.000","2018-01-08T14:10:56.000","$$$$RIBALTAMENTO$$$$","$$$$RIBALTAMENTO$$$$","1"
"101583","11","I","Ribaltamento Classificazione Voci sull'esercizio 2018. Lock tabella CLASSIFICAZIONE_VOCI","NULL","NULL","2018-01-08T14:10:56.000","2018-01-08T14:10:56.000","$$$$RIBALTAMENTO$$$$","$$$$RIBALTAMENTO$$$$","1"
"101583","12","I","Ribaltamento configurazione CNR sull'esercizio 2018. Lock tabella CONFIGURAZIONE_CNR","NULL","NULL","2018-01-08T14:10:56.000","2018-01-08T14:10:56.000","$$$$RIBALTAMENTO$$$$","$$$$RIBALTAMENTO$$$$","1"
"101583","13","I","Creazione dell'esercizio contabile 2018 per i CDS e impostazione delle percentuali di copertura impegni. Lock tabelle ESERCIZIO, PRC_COPERTURA_OBBLIG, NUMERAZIONE_DOC_CONT.","NULL","NULL","2018-01-08T14:10:56.000","2018-01-08T14:10:56.000","$$$$RIBALTAMENTO$$$$","$$$$RIBALTAMENTO$$$$","1"
"101583","14","I","Inserimento esercizio contabile per CdS: 001","NULL","NULL","2018-01-08T14:10:56.000","2018-01-08T14:10:56.000","$$$$RIBALTAMENTO$$$$","$$$$RIBALTAMENTO$$$$","1"
"101583","15","I","Inserimento esercizio contabile per CdS: 000","NULL","NULL","2018-01-08T14:10:56.000","2018-01-08T14:10:56.000","$$$$RIBALTAMENTO$$$$","$$$$RIBALTAMENTO$$$$","1"
"101583","16","I","Creazione dei parametri CDS per l'esercizio contabile 2018 per i CDS validi. Lock tabella PARAMETRI_CDS.","NULL","NULL","2018-01-08T14:10:56.000","2018-01-08T14:10:56.000","$$$$RIBALTAMENTO$$$$","$$$$RIBALTAMENTO$$$$","1"
"101583","17","I","Creazione della tabella CHIUSURA_COEP per l'esercizio contabile 2018 per i CDS validi. Lock tabella CHIUSURA_COEP.","NULL","NULL","2018-01-08T14:10:56.000","2018-01-08T14:10:56.000","$$$$RIBALTAMENTO$$$$","$$$$RIBALTAMENTO$$$$","1"
"101583","18","I","Ribaltamento tabella di identificazione dei collegamenti tra conti di partita di giro su 2018. Lock tabella ASS_PARTITA_GIRO.","NULL","NULL","2018-01-08T14:10:56.000","2018-01-08T14:10:56.000","$$$$RIBALTAMENTO$$$$","$$$$RIBALTAMENTO$$$$","1"
"101583","19","I","Ribaltamento elenco dei CDS che sono gestiti in versamento via interfaccia sull'esercizio 2018. Lock tabella LIQUID_CORI_INTERF_CDS","NULL","NULL","2018-01-08T14:10:56.000","2018-01-08T14:10:56.000","$$$$RIBALTAMENTO$$$$","$$$$RIBALTAMENTO$$$$","1"
"101583","20","I","Ribaltamento elenco dei CDS che sono gestiti in versamento via interfaccia sull'esercizio 2018. Lock tabella LIQUID_IVA_INTERF_CDS","NULL","NULL","2018-01-08T14:10:56.000","2018-01-08T14:10:56.000","$$$$RIBALTAMENTO$$$$","$$$$RIBALTAMENTO$$$$","1"
"101583","21","I","Ribaltamento UO che hanno una gestione dell'IVA esterna sull'esercizio 2018. Lock tabella LIQUID_IVA_ESTERNA","NULL","NULL","2018-01-08T14:10:56.000","2018-01-08T14:10:56.000","$$$$RIBALTAMENTO$$$$","$$$$RIBALTAMENTO$$$$","1"
"101583","22","I","Ribaltamento Dipartimento peso sull'esercizio 2018. Lock tabella Dipartimento_peso","NULL","NULL","2018-01-08T14:10:56.000","2018-01-08T14:10:56.000","$$$$RIBALTAMENTO$$$$","$$$$RIBALTAMENTO$$$$","1"
"101583","23","I","Creazione di ASS_UO_AREA per l'esercizio contabile 2018 per le UO valide. Lock tabella ASS_UO_AREA.","NULL","NULL","2018-01-08T14:10:56.000","2018-01-08T14:10:56.000","$$$$RIBALTAMENTO$$$$","$$$$RIBALTAMENTO$$$$","1"
"101583","24","I","Creazione di ASS_DIPARTIMENTO_AREA per l'esercizio contabile 2018 per le Aree valide. Lock tabella ASS_DIPARTIMENTO_AREA.","NULL","NULL","2018-01-08T14:10:56.000","2018-01-08T14:10:56.000","$$$$RIBALTAMENTO$$$$","$$$$RIBALTAMENTO$$$$","1"
"101583","25","I","Ribaltamento dei limiti di spesa sull'esercizio 2018. Lock tabella LIMITE_SPESA","NULL","NULL","2018-01-08T14:10:56.000","2018-01-08T14:10:56.000","$$$$RIBALTAMENTO$$$$","$$$$RIBALTAMENTO$$$$","1"
"101583","26","I","Ribaltamento per PDGP completato con successo, verificare e eseguire commit","NULL","NULL","2018-01-08T14:10:56.000","2018-01-08T14:10:56.000","$$$$RIBALTAMENTO$$$$","$$$$RIBALTAMENTO$$$$","1"
"101584","1","E","Non è stato ancora eseguito il ribaltamento per il PDGP per l'esercizio 2013: non è possibile proseguire.","NULL","NULL","2018-01-08T14:47:58.000","2018-01-08T14:47:58.000","$$$$RIBALTAMENTO$$$$","$$$$RIBALTAMENTO$$$$","1"
"101584","2","E","Errore non gestito: ORA-20020: Non è stato ancora eseguito il ribaltamento per il PDGP per l'esercizio 2013: non è possibile proseguire.
","NULL","NULL","2018-01-08T14:47:58.000","2018-01-08T14:47:58.000","$$$$RIBALTAMENTO$$$$","$$$$RIBALTAMENTO$$$$","1"
"101585","1","I","Ribaltamento dell'anagrafica dei capitoli sull'esercizio 2018. Lock tabelle ELEMENTO_VOCE, VOCE_F, VOCE_F_SALDI_CMP","NULL","NULL","2018-01-08T14:48:49.000","2018-01-08T14:48:49.000","$$$$RIBALTAMENTO$$$$","$$$$RIBALTAMENTO$$$$","1"
"101585","2","I","Ribaltamento delle associazioni fra elementi voce sull'esercizio 2018. Lock tabella ASS_EV_EV","NULL","NULL","2018-01-08T14:48:49.000","2018-01-08T14:48:49.000","$$$$RIBALTAMENTO$$$$","$$$$RIBALTAMENTO$$$$","1"
"101574","1","E","Lo script di ribaltamento per il PDGP ט giא stato eseguito con successo per l'esercizio 2018: non ט possibile eseguirlo nuovamente.","NULL","NULL","2018-01-08T12:35:43.000","2018-01-08T12:35:43.000","$$$$RIBALTAMENTO$$$$","$$$$RIBALTAMENTO$$$$","1"
"101574","2","E","Errore non gestito: ORA-20020: Lo script di ribaltamento per il PDGP ט giא stato eseguito con successo per l'esercizio 2018: non ט possibile eseguirlo nuovamente.
","NULL","NULL","2018-01-08T12:35:43.000","2018-01-08T12:35:43.000","$$$$RIBALTAMENTO$$$$","$$$$RIBALTAMENTO$$$$","1"
"101578","1","I","Inserimento dell'esercizio base 2018. Lock tabella ESERCIZIO_BASE","NULL","NULL","2018-01-08T13:14:42.000","2018-01-08T13:14:42.000","$$$$RIBALTAMENTO$$$$","$$$$RIBALTAMENTO$$$$","1"
"101578","2","I","Inserimento dei Parametri CNR per l'esercizio base 2018. Lock tabella PARAMETRI_CNR","NULL","NULL","2018-01-08T13:14:42.000","2018-01-08T13:14:42.000","$$$$RIBALTAMENTO$$$$","$$$$RIBALTAMENTO$$$$","1"
"101578","3","W","Parametri CNR per l'esercizio base 2018 giא esistenti","NULL","NULL","2018-01-08T13:14:42.000","2018-01-08T13:14:42.000","$$$$RIBALTAMENTO$$$$","$$$$RIBALTAMENTO$$$$","1"
"101578","4","I","Inserimento dell'esercizio contabile 2018 per l'ente. Lock tabelle ESERCIZIO, NUMERAZIONE_DOC_CONT","NULL","NULL","2018-01-08T13:14:42.000","2018-01-08T13:14:42.000","$$$$RIBALTAMENTO$$$$","$$$$RIBALTAMENTO$$$$","1"
"101578","5","W","Esercizio contabile 2018 per l'ente giא esistente","NULL","NULL","2018-01-08T13:14:42.000","2018-01-08T13:14:42.000","$$$$RIBALTAMENTO$$$$","$$$$RIBALTAMENTO$$$$","1"
"101578","6","E","Errore non gestito: ORA-02291: restrizione di integrità violata (PCIR009.FK_NUMERAZIONE_DOC_CONT00) - chiave madre non trovata
","NULL","NULL","2018-01-08T13:14:42.000","2018-01-08T13:14:42.000","$$$$RIBALTAMENTO$$$$","$$$$RIBALTAMENTO$$$$","1"
"101582","106","W","CONFIGURAZIONE_CNR con PK(2018, *, BASE_DEDUZIONE_FAMILY, ALTRO) già esistente","NULL","NULL","2018-01-08T14:09:04.000","2018-01-08T14:09:04.000","$$$$RIBALTAMENTO$$$$","$$$$RIBALTAMENTO$$$$","1"
"101582","107","W","CONFIGURAZIONE_CNR con PK(2018, *, BASE_DEDUZIONE_FAMILY, FIGLIO_MENO_TRE) già esistente","NULL","NULL","2018-01-08T14:09:04.000","2018-01-08T14:09:04.000","$$$$RIBALTAMENTO$$$$","$$$$RIBALTAMENTO$$$$","1"
"101582","108","W","CONFIGURAZIONE_CNR con PK(2018, *, BASE_DEDUZIONE_FAMILY, FIGLIO_SENZA_CONIUGE) già esistente","NULL","NULL","2018-01-08T14:09:04.000","2018-01-08T14:09:04.000","$$$$RIBALTAMENTO$$$$","$$$$RIBALTAMENTO$$$$","1"
"101582","109","W","CONFIGURAZIONE_CNR con PK(2018, *, BASE_DEDUZIONE_FAMILY, FIGLIO_HANDICAP) già esistente","NULL","NULL","2018-01-08T14:09:04.000","2018-01-08T14:09:04.000","$$$$RIBALTAMENTO$$$$","$$$$RIBALTAMENTO$$$$","1"
"101582","110","W","CONFIGURAZIONE_CNR con PK(2018, *, PIANO_RIPARTO, IM_CF_AMM_IMMOBILI) già esistente","NULL","NULL","2018-01-08T14:09:04.000","2018-01-08T14:09:04.000","$$$$RIBALTAMENTO$$$$","$$$$RIBALTAMENTO$$$$","1"
"101582","111","W","CONFIGURAZIONE_CNR con PK(2018, *, ELEMENTO_VOCE_SPECIALE, VOCE_IVA_FATTURA_ESTERA) già esistente","NULL","NULL","2018-01-08T14:09:04.000","2018-01-08T14:09:04.000","$$$$RIBALTAMENTO$$$$","$$$$RIBALTAMENTO$$$$","1"
"101582","112","W","CONFIGURAZIONE_CNR con PK(2018, *, PIANO_RIPARTO, IM_CF_AMM_ATTREZZ) già esistente","NULL","NULL","2018-01-08T14:09:04.000","2018-01-08T14:09:04.000","$$$$RIBALTAMENTO$$$$","$$$$RIBALTAMENTO$$$$","1"
"101582","113","W","CONFIGURAZIONE_CNR con PK(2018, *, INVIO_MAIL_AUTO, TERZI_DA_CONGUAGLIARE) già esistente","NULL","NULL","2018-01-08T14:09:04.000","2018-01-08T14:09:04.000","$$$$RIBALTAMENTO$$$$","$$$$RIBALTAMENTO$$$$","1"
"101582","114","W","CONFIGURAZIONE_CNR con PK(2018, *, ELEMENTO_VOCE_SPECIALE, NETTO_DA_TRATTENERE) già esistente","NULL","NULL","2018-01-08T14:09:04.000","2018-01-08T14:09:04.000","$$$$RIBALTAMENTO$$$$","$$$$RIBALTAMENTO$$$$","1"
"101582","115","W","CONFIGURAZIONE_CNR con PK(2018, *, COSTANTI, MODELLO_INTRASTAT) già esistente","NULL","NULL","2018-01-08T14:09:04.000","2018-01-08T14:09:04.000","$$$$RIBALTAMENTO$$$$","$$$$RIBALTAMENTO$$$$","1"
"101582","116","W","CONFIGURAZIONE_CNR con PK(2018, *, ELEMENTO_VOCE_SPECIALE, VOCE_VERSAMENTO_IVA) già esistente","NULL","NULL","2018-01-08T14:09:04.000","2018-01-08T14:09:04.000","$$$$RIBALTAMENTO$$$$","$$$$RIBALTAMENTO$$$$","1"
"101582","117","W","CONFIGURAZIONE_CNR con PK(2018, *, ELEMENTO_VOCE_SPECIALE, FONDO_RISERVA_CDS) già esistente","NULL","NULL","2018-01-08T14:09:04.000","2018-01-08T14:09:04.000","$$$$RIBALTAMENTO$$$$","$$$$RIBALTAMENTO$$$$","1"
"101582","118","W","CONFIGURAZIONE_CNR con PK(2018, *, COSTANTI, MODELLO_INTRA_12) già esistente","NULL","NULL","2018-01-08T14:09:04.000","2018-01-08T14:09:04.000","$$$$RIBALTAMENTO$$$$","$$$$RIBALTAMENTO$$$$","1"
"101582","119","W","CONFIGURAZIONE_CNR con PK(2018, *, ELEMENTO_VOCE_SPECIALE, TITOLO_SPESE_FUNZIONAMENTO_CDS) già esistente","NULL","NULL","2018-01-08T14:09:04.000","2018-01-08T14:09:04.000","$$$$RIBALTAMENTO$$$$","$$$$RIBALTAMENTO$$$$","1"
"101582","120","W","CONFIGURAZIONE_CNR con PK(2018, *, VOCEEP_SPECIALE, INSUSSISTENZE_CREDITO) già esistente","NULL","NULL","2018-01-08T14:09:04.000","2018-01-08T14:09:04.000","$$$$RIBALTAMENTO$$$$","$$$$RIBALTAMENTO$$$$","1"
"101582","121","W","CONFIGURAZIONE_CNR con PK(2018, *, VOCEEP_SPECIALE, DEBITI_INIZIALI) già esistente","NULL","NULL","2018-01-08T14:09:04.000","2018-01-08T14:09:04.000","$$$$RIBALTAMENTO$$$$","$$$$RIBALTAMENTO$$$$","1"
"101582","122","W","CONFIGURAZIONE_CNR con PK(2018, *, VOCEEP_SPECIALE, CREDITI_INIZIALI) già esistente","NULL","NULL","2018-01-08T14:09:04.000","2018-01-08T14:09:04.000","$$$$RIBALTAMENTO$$$$","$$$$RIBALTAMENTO$$$$","1"
"101582","123","W","CONFIGURAZIONE_CNR con PK(2018, *, VOCEEP_SPECIALE, STATO_PATRIMONIALE_INIZIALE) già esistente","NULL","NULL","2018-01-08T14:09:04.000","2018-01-08T14:09:04.000","$$$$RIBALTAMENTO$$$$","$$$$RIBALTAMENTO$$$$","1"
"101582","124","W","CONFIGURAZIONE_CNR con PK(2018, *, VOCEEP_SPECIALE, FATTURE_DA_EMETTERE) già esistente","NULL","NULL","2018-01-08T14:09:04.000","2018-01-08T14:09:04.000","$$$$RIBALTAMENTO$$$$","$$$$RIBALTAMENTO$$$$","1"
"101582","125","W","CONFIGURAZIONE_CNR con PK(2018, *, CLASSIFICAZIONE_CORI_SPEC, CORI_STIP_EXTRA) già esistente","NULL","NULL","2018-01-08T14:09:04.000","2018-01-08T14:09:04.000","$$$$RIBALTAMENTO$$$$","$$$$RIBALTAMENTO$$$$","1"
"101582","126","W","CONFIGURAZIONE_CNR con PK(2018, *, LIQUID_CORI, CENTRO_ATTIVA) già esistente","NULL","NULL","2018-01-08T14:09:04.000","2018-01-08T14:09:04.000","$$$$RIBALTAMENTO$$$$","$$$$RIBALTAMENTO$$$$","1"
